restaurant_overall_rating,user_review_title,user_review,restaurant_name,user_num_reviews,user_helpful_reviews,user_review_date,user_location,restaurant_url,user_rating,restaurant_num_reviews,restaurant_location,user_name,restaurant_latitude,restaurant_longitude,user_latitude,user_longitude,user_restaurant_distance,user_is_local,user_review_length
3.5,Great Irish bar,"After a great dinner at The Dubliner, we strolled next door to Kelly's Irish Times. A much more casual atmosphere, the wall behind the bar was adorned with police and fire patches from all over the country. A solo guitar player did a great job of belting out old familiar tunes for the crowd. They do serve wings, pretzels, soups...


More",Kelly's Irish Times Pub,19,8,"December 29, 2014","Swansboro, North Carolina",/Restaurant_Review-g28970-d497601-Reviews-Kelly_s_Irish_Times_Pub-Washington_DC_District_of_Columbia.html,4.0,185,"Washington, DC",K M,38.8949549,-77.0366456,34.687662100000004,-77.1191166,290.15397607749344,False,339.0
3.5,So so: rundown - blah food,It felt old and worn. Food wasn't very good. Service was pretty good. We ate there because the line was too long at the Dubliner. Now I know why.,Kelly's Irish Times Pub,91,37,"December 22, 2014","Herndon, VA",/Restaurant_Review-g28970-d497601-Reviews-Kelly_s_Irish_Times_Pub-Washington_DC_District_of_Columbia.html,2.0,185,"Washington, DC",webbuzzard,38.8949549,-77.0366456,38.9695316,-77.3859479,19.510290339077986,True,145.0
3.5,Popular Place,"Nice Irish Pub and Restaurant. Food okay. Daily drink specials. Always crowded, so popular place due to location to Capitol and Union Station.",Kelly's Irish Times Pub,17,5,"December 7, 2014","Sacramento, California",/Restaurant_Review-g28970-d497601-Reviews-Kelly_s_Irish_Times_Pub-Washington_DC_District_of_Columbia.html,3.0,185,"Washington, DC",WorldTravelerTom,38.8949549,-77.0366456,38.561652,-121.4500282,2375.5333075990734,False,142.0
3.5,Great Pub and Food,"This was a move from next door. Two Irish Pub located together went in one and could not stand let alone set. I had my family with me so we went next door to Kelly. GREAT move. We were allowed to seat ourselves. Got seated. I had wife and child 7 with me. Service a little slow to see us...


More",Kelly's Irish Times Pub,27,9,"December 6, 2014",,/Restaurant_Review-g28970-d497601-Reviews-Kelly_s_Irish_Times_Pub-Washington_DC_District_of_Columbia.html,5.0,185,"Washington, DC",Jeremy O,38.8949549,-77.0366456,,,,,297.0
3.5,Great place to hangout for a few drinks,"Nice Irish Pub in the heart of Union Square, convenient to the Metro. Comfortable, unpretentious atmosphere with some nice outdoor seating, weather permitting. This also happens to be the post game hangout bar for the Washington DC Current (DC's professional Ultimate Frisbee team) players and fans. Good bar food, great drinks and fantastic, friendly bartenders and waitstaff. A great spot.",Kelly's Irish Times Pub,36,32,"December 2, 2014","Massachusetts, United States",/Restaurant_Review-g28970-d497601-Reviews-Kelly_s_Irish_Times_Pub-Washington_DC_District_of_Columbia.html,4.0,185,"Washington, DC",Mark E,38.8949549,-77.0366456,42.3788774,-72.03236600000002,356.2275603241646,False,391.0
3.5,Great neighborhood bar,Great place to stop by and join friends for a drink and good food. Very close to union station. Comfortable atmosphere with good specials.,Kelly's Irish Times Pub,78,24,"November 5, 2014","Jacksonville, Florida",/Restaurant_Review-g28970-d497601-Reviews-Kelly_s_Irish_Times_Pub-Washington_DC_District_of_Columbia.html,4.0,185,"Washington, DC",Traveler10531558,38.8949549,-77.0366456,30.3321838,-81.655651,646.0287497473273,False,138.0
3.5,light lunch,We visited at lunch time good food and friendly service good atmosphere would recommend a visit no more needs to be said,Kelly's Irish Times Pub,10,6,"October 27, 2014","Ashington, United Kingdom",/Restaurant_Review-g28970-d497601-Reviews-Kelly_s_Irish_Times_Pub-Washington_DC_District_of_Columbia.html,4.0,185,"Washington, DC",ianMate,38.8949549,-77.0366456,55.18229399999999,-1.5708473,3544.6174534084134,False,120.0
3.5,Great service,It was a very authentic feeling pub and the service was great. We had also eaten at the Dubliner next door and they are very different establishments. Kelly's felt like a more casual place. I would recommend both.,Kelly's Irish Times Pub,8,6,"September 30, 2014","Lincoln City, Oregon",/Restaurant_Review-g28970-d497601-Reviews-Kelly_s_Irish_Times_Pub-Washington_DC_District_of_Columbia.html,5.0,185,"Washington, DC",kjkillham,38.8949549,-77.0366456,44.958164399999994,-124.01789140000001,2422.5977735857746,False,213.0
3.5,Horrible,Waitress pointed us to a table then left us sitting there for ten minutes without a menu or drink. Place is a bit run down. We ended up leaving.,Kelly's Irish Times Pub,31,10,"September 16, 2014",Toronto,/Restaurant_Review-g28970-d497601-Reviews-Kelly_s_Irish_Times_Pub-Washington_DC_District_of_Columbia.html,1.0,185,"Washington, DC",chrisk1970a,38.8949549,-77.0366456,43.6529206,-79.3849008,350.3224729993701,False,144.0
3.5,Typical Irish Pub,"Bar food, nothing great nothing bad. Had to go to bar to get anything, I think they had 2 people working the floor on Sat night. They had some 10 specials, but no one in my group tried them.",Kelly's Irish Times Pub,34,16,"September 16, 2014","Saint Albans, West Virginia, USA",/Restaurant_Review-g28970-d497601-Reviews-Kelly_s_Irish_Times_Pub-Washington_DC_District_of_Columbia.html,4.0,185,"Washington, DC",419Bill,38.8949549,-77.0366456,38.3856488,-81.836241,261.9854710380067,False,190.0
3.5,"Loud, even on a ""quiet"" night","I have yet to encounter any Irish pub in the US that bears more than a very faint, passing resemblance to any actual pub I have been to in Ireland. Kelly's is typical of the US version but there's nothing wrong with that, as long as you know what to expect. Posters all over the walls, dark wood ambience, and...


More",Kelly's Irish Times Pub,16,10,"September 16, 2014","Silver City, New Mexico",/Restaurant_Review-g28970-d497601-Reviews-Kelly_s_Irish_Times_Pub-Washington_DC_District_of_Columbia.html,4.0,185,"Washington, DC",tchernabyelo,38.8949549,-77.0366456,32.7725053,-108.2793701,1794.6459414313003,False,319.0
3.5,When in DC do what the Irish do,"Came here to watch the World Cup games. The place was packed, but there were televisions all over the place. We enjoyed a very tasty Portabello mushroom sandwich.",Kelly's Irish Times Pub,39,14,"August 25, 2014","Roselle, Illinois",/Restaurant_Review-g28970-d497601-Reviews-Kelly_s_Irish_Times_Pub-Washington_DC_District_of_Columbia.html,4.0,185,"Washington, DC",martinigirlmina,38.8949549,-77.0366456,41.9847505,-88.07979329999998,619.4260443065456,False,162.0
3.5,terrible service,"I was not greeted at the door at 3:30-so I wondered if it was even open. Finally sat near the bar in order to be seen. Male server took my order and eventually brought me out the wrong beer (already opened) so I sent it back. Food came out, and was tasty-but nothing special-BBQ sliders. Had to get up to...


More",Kelly's Irish Times Pub,192,137,"August 18, 2014",Michigan,/Restaurant_Review-g28970-d497601-Reviews-Kelly_s_Irish_Times_Pub-Washington_DC_District_of_Columbia.html,2.0,185,"Washington, DC",50 states before I die,38.8949549,-77.0366456,43.6211955,-84.6824346,514.2960438895891,False,314.0
3.5,"Gritty, raw, wonderful","Kelly's Irish Times is a stripped-down, dingy, working class-style Irish pub and restaurant, with bad greasy food that's perfect for a healthy night of drinking with friends. Lots of memorabilia from politicians and police, and you can sit under portraits of Irish-American presidents JFK or Ronald Reagan - whatever suits you. Loud regular live music, too.
This is the Irish...


More",Kelly's Irish Times Pub,25,17,"August 14, 2014","Washington DC, District of Columbia",/Restaurant_Review-g28970-d497601-Reviews-Kelly_s_Irish_Times_Pub-Washington_DC_District_of_Columbia.html,4.0,185,"Washington, DC",Mike W,38.8949549,-77.0366456,38.8949549,-77.03664559999999,1.3688331711774772e-12,True,385.0
3.5,Good food -- enormous plates,"A all-around nice pub with huge plates of food (really good fish and chips and the bangers and mash was too big to finish) and good draft beer. Family-friendly, at least during the day. Helpful and friendly staff (even when very busy they kept checking in on tables) and conveniently close to Union Station.",Kelly's Irish Times Pub,59,47,"August 10, 2014",Bangalore,/Restaurant_Review-g28970-d497601-Reviews-Kelly_s_Irish_Times_Pub-Washington_DC_District_of_Columbia.html,5.0,185,"Washington, DC",pys11,38.8949549,-77.0366456,12.979119800000001,77.5912997,8506.429809517991,False,307.0
3.5,Fun little spot with pretty good food!,"Fun little place, me and a friend got some food and drinks here. It was a fun place to start the night off!",Kelly's Irish Times Pub,16,6,"August 4, 2014","Taylorsville, Utah",/Restaurant_Review-g28970-d497601-Reviews-Kelly_s_Irish_Times_Pub-Washington_DC_District_of_Columbia.html,4.0,185,"Washington, DC",AlyssiaandAndrew_UT,38.8949549,-77.0366456,40.667751700000004,-111.9386311,1849.6553020682243,False,107.0
3.5,Great Food but the Restaruant Needs Some Work,"We ate here, got a couple of reasonably priced sandwiches for lunch, and were not disappointed! The meat, toppings, and bread were all very tasty. You even get a choice of what kind of potato/salad you want with the sandwich. The service was also very friendly and helpful, despite being understaffed for rush hour.
The building is very old and...


More",Kelly's Irish Times Pub,74,31,"July 31, 2014","Topeka, Kansas",/Restaurant_Review-g28970-d497601-Reviews-Kelly_s_Irish_Times_Pub-Washington_DC_District_of_Columbia.html,4.0,185,"Washington, DC",Lenn B,38.8949549,-77.0366456,39.0490111,-95.6775557,1002.0765590406738,False,354.0
3.5,Ah the Irish ---,"WE had limited time and the service was quick, the food very tasty, and a folk singer was presenting as we were leaving. When it is done well, it is done well. I recommend Kelly's.",Kelly's Irish Times Pub,104,56,"July 26, 2014",Indiana,/Restaurant_Review-g28970-d497601-Reviews-Kelly_s_Irish_Times_Pub-Washington_DC_District_of_Columbia.html,5.0,185,"Washington, DC",jkle,38.8949549,-77.0366456,40.3270127,-86.1746933,497.28050891509434,False,180.0
3.5,Harp lager,I have visited the Kelly Irish Times and the Irish bar next door on several occasions. The service and food at both establishments are very good. Kelly's also has Irish music in one of their rooms.,Kelly's Irish Times Pub,88,35,"July 22, 2014",Limassol Cyprus,/Restaurant_Review-g28970-d497601-Reviews-Kelly_s_Irish_Times_Pub-Washington_DC_District_of_Columbia.html,4.0,185,"Washington, DC",SueKeo,38.8949549,-77.0366456,34.6735637,33.042341,5685.227322708239,False,197.0
3.5,Loved it,"The whole evening was wonderful. Noisy, vibrant and great fun.
Service was excellent. Just the right amount of time to look at the menu and then for the food to be served. Not kept waiting for any further drinks throughout the evening.
If you are in Washington, Go here",Kelly's Irish Times Pub,88,48,"July 4, 2014","Newton Abbot, United Kingdom",/Restaurant_Review-g28970-d497601-Reviews-Kelly_s_Irish_Times_Pub-Washington_DC_District_of_Columbia.html,5.0,185,"Washington, DC",nivekronnoco,38.8949549,-77.0366456,50.5296441,-3.6112097000000003,3550.625160965103,False,269.0
3.5,"Good service, so-so food","Nice old building. Not a lot of large tables - we were a party of 5. Only table available was in back by arcade games. The service was friendly and attentive. The food was average. Mac and cheese with corn beef was a little strange - think it was the cheese selection. Sliders were ok - sausage was the best,...


More",Kelly's Irish Times Pub,187,65,"July 1, 2014","Middletown, DE",/Restaurant_Review-g28970-d497601-Reviews-Kelly_s_Irish_Times_Pub-Washington_DC_District_of_Columbia.html,2.0,185,"Washington, DC",MyTravels033,38.8949549,-77.0366456,39.4415995,-75.72503748,79.89097324086542,False,318.0
3.5,Food and drinks,We ate here everyday on vacation! The cod and shrimp was fantastic! Irish stew was wonderful! Service was friendly and good. This place is a gem!,Kelly's Irish Times Pub,4,0,"June 24, 2014","Charlotte, North Carolina",/Restaurant_Review-g28970-d497601-Reviews-Kelly_s_Irish_Times_Pub-Washington_DC_District_of_Columbia.html,5.0,185,"Washington, DC",Debra U,38.8949549,-77.0366456,35.2270869,-80.8431268,328.9098342000259,False,145.0
3.5,"Good food, slow service.","This review is based upon a single visit, so it may not be completely representative of their service.
My wife, daughter and I had dinner here one evening during our family vacation to the northeast. We each had burgers. I had bleu cheese on mine; my wife and daughter opted for either American cheese or plain. The burger was good,...


More",Kelly's Irish Times Pub,68,19,"June 15, 2014","Sperry, Oklahoma",/Restaurant_Review-g28970-d497601-Reviews-Kelly_s_Irish_Times_Pub-Washington_DC_District_of_Columbia.html,3.0,185,"Washington, DC",WadeFromOklahoma,38.8949549,-77.0366456,36.29731339999999,-95.991386,1053.451132528059,False,342.0
3.5,Relaxing on the outside deck,"There is lots of seating inside but we enjoyed sitting outside in the sunshine. The food was good, as was the beer. We could see the train station from where we were sitting. Inside the decor was definitely Irish pub with wood and brass. Service was good, staff was friendly.",Kelly's Irish Times Pub,121,59,"June 12, 2014","Whitehorse, Canada",/Restaurant_Review-g28970-d497601-Reviews-Kelly_s_Irish_Times_Pub-Washington_DC_District_of_Columbia.html,4.0,185,"Washington, DC",Gertie68,38.8949549,-77.0366456,60.72067610000001,-135.05230790000002,2871.7853004691065,False,275.0
3.5,Meh.,"The bar had ""character""....by that I mean it was dark and dirty with bad music playing.
Didn't feel very welcomed either.
$6+ for a Guinness draft.
Won't be going back.",Kelly's Irish Times Pub,6,2,"June 2, 2014",somewhere in PA,/Restaurant_Review-g28970-d497601-Reviews-Kelly_s_Irish_Times_Pub-Washington_DC_District_of_Columbia.html,3.0,185,"Washington, DC",slugmama,38.8949549,-77.0366456,48.8440437,2.2934455,3838.940888861384,False,168.0
3.5,Pete Papageorge...Enough Said,"Apparently, one cannot go to Washington, DC, without visiting this bar. While the food is okay, it is Pete Papageorge who makes the experience memorable. As he only performs on most Friday and Saturday nights, be sure to check. Highly recommend.",Kelly's Irish Times Pub,60,24,"June 1, 2014",Merced,/Restaurant_Review-g28970-d497601-Reviews-Kelly_s_Irish_Times_Pub-Washington_DC_District_of_Columbia.html,5.0,185,"Washington, DC",AMACsMom,38.8949549,-77.0366456,37.3029568,-120.48432690000001,2348.05351098145,False,245.0
3.5,Post concert PUB time!,This is a no frills pub that caters to a younger crowd which I liked. The bartenders were attentive and friendly. Stopped in for cocktails after the National Memorial Concert and enjoyed the wind down.,Kelly's Irish Times Pub,79,27,"May 29, 2014",Catawba Island,/Restaurant_Review-g28970-d497601-Reviews-Kelly_s_Irish_Times_Pub-Washington_DC_District_of_Columbia.html,4.0,185,"Washington, DC",CatawbaCats,38.8949549,-77.0366456,41.564217,-82.8396329,357.78022428267445,False,201.0
3.5,Great find!,"Came upon this place while touring the area. I love finding neighborhood gems, and this definitely qualifies. Fun atmosphere, great food, knowledgeable and friendly staff.",Kelly's Irish Times Pub,12,4,"April 17, 2014","Oshkosh, Wisconsin",/Restaurant_Review-g28970-d497601-Reviews-Kelly_s_Irish_Times_Pub-Washington_DC_District_of_Columbia.html,5.0,185,"Washington, DC",bwhitney24,38.8949549,-77.0366456,44.0206919,-88.54085740000002,693.1899341482867,False,171.0
3.5,Great food,"Just had a terrific dinner here- nothing fancy, but delicious food and prompt, friendly service. Nice casual atmosphere. Have eaten here before and always come back for more. If you're looking for fine wine and fancy desserts, this probably isn't the place for you. But if you're in the mood for some great fish n' chips or pulled pork sliders...


More",Kelly's Irish Times Pub,158,70,"April 15, 2014","Lebanon, NJ",/Restaurant_Review-g28970-d497601-Reviews-Kelly_s_Irish_Times_Pub-Washington_DC_District_of_Columbia.html,4.0,185,"Washington, DC",ChiefRQ,38.8949549,-77.0366456,40.6417683,-74.8359987,168.06799267441275,False,353.0
3.5,Love this place,"Went several times during my recent visit. Just the kind of place I enjoy going to. Not corporate. Not pristine. Not sanitized. But, also, not a nasty dive. It's more of a ""lived in"" feeling, which I love. The beer selection suited my needs and the food was better than I expected.
One of the best Reubens I've had. Wife...


More",Kelly's Irish Times Pub,145,72,"April 15, 2014","Atlanta, GA",/Restaurant_Review-g28970-d497601-Reviews-Kelly_s_Irish_Times_Pub-Washington_DC_District_of_Columbia.html,4.0,185,"Washington, DC",RockyRaccoon,38.8949549,-77.0366456,33.749098700000005,-84.39018490000002,542.0876431866226,False,330.0
3.5,Total dump.,"We stumbled into Kelly's starving after a long drive. The first sign that we should have gone elsewhere was the young woman out front drinking from what appeared to be a trophy. Upon entering we had to go to the bar to ask to be seated. The server was MIA. The bartender came over and took our order. After we...


More",Kelly's Irish Times Pub,88,41,"April 14, 2014","Asbury Park, New Jersey",/Restaurant_Review-g28970-d497601-Reviews-Kelly_s_Irish_Times_Pub-Washington_DC_District_of_Columbia.html,1.0,185,"Washington, DC",ProffesionalReviewNJ,38.8949549,-77.0366456,40.2203907,-74.01208170000002,185.5889886186907,False,319.0
3.5,Loud and fun,"Close to Union Station, you can get a quick dinner of Corned Beef & Cabbage for a very reasonable price, then hop on a nighttime monument tour trolley.
The bar was jammed with what must have been locals getting out of work, but there was room at the tables to sit and eat. Their back-bar has an impressive array of...


More",Kelly's Irish Times Pub,50,20,"April 3, 2014","Charlotte, North Carolina",/Restaurant_Review-g28970-d497601-Reviews-Kelly_s_Irish_Times_Pub-Washington_DC_District_of_Columbia.html,4.0,185,"Washington, DC",steve49022,38.8949549,-77.0366456,35.2270869,-80.8431268,328.9098342000259,False,324.0
3.5,great for a beer and a snack after work,"Good bar, good service (but we are regulars) bar/fried snacks good. Sure its a little shabby around the edges (especially the bathrooms) but it kind of adds charm.",Kelly's Irish Times Pub,34,27,"March 18, 2014",Kent,/Restaurant_Review-g28970-d497601-Reviews-Kelly_s_Irish_Times_Pub-Washington_DC_District_of_Columbia.html,3.0,185,"Washington, DC",MrsP1968,38.8949549,-77.0366456,51.2244644,0.7334215000000001,3716.2634155852165,False,163.0
3.5,Always a favorite,"I always end up here at some point of my trips to DC. It is one of the favorites of our IBEW members, and a good place to run into others in our group who are in the general area.",Kelly's Irish Times Pub,80,23,"March 9, 2014","Lake Ozark, Missouri",/Restaurant_Review-g28970-d497601-Reviews-Kelly_s_Irish_Times_Pub-Washington_DC_District_of_Columbia.html,5.0,185,"Washington, DC",OnTheRoadWarrior,38.8949549,-77.0366456,38.1986436,-92.6387968,845.4822719379459,False,179.0
3.5,Irish delight,"This was a great casual place, very homey and comfortable. Service was nice, food was good, atmosphere interesting. Great for a Irish meal and a beer.",Kelly's Irish Times Pub,13,10,"March 4, 2014","Deer Park, New York",/Restaurant_Review-g28970-d497601-Reviews-Kelly_s_Irish_Times_Pub-Washington_DC_District_of_Columbia.html,4.0,185,"Washington, DC",P L,38.8949549,-77.0366456,40.7617653,-73.3292858,235.50615567242946,False,150.0
3.5,Enjoyed late lunch,"Enjoyed late lunch with draft smithwicks , fried shrimp, and Mac n cheese. Waiter Ty was very helpful in DC tourist suggestions. Good atmosphere and prices. Recommend for casual relaxed lunch.",Kelly's Irish Times Pub,3,1,"March 2, 2014","Tennessee, USA",/Restaurant_Review-g28970-d497601-Reviews-Kelly_s_Irish_Times_Pub-Washington_DC_District_of_Columbia.html,5.0,185,"Washington, DC",curious_re_cruises,38.8949549,-77.0366456,35.7730076,-86.28200809999998,552.4140984112231,False,192.0
3.5,could be better,"3 adults and 2 kids for dinner food was ok/good more like a late night bar type of place ,toilets need much improvement",Kelly's Irish Times Pub,10,4,"February 27, 2014",edinburgh,/Restaurant_Review-g28970-d497601-Reviews-Kelly_s_Irish_Times_Pub-Washington_DC_District_of_Columbia.html,3.0,185,"Washington, DC",martingardner12,38.8949549,-77.0366456,55.9483544,-3.1931187000000003,3470.149060246335,False,119.0
3.5,Hangout,"Positive, I liked my Grilled Cheese sandwich, salad dressing was good, stew was ok. Seems to be an after work drinking joint, which is what it is, just be prepared for noise, and crowd.
Negative, while We sat there eating by the kitchen I got grossed out by the uncleanliness. Watched the waitress pick up something off floor, dump old...


More",Kelly's Irish Times Pub,5,2,"February 14, 2014",,/Restaurant_Review-g28970-d497601-Reviews-Kelly_s_Irish_Times_Pub-Washington_DC_District_of_Columbia.html,2.0,185,"Washington, DC",Carrie W,38.8949549,-77.0366456,,,,,345.0
3.5,Chaos.,We stood by door for 20 mins waiting to be seated. We finally picked a table and sat down. Waited 30 before a waiter came around and said they needed the table. That ended our only trip to noisy atmosphere with poor hygiene.,Kelly's Irish Times Pub,11,8,"February 10, 2014",McAlester,/Restaurant_Review-g28970-d497601-Reviews-Kelly_s_Irish_Times_Pub-Washington_DC_District_of_Columbia.html,1.0,185,"Washington, DC",recluse_citadel,38.8949549,-77.0366456,34.9334981,-95.7697934,1070.4850753175417,False,224.0
3.5,Great for a quick drink after work,great beers and bar food. the sliders are quite scrumptious. as is the beer cheese. less pretentious than the other places in the neighborhood. but just as good. value for money. must try.,Kelly's Irish Times Pub,19,5,"February 7, 2014",singapore,/Restaurant_Review-g28970-d497601-Reviews-Kelly_s_Irish_Times_Pub-Washington_DC_District_of_Columbia.html,4.0,185,"Washington, DC",bharath_jairaj,38.8949549,-77.0366456,1.2904527,103.85203800000001,9664.483670762194,False,188.0
3.5,Bad experience,"Poor atmosphere with pro IRA posters prominent, toilets disgusting and service not great. Downmarket pub",Kelly's Irish Times Pub,70,16,"January 22, 2014","Basildon, United Kingdom",/Restaurant_Review-g28970-d497601-Reviews-Kelly_s_Irish_Times_Pub-Washington_DC_District_of_Columbia.html,2.0,185,"Washington, DC",B0bandJill,38.8949549,-77.0366456,51.5681417,0.4567960999999999,3697.2092179845617,False,104.0
3.5,Nice Irish pub in Downtown Washington,"Stopped by recently for lunch at the bar with my sister. I had a fish and chips, my sister had one of the daily specials. We both had Black & Tans to go along. The place is extremely nice as far a decor (traditional Irish, as you would expect), and the service was fantastic. You can't go wrong here!!!",Kelly's Irish Times Pub,59,19,"January 3, 2014","Chevy Chase, Maryland",/Restaurant_Review-g28970-d497601-Reviews-Kelly_s_Irish_Times_Pub-Washington_DC_District_of_Columbia.html,4.0,185,"Washington, DC",SerpaJ,38.8949549,-77.0366456,38.99320720000001,-77.0743833,7.075875162147823,True,302.0
3.5,OK bar food.,"We were staying at the Hyatt on Capitol Hill for the weekend so we walked down to Kelly's for dinner. My wife had the ham and cheese and I the corned beef on rye. Both were good for the price.
I would not get the onion rings again as I was up all night --maybe I should stay away from...


More",Kelly's Irish Times Pub,95,38,"December 28, 2013","Easton, Maryland",/Restaurant_Review-g28970-d497601-Reviews-Kelly_s_Irish_Times_Pub-Washington_DC_District_of_Columbia.html,3.0,185,"Washington, DC",Specman728,38.8949549,-77.0366456,38.7742826,-76.07633050000003,52.475281842479454,False,294.0
3.5,Fantastic bar near the Hill,"I've been to Kelly's several times, always with colleagues after work. It's a comfortable vibe. The music is great. The drinks are reasonably priced for DC. I would recommend!",Kelly's Irish Times Pub,8,3,"November 10, 2013","Strasbourg, France",/Restaurant_Review-g28970-d497601-Reviews-Kelly_s_Irish_Times_Pub-Washington_DC_District_of_Columbia.html,5.0,185,"Washington, DC",Samantha R,38.8949549,-77.0366456,48.584614,7.750712700000001,4074.997688061042,False,175.0
3.5,"If you want to have fun, STAY AWAY FROM HERE!!!!","Bad food, bartenders looked pissed and made the drinks badly. The atmosphere was horrible, dirty and the bathrooms were a complete mess. The manager was a rude guy. Definitely not coming here again!!",Kelly's Irish Times Pub,1,0,"November 4, 2013","Washington DC, District of Columbia",/Restaurant_Review-g28970-d497601-Reviews-Kelly_s_Irish_Times_Pub-Washington_DC_District_of_Columbia.html,1.0,185,"Washington, DC",Wi M,38.8949549,-77.0366456,38.8949549,-77.03664559999999,1.3688331711774772e-12,True,199.0
3.5,average food,"I ate here for lunch and dinner on the same day. I arrived after 2pm for lunch, so the place was quiet. However, it smelled like stale beer, and not in a pleasant way. Service was okay but the food was nothing special. It struck me as more of a local hangout (which is certainly fine).",Kelly's Irish Times Pub,64,59,"October 29, 2013","Greensboro, North Carolina",/Restaurant_Review-g28970-d497601-Reviews-Kelly_s_Irish_Times_Pub-Washington_DC_District_of_Columbia.html,3.0,185,"Washington, DC",scrappy56,38.8949549,-77.0366456,36.0726355,-79.79197540000001,246.57450339335395,False,285.0
