restaurant_overall_rating,user_review_title,user_review,restaurant_name,user_num_reviews,user_helpful_reviews,user_review_date,user_location,restaurant_url,user_rating,restaurant_num_reviews,restaurant_location,user_name,restaurant_latitude,restaurant_longitude,user_latitude,user_longitude,user_restaurant_distance,user_is_local,user_review_length
4.0,Disappointing,"Our food was not tasty and the service was terrible. We asked for something and the server disappeared and never brought it. We asked her again and again...when we saw her, which was rare. She never brought it. Finally we grabbed a busboy and asked him. We didn't eat there again and it did not look busy. What a shame....


More",Bistro 525,32,13,"May 9, 2014","San Diego, California",/Restaurant_Review-g28970-d3358297-Reviews-Bistro_525-Washington_DC_District_of_Columbia.html,2.0,30,"Washington, DC",60750WorldTraveler,38.8949549,-77.0366456,32.7174209,-117.1627714,2274.70115165904,False,329.0
4.0,Great Wait Staff,Good restaurant in the Washington Court Hotel! My sister and I ate breakfasts and one evening meal during our stay. The wait staff were very kind and the food was very good. The portions were large enough to share and the menu is affordable.,Bistro 525,29,5,"April 29, 2014","Eureka, Kansas, United States",/Restaurant_Review-g28970-d3358297-Reviews-Bistro_525-Washington_DC_District_of_Columbia.html,5.0,30,"Washington, DC",Janet G,38.8949549,-77.0366456,37.8239167,-96.2891703,1046.2480092023118,False,241.0
4.0,Great to have a good in hotel restaurant,"This restaurant is actually located inside the Washington Court Hotel. All the way in back of the lobby, it is tucked away in the corner but is easy to find once inside the hotel lobby. We stayed at the hotel and it was a nice bonus to have a good on site restaurant. I typically don't expect much from hotel...


More",Bistro 525,85,40,"January 23, 2014","Philadelphia, PA",/Restaurant_Review-g28970-d3358297-Reviews-Bistro_525-Washington_DC_District_of_Columbia.html,4.0,30,"Washington, DC",DPM67,38.8949549,-77.0366456,39.952335,-75.16378900000002,123.94015589510353,False,318.0
4.0,Awesome,Try the Salmon!! Amazing!! The atmosphere was quiet and romantic. Wine was great. Staff was nice. Fairly inexpensive for the area!! Definitely will be back.,Bistro 525,2,0,"December 12, 2013","Staunton, Virginia",/Restaurant_Review-g28970-d3358297-Reviews-Bistro_525-Washington_DC_District_of_Columbia.html,5.0,30,"Washington, DC",mark s,38.8949549,-77.0366456,38.14935,-79.07164559999998,121.67038401872226,False,156.0
4.0,i thought it would be a bust but it was great.,"i loved my entree and the whole experience.... this place doesnt have any hype, but I thogut it was great and I am accused of beeing a bit of a food snob.",Bistro 525,21,10,"November 20, 2013",punxsutawney pa,/Restaurant_Review-g28970-d3358297-Reviews-Bistro_525-Washington_DC_District_of_Columbia.html,5.0,30,"Washington, DC",averageguy_10,38.8949549,-77.0366456,40.9436303,-78.971078,174.74164905404027,False,154.0
4.0,Nice ambiance but the food doesn't match it,"Very courteous wait staff but unfortunately the food wasn't all that good. The tomato and olive salad had a few slices of anemic-looking tomato coupled with a few olives. For $12, I would expect more of an effort. The Maryland crab cake sandwich was good but the texture was especially mushy. Outstanding fries. Reasonably priced wine selection.",Bistro 525,113,31,"October 12, 2013","Omaha, Nebraska",/Restaurant_Review-g28970-d3358297-Reviews-Bistro_525-Washington_DC_District_of_Columbia.html,3.0,30,"Washington, DC",Deborah G,38.8949549,-77.0366456,41.25873170000001,-95.9378732,1012.8973147534746,False,345.0
4.0,Warmed over cafeteria food at premium prices,"Menu selection looked appetizing, but food was literally warmed over cafeteria servicing (think Costco entrees) at premium prices. No value at all, and food was mainstream bland..",Bistro 525,2,2,"October 10, 2013","Washington DC, District of Columbia",/Restaurant_Review-g28970-d3358297-Reviews-Bistro_525-Washington_DC_District_of_Columbia.html,1.0,30,"Washington, DC",Arguendo A,38.8949549,-77.0366456,38.8949549,-77.03664559999999,1.3688331711774772e-12,True,179.0
4.0,good breakfast buffet,I stayed at the Washington Court Hotel and went to this restaurant to have breakfast the day of my departure. The quality selection of food are good; no complaints at all.,Bistro 525,99,38,"September 30, 2013","Fredericksburg, Virginia",/Restaurant_Review-g28970-d3358297-Reviews-Bistro_525-Washington_DC_District_of_Columbia.html,3.0,30,"Washington, DC",tgd721,38.8949549,-77.0366456,38.30318370000001,-77.46053990000001,46.82553774790817,True,171.0
4.0,Offensively unaccomodating,"We were surprised by our experience because the restaurant seemed to have a number of good reviews, but after driving many hours and checking into the hotel, we attempted to eat here and were really put off by the manager who told us (in a rather rude way) why they couldn't accommodate vegetarians. They couldn't even offer to put together...


More",Bistro 525,217,73,"August 25, 2013","Bethlehem, Pennsylvania",/Restaurant_Review-g28970-d3358297-Reviews-Bistro_525-Washington_DC_District_of_Columbia.html,1.0,30,"Washington, DC",LGBTtraveler,38.8949549,-77.0366456,40.6178915,-75.3786521,148.06043413197904,False,350.0
4.0,"Good food, great service","Our family enjoyed a lovely meal here during the week. The staff is very attentive; we were definitely impressed by their service. Our meals were quite good and the menu has many choices to offer, especially for a picky child!",Bistro 525,17,8,"August 22, 2013","Yardley, Pennsylvania, United States",/Restaurant_Review-g28970-d3358297-Reviews-Bistro_525-Washington_DC_District_of_Columbia.html,4.0,30,"Washington, DC",Michaelene N,38.8949549,-77.0366456,40.245664,-74.84599720000001,149.53634298581392,False,226.0
4.0,"Relaxed breakfast, rather disappointing dinner","The bar and dining ""areas"" in the vast lobby of our Washington hotel, Hyatt Regency Capitol Hill, were far too tumultuous for us to enjoy a relaxed meal, so we retreated up the street a bit to the much more sedate Washington Court Hotel and its Bistro 525. We really liked the looks of the bar area here, as well,...


More",Bistro 525,193,216,"April 10, 2013","Toronto, Canada",/Restaurant_Review-g28970-d3358297-Reviews-Bistro_525-Washington_DC_District_of_Columbia.html,4.0,30,"Washington, DC",Torontotraveller2,38.8949549,-77.0366456,43.6529206,-79.3849008,350.3224729993701,False,323.0
4.0,No need to eat outside of Hotel,The lamb leg and ploughboy sandwich were both excellent and filling. Service can be a bit slow but wasn't a major concern.,Bistro 525,10,14,"April 1, 2013","Dundas, Canada",/Restaurant_Review-g28970-d3358297-Reviews-Bistro_525-Washington_DC_District_of_Columbia.html,4.0,30,"Washington, DC",Rogie L,38.8949549,-77.0366456,43.263975,-79.95351959999998,337.721787022751,False,122.0
4.0,Convenient in the Washington Court Hotel,"Service was good and the food was tasty. Wasn't really typical bar food, although served there. it came from the hotel's kitchen. A friend said the fries were great.",Bistro 525,50,35,"March 26, 2013","Pullman, Washington",/Restaurant_Review-g28970-d3358297-Reviews-Bistro_525-Washington_DC_District_of_Columbia.html,4.0,30,"Washington, DC",Glenn J,38.8949549,-77.0366456,46.7304268,-117.173895,2085.684780432676,False,165.0
4.0,Innovative and delicious,"The menu offerings were fresh and interesting, meals were well prepared and full of flavor. Prices were very reasonable considering the DC location....and the portions were generous as well (my daughter had the lemon basted chicken and it was a true half chicken). Nice wine selection with a variety of price points....attractive decor and good service.
All around a very...


More",Bistro 525,22,5,"February 25, 2013","Richmond, Virginia",/Restaurant_Review-g28970-d3358297-Reviews-Bistro_525-Washington_DC_District_of_Columbia.html,5.0,30,"Washington, DC",Steve S,38.8949549,-77.0366456,37.53850870000001,-77.4342799,96.02676126284274,False,381.0
4.0,"Bistro 525, Healthy and Good","The food here is tasty and well prepared with many healthy options for those who are heart-conscious, and enjoy fresh, low fat and low-cholesterol diets, but who don't want to give up on taste.",Bistro 525,33,42,"December 7, 2012","Marina del Rey, California",/Restaurant_Review-g28970-d3358297-Reviews-Bistro_525-Washington_DC_District_of_Columbia.html,4.0,30,"Washington, DC",D S,38.8949549,-77.0366456,33.97740170000001,-118.4508018,2312.201077418449,False,193.0
4.0,AMAZING!!,Great food and wonderful service! I stayed in hotel and had dinner here once. Very quiet and private feel. Great for a romantic dinner for two.,Bistro 525,41,15,"November 27, 2012","Virginia Beach, Virginia",/Restaurant_Review-g28970-d3358297-Reviews-Bistro_525-Washington_DC_District_of_Columbia.html,5.0,30,"Washington, DC",Alicia G,38.8949549,-77.0366456,36.7183708,-76.2466798,156.21186551993338,False,143.0
4.0,Not bad,"Ate here one nigth during our stay. Restaurant was empty. Service was ok, food was ok too. The crab soup was very good however. The rest of the meal was ok, steak was a little over cooked. Wine was good. They were out of a dessert, so they tried to emprovise, I give them credit for trying, but the dessert...


More",Bistro 525,102,64,"October 12, 2012","Washington DC, District of Columbia",/Restaurant_Review-g28970-d3358297-Reviews-Bistro_525-Washington_DC_District_of_Columbia.html,3.0,30,"Washington, DC",Rob_Gillis,38.8949549,-77.0366456,38.8949549,-77.03664559999999,1.3688331711774772e-12,True,316.0
4.0,Good hotel restaurant,I ate here while staying at the Washington Court Hotel. Very good breakfast buffet and very friendly staff. I would definitely eat here again.,Bistro 525,65,28,"September 26, 2012",South Puget Sound,/Restaurant_Review-g28970-d3358297-Reviews-Bistro_525-Washington_DC_District_of_Columbia.html,4.0,30,"Washington, DC",CathyLen,38.8949549,-77.0366456,47.8331514,-122.43458059999999,2331.9867945624314,False,142.0
4.0,Surprisingly good for a hotel restaurant,"I dined here on four occasions during my stay at the Washington Court Hotel. Breakfast was not included with the room, and I wanted to eat relatively healthy so I ate at the hotel rather than go across the street to Starbucks.
I didn't want to eat the buffet so ordered a la carte. There were many interesting choices on...


More",Bistro 525,135,58,"September 26, 2012",Bangkok,/Restaurant_Review-g28970-d3358297-Reviews-Bistro_525-Washington_DC_District_of_Columbia.html,5.0,30,"Washington, DC",DrMcinBKK,38.8949549,-77.0366456,13.5859219,100.4160866,8816.368239977715,False,330.0
4.0,A pleasant surprise,"Located in the Washington Court Hotel, we can recommend Bistro 525 to folks looking for a good meal in DC.
We are usually snobs and eschew restaurants located in hotels, but we made an exception because there was a nasty storm brewing and we had been out ""sightshopping"" all day and were tired and foot weary.
Glad we did. The...


More",Bistro 525,89,26,"September 5, 2012","Richmond, Virginia",/Restaurant_Review-g28970-d3358297-Reviews-Bistro_525-Washington_DC_District_of_Columbia.html,4.0,30,"Washington, DC",nigel'smom,38.8949549,-77.0366456,37.53850870000001,-77.4342799,96.02676126284274,False,336.0
3.5,Pleasant surprise,"We came here yesterday after zoo visit for lunch. We first thought it's a bar and there won't be any regular food but surprisingly they even had a kids menu ! We ordered a burger and chicken tenders for the toddler. The food was actually quite good and the guy who runs the place was quite friendly and nice ....


More",Zoo Bar Cafe,102,83,"October 7, 2015","Abu Dhabi, United Arab Emirates",/Restaurant_Review-g28970-d4727691-Reviews-Zoo_Bar_Cafe-Washington_DC_District_of_Columbia.html,5.0,21,"Washington, DC",EmilAlex,38.8949549,-77.0366456,24.4747961,54.3705762,7061.986799706706,False,319.0
3.5,Place to relax after the zoo,"The Zoo bar is right across to the main gate of the zoo (Connecticut Ave.) A very nice place to have cold beer or a glass of wine after the zoo, The place looks nice and clean with a nice old wooden bar. The menu is simple. I was there late afternoon for lunch on week day. I sat at...


More",Zoo Bar Cafe,238,73,"October 1, 2015","Washington DC, District of Columbia",/Restaurant_Review-g28970-d4727691-Reviews-Zoo_Bar_Cafe-Washington_DC_District_of_Columbia.html,4.0,21,"Washington, DC",Prawet J,38.8949549,-77.0366456,38.8949549,-77.03664559999999,1.3688331711774772e-12,True,292.0
3.5,Does the job nicely,"Adjacent to Washington Zoo - good place to try after a long walk around the zoo. No pretentious stuff here. Bar with standard eating options - pleasant service. Good burgers, salads etc. Enjoyable lunch.",Zoo Bar Cafe,129,38,"September 30, 2015",,/Restaurant_Review-g28970-d4727691-Reviews-Zoo_Bar_Cafe-Washington_DC_District_of_Columbia.html,4.0,21,"Washington, DC",99TedP61,38.8949549,-77.0366456,,,,,203.0
3.5,Ok but slow service,Food was quite good but slow service at the till. Some items need to wait to be made but others ready to eat.,Zoo Bar Cafe,347,145,"August 8, 2015",England,/Restaurant_Review-g28970-d4727691-Reviews-Zoo_Bar_Cafe-Washington_DC_District_of_Columbia.html,3.0,21,"Washington, DC",adam_nwuk,38.8949549,-77.0366456,52.7954791,-0.540240237,3630.61822620711,False,109.0
3.5,adequate,Had a salad was fresh nothing special but was nice and cool and the staff were friendly. Ate salad because they had quite few typical American unhealthy choices and I needed to eat and didn't want to keep looking.,Zoo Bar Cafe,25,9,"July 19, 2015",,/Restaurant_Review-g28970-d4727691-Reviews-Zoo_Bar_Cafe-Washington_DC_District_of_Columbia.html,3.0,21,"Washington, DC",Islandgirlislandgirl,38.8949549,-77.0366456,,,,,213.0
3.5,What a nice stop,"We stopped by here for lunch after a hot and crowded visit to the zoo. It was a normal bar restaurant atmosphere but the sunshine was beaming in the windows and it was friendly. We were greeted by ""the guy"" who might have been the owner. Our expectations of the food were not high. But when the food came, we...


More",Zoo Bar Cafe,24,5,"June 14, 2015",Salt Lake City,/Restaurant_Review-g28970-d4727691-Reviews-Zoo_Bar_Cafe-Washington_DC_District_of_Columbia.html,4.0,21,"Washington, DC",lexigirl99,38.8949549,-77.0366456,40.7670126,-111.8904308,1846.2390931376406,False,318.0
3.5,Pleasantly surprised,Typical bar setting but food was delicious. Chef salad was fresh with real turkey and ham instead of deli meat. Burger was favorable and cooked to order. Fresh cut fries were very good.,Zoo Bar Cafe,1,0,"June 10, 2015","Raleigh, North Carolina",/Restaurant_Review-g28970-d4727691-Reviews-Zoo_Bar_Cafe-Washington_DC_District_of_Columbia.html,4.0,21,"Washington, DC",nolazarn,38.8949549,-77.0366456,35.7804015,-78.6390779,232.19273986783782,False,185.0
3.5,Very Tasty,"After a morning at the zoo my family was hot and hungry. The cafe was conveniently located at the entrance of the zoo. We entered the cafe and were greeted and seated. The waiter was very nice and accommodating. The cafe is a very small hometown atmosphere in a huge city,very quaint! The food was outstanding with large portions.",Zoo Bar Cafe,38,21,"June 2, 2015",,/Restaurant_Review-g28970-d4727691-Reviews-Zoo_Bar_Cafe-Washington_DC_District_of_Columbia.html,5.0,21,"Washington, DC",Stargazerlily411,38.8949549,-77.0366456,,,,,330.0
3.5,It was OK,"The ladies in the ZOO welcome center recommended this place. It was a slightly late lunch. It was not crowded. Only one man taking orders. We were a little sketched, but starving. The food was good. They didn't get our order completely right, but we ate what they brought because we were in a hurry. He realized the order was...


More",Zoo Bar Cafe,61,38,"March 28, 2015",florida,/Restaurant_Review-g28970-d4727691-Reviews-Zoo_Bar_Cafe-Washington_DC_District_of_Columbia.html,3.0,21,"Washington, DC",fishheadflorida,38.8949549,-77.0366456,27.7567667,-81.4639835,808.9219264085541,False,335.0
3.5,Convienent Location & Friendly Service,"This is a little pub across from the zoo entrance. It looks like the kind of place that would have terrific soups/sandwiches a burgers served by a great character. Well they've got the great character server/bartender but the food was so so. large portions but nothing to write home about. If you're hungry and don't want zoo fast food this...


More",Zoo Bar Cafe,51,37,"March 27, 2015",Minneapolis,/Restaurant_Review-g28970-d4727691-Reviews-Zoo_Bar_Cafe-Washington_DC_District_of_Columbia.html,3.0,21,"Washington, DC",budget_travel_buff,38.8949549,-77.0366456,44.9772995,-93.2654692,933.4296463460747,False,350.0
3.5,Handy and delicious!,"We were famished after wandering the national zoo, and wanted to eat before going back to hotel. Walk out zoo gate on Connecticut Ave, and there's the Zoo Bar and Cafe. We wound up in a DC institution. Who knew? Hamburger was the right size, juicy, flavorful. Handcut fries were fresh and cooked to just a slight crispness. The beer...


More",Zoo Bar Cafe,45,28,"October 17, 2014","Harpers Ferry, West Virginia",/Restaurant_Review-g28970-d4727691-Reviews-Zoo_Bar_Cafe-Washington_DC_District_of_Columbia.html,5.0,21,"Washington, DC",123carolyn123,38.8949549,-77.0366456,39.323418,-77.7319766,47.645540458728696,True,342.0
3.5,Great Food!,We visit this restaurant every time we visit the zoo. Its right across the road from the zoos front entrance and has reasonable prices. I've never been disappointed in the food quality and I always enjoy my time there.,Zoo Bar Cafe,17,11,"October 5, 2014",,/Restaurant_Review-g28970-d4727691-Reviews-Zoo_Bar_Cafe-Washington_DC_District_of_Columbia.html,4.0,21,"Washington, DC",Charlie W,38.8949549,-77.0366456,,,,,218.0
3.5,Just Fine for a Quick Bite Before the Zoo,"We stopped into the Zoo Bar Cafe before going into the zoo, as it is directly across from the entrance. There are a few outdoor tables, a bar, and about a dozen tables inside. They have about 5 craft beers on tap, and about 8-10 more in bottles. The menu is typical pub fare. Our party had sandwiches, burgers, and...


More",Zoo Bar Cafe,73,35,"September 30, 2014","Columbia, Maryland",/Restaurant_Review-g28970-d4727691-Reviews-Zoo_Bar_Cafe-Washington_DC_District_of_Columbia.html,3.0,21,"Washington, DC",Marcy D,38.8949549,-77.0366456,39.2156213,-76.85820490000002,24.112677929293458,True,324.0
3.5,Look somewhere else.,"We had 3 adults, 2 children, and a baby and They added a high group gratuity to our bill. Food was not fresh, bread and chips were stale. Took too long to bring out food. Do not map quest for directions, it will take you to a dead end alley!",Zoo Bar Cafe,3,1,"April 13, 2014",,/Restaurant_Review-g28970-d4727691-Reviews-Zoo_Bar_Cafe-Washington_DC_District_of_Columbia.html,2.0,21,"Washington, DC",Shasti19,38.8949549,-77.0366456,,,,,241.0
3.5,Never Did Figure Out the Smell,"When you come out of the zoo at Connecticut Ave, the Zoo Bar Cafe is your first choice of places to eat. It's a very small narrow place and on the day we went it seemed to be doing mostly take-out for lunch. There was a stale odor to the place that I just couldn't identify and it looked like...


More",Zoo Bar Cafe,295,97,"March 13, 2014",Virginia,/Restaurant_Review-g28970-d4727691-Reviews-Zoo_Bar_Cafe-Washington_DC_District_of_Columbia.html,3.0,21,"Washington, DC",VEC24,38.8949549,-77.0366456,37.1232245,-78.4927721,145.75460982304784,False,302.0
3.5,Better than expected and reasonable price,"We dreaded eating at the zoo, so decided to wait. Glad we did! Great service, good food. Very reasonable prices. A win in our book.",Zoo Bar Cafe,47,19,"March 12, 2014","Dallas, Texas",/Restaurant_Review-g28970-d4727691-Reviews-Zoo_Bar_Cafe-Washington_DC_District_of_Columbia.html,4.0,21,"Washington, DC",B B,38.8949549,-77.0366456,32.7762719,-96.7968558,1183.8183629964524,False,131.0
3.5,It is convenient for adults visiting National Zoo,"We ate at the national zoo on the first visit, and food was terrible, and over priced. Second trip to the zoo we saw this little bar with outside seating just across from the main entrance. It isn't appropriate for children. Funky interior, and the man doing the bar came over to greet us as soon as we entered. Place...


More",Zoo Bar Cafe,108,85,"November 1, 2013","Bakersfield, California",/Restaurant_Review-g28970-d4727691-Reviews-Zoo_Bar_Cafe-Washington_DC_District_of_Columbia.html,4.0,21,"Washington, DC",nancypants911,38.8949549,-77.0366456,35.3738712,-119.0194639,2310.222790704886,False,327.0
3.5,Blues & Jazz from Thursday through Sunday,"Thursday is jam session. They have a house band & then others sit in & play their instruments or sing. Friday & Saturday nights, starting around 10 or 10:00 there are blues & jazz bands that play there once a month. No cover, but tips are encouraged. Fun!",Zoo Bar Cafe,3,0,"September 28, 2013","Washington, United Kingdom",/Restaurant_Review-g28970-d4727691-Reviews-Zoo_Bar_Cafe-Washington_DC_District_of_Columbia.html,5.0,21,"Washington, DC",beverlyroberts,38.8949549,-77.0366456,54.898614,-1.528827,3551.2802532001188,False,255.0
3.5,Just don't do it,"Very disappointing lunch here on a Friday in August. Right across from the zoo and conveniently located. It was actually the first place we saw when we exited the zoo, and the outside looked cute. Service was beyond horrible. Took forever to even be acknowledged or get drinks. After a very long wait, our food was delivered minus one person's...


More",Zoo Bar Cafe,15,8,"August 24, 2013","Boston, Massachusetts",/Restaurant_Review-g28970-d4727691-Reviews-Zoo_Bar_Cafe-Washington_DC_District_of_Columbia.html,1.0,21,"Washington, DC",Terri C,38.8949549,-77.0366456,42.3604823,-71.0595678,394.6971339457478,False,353.0
3.5,Hip decor - nice burger,Stumbled into this place on a rainy afternoon looking for a quick lunch. Escorted inside to a trendily decorated restaurant - pleasant service. Enjoyed good burger with flavousome fries - not a bad coffee either.,Red Apron Butcher Penn Quarter,129,38,"October 3, 2015",,/Restaurant_Review-g28970-d6639506-Reviews-Red_Apron_Butcher_Penn_Quarter-Washington_DC_District_of_Columbia.html,4.0,25,"Washington, DC",99TedP61,38.8949549,-77.0366456,,,,,212.0
3.5,Amazing! !!,"It is always difficult to find a place to eat with my daughter who has Celiac. We were starving and stopped here for lunch.
I had the burger, it was amazing! The fries were also great and because it was a clean froer my daughter could also have them.
We started referring to the burger as unicorn meat. It was...


More",Red Apron Butcher Penn Quarter,34,16,"September 30, 2015",Jacksonville,/Restaurant_Review-g28970-d6639506-Reviews-Red_Apron_Butcher_Penn_Quarter-Washington_DC_District_of_Columbia.html,5.0,25,"Washington, DC",Love2Go80,38.8949549,-77.0366456,30.3321838,-81.655651,646.0287497473273,False,319.0
3.5,Hip place to have drinks and nibbles with friends,"a hip place for an after work drink and snack ( you need to have something to eat if you want to have a table with your friends). Good wine selections and very good cocktails. Liked the atmosphere a lot- very stylish. If you want, you can get very good meat to take home for dinner at the butcher part...


More",Red Apron Butcher Penn Quarter,134,77,"September 15, 2015","Snoqualmie, Washington",/Restaurant_Review-g28970-d6639506-Reviews-Red_Apron_Butcher_Penn_Quarter-Washington_DC_District_of_Columbia.html,4.0,25,"Washington, DC",couplessPS,38.8949549,-77.0366456,47.53320720000001,-121.8434935,2305.0624794924693,False,311.0
3.5,Best steak I've had in years was purchased here!,Quality of the meat is excellent. We also like to pick up a charcuterie selection for parties at our home nearby. Sandwiches are a good choice for a picnic on the Mall. There are also a few outside tables in warm weather.,Red Apron Butcher Penn Quarter,158,70,"July 24, 2015","Columbia, Maryland",/Restaurant_Review-g28970-d6639506-Reviews-Red_Apron_Butcher_Penn_Quarter-Washington_DC_District_of_Columbia.html,4.0,25,"Washington, DC",Manningjen,38.8949549,-77.0366456,39.2156213,-76.85820490000002,24.112677929293458,True,221.0
3.5,Great meats and accoutrements,"I think it's hilarious when people complain about the price of something when they clearly saw the menu, ordered the food, went home, turned it into poo and got on with their lives. If you know that you're going to have a problem with the price regardless, then just don't order it because there are people working very passionately to...


More",Red Apron Butcher Penn Quarter,262,85,"July 14, 2015","Hyattsville, Maryland",/Restaurant_Review-g28970-d6639506-Reviews-Red_Apron_Butcher_Penn_Quarter-Washington_DC_District_of_Columbia.html,4.0,25,"Washington, DC",CaptainAwethume,38.8949549,-77.0366456,38.95325,-76.9408522,6.5432802608797855,True,345.0
3.5,"Good food, but guard your drink","The food was good, but the bartender confiscated my drink before I was finished. I tried to flag her down, but I was late for a Nationals' game. The menu is a little confusing, too.",Red Apron Butcher Penn Quarter,4,3,"June 25, 2015",,/Restaurant_Review-g28970-d6639506-Reviews-Red_Apron_Butcher_Penn_Quarter-Washington_DC_District_of_Columbia.html,3.0,25,"Washington, DC",Chris F,38.8949549,-77.0366456,,,,,181.0
