restaurant_overall_rating,user_review_title,user_review,restaurant_name,user_num_reviews,user_helpful_reviews,user_review_date,user_location,restaurant_url,user_rating,restaurant_num_reviews,restaurant_location,user_name,restaurant_latitude,restaurant_longitude,user_latitude,user_longitude,user_restaurant_distance,user_is_local,user_review_length
3.5,Can't I just buy a baguette?,"Long slow line; manager gave us a french loaf but wouldn't. ring it up at the empty cash register. Had to go back in line for the single slow cashier. After ten minutes gave him the bread back.
Miss madelaine but will just have to make do with whole food.
May be french quality but also french (in) efficiency.",PAUL Georgetown,95,49,"September 27, 2014","Washington DC, District of Columbia",/Restaurant_Review-g28970-d5223462-Reviews-PAUL_Georgetown-Washington_DC_District_of_Columbia.html,2.0,36,"Washington, DC",DC196,38.8949549,-77.0366456,38.8949549,-77.03664559999999,1.3688331711774772e-12,True,310.0
3.5,Thrilled to see Paul in Georgetown!,"I stumbled upon this wonderful French bakery while looking for a place to get a cup of tea and something for breakfast. Having been to Paris twice I was thrilled to find a Paul in Georgetown. The tea and croissant were delicious. I took my daughter the next morning for a sit down meal and it was incredibly disappointing. The...


More",PAUL Georgetown,17,11,"August 27, 2014",,/Restaurant_Review-g28970-d5223462-Reviews-PAUL_Georgetown-Washington_DC_District_of_Columbia.html,3.0,36,"Washington, DC",Barbara S,38.8949549,-77.0366456,,,,,336.0
3.5,45 minutes waiting!,Cold espresso. We waited 45 minutes for food. The service team had no idea. They walked arroud with no plan. Too pricy for the quality. Never again!!,PAUL Georgetown,1,1,"August 2, 2014",,/Restaurant_Review-g28970-d5223462-Reviews-PAUL_Georgetown-Washington_DC_District_of_Columbia.html,1.0,36,"Washington, DC",Zaher G,38.8949549,-77.0366456,,,,,149.0
3.5,Listen to the dude behind the counter,"I entered only wanting to pick up a croissant for tomorrow 's breakfast since it was close to closing time. But they have pretty hip young guys working there and he suggested I try the chocolate creme croissant. I am not a pudding fan and he assured me it wasn't the jello pudding stuff inside, so I took a chance....


More",PAUL Georgetown,80,29,"May 29, 2014","Washington DC, District of Columbia",/Restaurant_Review-g28970-d5223462-Reviews-PAUL_Georgetown-Washington_DC_District_of_Columbia.html,5.0,36,"Washington, DC",JanetMcE,38.8949549,-77.0366456,38.8949549,-77.03664559999999,1.3688331711774772e-12,True,324.0
3.5,Great French bakery cafe,"We had found several Paul's during trips to France and enjoyed their food so we very pleased to find one in Georgetown, DC during a hop on hop off bus trip around the city
We had intended to just buy a sandwich from the shop but found that they had a small restaurant upstairs. We were lucky to be seated...


More",PAUL Georgetown,130,71,"May 16, 2014","Boston, Massachusetts",/Restaurant_Review-g28970-d5223462-Reviews-PAUL_Georgetown-Washington_DC_District_of_Columbia.html,4.0,36,"Washington, DC",Joan C,38.8949549,-77.0366456,42.3604823,-71.0595678,394.6971339457478,False,314.0
3.5,Afternoon tea.,Called in out of the rain. Beautiful little tea rooms where its easy to while the time away over a pastry and coffee. Two coffees and 2 tarts came to 22$. Lovely treat.,PAUL Georgetown,73,43,"March 19, 2014","Carlow, Ireland",/Restaurant_Review-g28970-d5223462-Reviews-PAUL_Georgetown-Washington_DC_District_of_Columbia.html,4.0,36,"Washington, DC",creamybeamy,38.8949549,-77.0366456,52.84083440000001,-6.9261130999999985,3371.6448006792248,False,168.0
3.5,Great patisserie,"These must be the best croissants in D.C. The coffee is great too. This is why I am giving this cafe such a high rating. There are not many tables, and service is not great. Things seem to work best here if you order the coffee and croissant at the counter and then try to find a table.",PAUL Georgetown,78,58,"February 15, 2014","Westchester County, New York",/Restaurant_Review-g28970-d5223462-Reviews-PAUL_Georgetown-Washington_DC_District_of_Columbia.html,4.0,36,"Washington, DC",DW1499,38.8949549,-77.0366456,41.1763139,-73.7907554,233.22115886603592,False,286.0
3.5,"Quaint french bistro setting, but inattentive, inaccurate staff","Cool french bistro setting with patisserie downstairs and small dining room upstairs. Decor mixes french rustic and mismatched traditional. Sunday Brunch was a little crowded but not packed. Waiter made mistakes with order and had to asked for some things repeatedly. Service was too slow for the moderate volume of people. Food was good and not hugely overpriced as you...


More",PAUL Georgetown,9,6,"December 23, 2013","Philadelphia, Pennsylvania",/Restaurant_Review-g28970-d5223462-Reviews-PAUL_Georgetown-Washington_DC_District_of_Columbia.html,4.0,36,"Washington, DC",CMMinPhila,38.8949549,-77.0366456,39.952335,-75.16378900000002,123.94015589510353,False,380.0
3.5,Nah!,"Not to be compared with Paul in Beirut, dubai or Paris ,,,, the food was ok, the table dirty even after the waiter cleaned .... My table was opposite to their kitchen window, the cook was mixing the spinach and salmon with their bare hands: no gloves, nothing !!! Nooooo minimum hygiene !!!",PAUL Georgetown,68,31,"December 8, 2013","Dubai, United Arab Emirates",/Restaurant_Review-g28970-d5223462-Reviews-PAUL_Georgetown-Washington_DC_District_of_Columbia.html,2.0,36,"Washington, DC",Nicky025,38.8949549,-77.0366456,25.2683521,55.2961962,7052.37383145374,False,290.0
3.5,NO tea in this tea shop!,"Dying for a cup of tea and French fancy we chose Paul as I knew they were good from their cafés in Paris and London. Oh dear they'd run out of normal tea....!! Perhaps the manager could have shown a little initiative and gone around the corner to buy some supplies but no, they were 'waiting for a delivery' ...as...


More",PAUL Georgetown,32,21,"November 23, 2013",lewes,/Restaurant_Review-g28970-d5223462-Reviews-PAUL_Georgetown-Washington_DC_District_of_Columbia.html,3.0,36,"Washington, DC",Alison F,38.8949549,-77.0366456,50.8741265,0.0121129,3694.504717046159,False,324.0
3.5,They forgot my order completely!!!,"After we heard so much good about this place for breakfast. So we decided to go there to try on our last day in Washington. But we were very disappointed, first they delivered my husband's but completely forgotten mine till I asked then the food didn't even live up to its so called reputation. We left most of it and...


More",PAUL Georgetown,42,23,"November 21, 2013","London, United Kingdom",/Restaurant_Review-g28970-d5223462-Reviews-PAUL_Georgetown-Washington_DC_District_of_Columbia.html,1.0,36,"Washington, DC",PrettyEastSussex,38.8949549,-77.0366456,51.5073219,-0.1276474,3674.6806319924717,False,327.0
4.5,Great Bar!!!,"Great Bar!! Wonderful choice of good beers, and good place to drink with friends.
Just a few blocks north of the hustle and bustle of the sites and trendy big city bars.
Highly recommend!",The Saloon,2,0,"February 20, 2015","Vincennes, Indiana",/Restaurant_Review-g28970-d1221318-Reviews-The_Saloon-Washington_DC_District_of_Columbia.html,5.0,14,"Washington, DC",Tonywbushwacker,38.8949549,-77.0366456,38.6772691,-87.5286325,566.3370791393271,False,187.0
4.5,cool bar,"comfy bar with good selection of beer. A no nonsense attitude which is cool but also a bit ridiculous. ""We don't serve martinis"" ?!",The Saloon,10,5,"November 16, 2014",Ohio,/Restaurant_Review-g28970-d1221318-Reviews-The_Saloon-Washington_DC_District_of_Columbia.html,4.0,14,"Washington, DC",mark10Ohio,38.8949549,-77.0366456,40.2253569,-82.6881395,315.3714767413451,False,131.0
4.5,A reprieve from the bustle of U,"The Saloon is a non-profit bar that uses it's money to build food and homes in third world countries. Because of this rocking philanthropy, they close for a month or so every year - but the rest of the time it's a great, relatively quiet place to grab quality beer.
The bar has lots of quirky fun rules, no standing...


More",The Saloon,86,35,"November 13, 2014","Washington DC, District of Columbia",/Restaurant_Review-g28970-d1221318-Reviews-The_Saloon-Washington_DC_District_of_Columbia.html,4.0,14,"Washington, DC",nderiley,38.8949549,-77.0366456,38.8949549,-77.03664559999999,1.3688331711774772e-12,True,325.0
4.5,"Beer menu gets 5 stars, food was average","We ended up stopping here because of how crowded Ben's Chili Bowl was that night. This bar was on the hipster/pretentious side (who makes rules for a bar!), however the beer was worthy of some pretension. There was a wide selection of German and American beers and they pulled full pints which is nice. The food was average, it tasted...


More",The Saloon,22,9,"March 5, 2014","Charleston, West Virginia",/Restaurant_Review-g28970-d1221318-Reviews-The_Saloon-Washington_DC_District_of_Columbia.html,3.0,14,"Washington, DC",merideen,38.8949549,-77.0366456,38.3498221,-81.6326301,251.49642739954749,False,344.0
4.5,Come Again,"I passed by on the way to Ben's Chili Bowl, a ""DC landmark."" Since Ben's is cash only, and I carry no cash, the couldn't, wouldn't, serve me. Fortunately the Saloon is next door. I do not think I have ever been into a more accommodating establishment.
Note the rules and realize that your patronage is helping establish schools in...


More",The Saloon,30,8,"November 7, 2013","Kennewick, Washington",/Restaurant_Review-g28970-d1221318-Reviews-The_Saloon-Washington_DC_District_of_Columbia.html,5.0,14,"Washington, DC",TTommy69,38.8949549,-77.0366456,46.2112458,-119.1372338,2179.90653507866,False,340.0
4.5,Fun and great bar food!,"Great German bar with surprisingly good food. Overall, another fun experience on U Street. Our bartender was extremely friendly and helpful.",The Saloon,34,13,"November 2, 2013","Providence, Rhode Island",/Restaurant_Review-g28970-d1221318-Reviews-The_Saloon-Washington_DC_District_of_Columbia.html,4.0,14,"Washington, DC",TheByrdsTheWord,38.8949549,-77.0366456,41.8239891,-71.4128343,358.97703655267924,False,140.0
4.5,Great beer!,"The Saloon is a cozy little bar down a couple steps off U Street. They have very strict rules :-), so read the menu & walls so you don't get harangued by everyone - i.e. you HAVE to order drinks & wait for them to come before ordering food; no talking on cell phones; split checks get charged an extra...


More",The Saloon,11,0,"July 31, 2013","Arlington, Virginia",/Restaurant_Review-g28970-d1221318-Reviews-The_Saloon-Washington_DC_District_of_Columbia.html,4.0,14,"Washington, DC",WendieW10,38.8949549,-77.0366456,38.8903961,-77.0841585,2.580575353203579,True,311.0
4.5,4th of July at the National Mall,"I visited the Saloon with my parents, sister and good friend (I was visiting the latter two who live in DC but hadn't been to the bar before) to have a drink on our way out of Ben's Chili Bowl (supposedly a DC landmark that sadly does not offer alcoholic beverages). While the bartender (he seemed to have an accent...


More",The Saloon,34,6,"July 22, 2013","Philadelphia, Pennsylvania",/Restaurant_Review-g28970-d1221318-Reviews-The_Saloon-Washington_DC_District_of_Columbia.html,4.0,14,"Washington, DC",ehhviino,38.8949549,-77.0366456,39.952335,-75.16378900000002,123.94015589510353,False,325.0
4.5,A menu for Beer...top marks from me,"Looking for somewhere to have a quick drink before attending a gig at the U Street Music Hall, we found ourselves in The Saloon.
It has a quirky feel, with funny slogans on the wall, as well as information on the schools in third world and impoverished nations that your money is helping to pay for.
There was a very...


More",The Saloon,87,49,"June 14, 2013",England,/Restaurant_Review-g28970-d1221318-Reviews-The_Saloon-Washington_DC_District_of_Columbia.html,5.0,14,"Washington, DC",iwficon,38.8949549,-77.0366456,52.7954791,-0.540240237,3630.61822620711,False,326.0
4.5,GREAT BEER & BAR FOOD!,"We stopped in the Saloon for some libations after a busy day of sightseeing. The beer selection was excellent. We sat and relaxed and were never rushed. We order some wings, onion rings and hummus. The wings were delicious and had a tangy spicy sauce. The onion rings were absolutely delicious. I'd pass on the hummus.
A great place to...


More",The Saloon,15,7,"April 16, 2013","largo, fl",/Restaurant_Review-g28970-d1221318-Reviews-The_Saloon-Washington_DC_District_of_Columbia.html,5.0,14,"Washington, DC",gatormomlaura,38.8949549,-77.0366456,27.9094665,-82.7873244,826.3703970957561,False,345.0
4.5,unique,"The place does not open until about 4:00/ 5:00 pm, but was worth waiting for after traveling all day to DC.
It has the most incredible beer selections from all over the world I personally have ever experienced. They tell you right up front in the menu they don't ask for your food order right away, so that you take...


More",The Saloon,74,43,"September 29, 2012",montana,/Restaurant_Review-g28970-d1221318-Reviews-The_Saloon-Washington_DC_District_of_Columbia.html,5.0,14,"Washington, DC",realist1Montana,38.8949549,-77.0366456,47.3752671,-109.63875790000002,1733.9689897499795,False,325.0
4.5,Friendly and quirky!,Stopped by for a drink after dinner so we didn't eat. We tried some new beers and enjoyed the quirky atmosphere. Our waiter was welcoming and friendly. We were quite impressed with their pet project for building schools in third world countries. Nobody could argue with that!,The Saloon,87,47,"May 11, 2012","Ventura, California",/Restaurant_Review-g28970-d1221318-Reviews-The_Saloon-Washington_DC_District_of_Columbia.html,4.0,14,"Washington, DC",Diana5101,38.8949549,-77.0366456,34.364744,-119.3105822,2349.031237073398,False,275.0
4.5,great place to meet friends and talk,"Stopped in while waiting to meet friends and sat at the bar. They have a great beer selection and serve drafts in true half-liter glasses. There are no American bottles here, but plenty of good beers from other countries. I did not try the food. It has the feeling on a well traveled neighborhood bar and I would definitely return....


More",The Saloon,64,59,"April 5, 2012","Greensboro, North Carolina",/Restaurant_Review-g28970-d1221318-Reviews-The_Saloon-Washington_DC_District_of_Columbia.html,4.0,14,"Washington, DC",scrappy56,38.8949549,-77.0366456,36.0726355,-79.79197540000001,246.57450339335395,False,341.0
4.5,great beer-adequate food,"I love the warm cozy atmosphere of this casual downstairs bar, and the spirit which motivates the staff to close up once a year to go build schools in Afghanistan, devoting a percentage of revenue to support the costs of this good deed.
The beer selection is very special. The specialty is a one-year brewed strong beer, almost a liqueur,...


More",The Saloon,93,52,"November 19, 2011",Northwestern New Jersey,/Restaurant_Review-g28970-d1221318-Reviews-The_Saloon-Washington_DC_District_of_Columbia.html,4.0,14,"Washington, DC",EmptyNesterMom,38.8949549,-77.0366456,40.943372499999995,-74.66235970000002,189.4093245279612,False,348.0
4.0,Bolognaise - Ragu Ragu Ragu,"I went to this restaurant initially to see my friend Smitty, the new bartender. But I was so surprised by the food. The pasta is all homemade, the risotto delicious, but the bolognaise was superb. Nice pour for the drinks and great conversation and quite neighborly. Its a cozy place where the manager is there to welcome you and so...


More",M Cafe Bar,27,7,"November 13, 2014","Washington, D.C.",/Restaurant_Review-g28970-d4783905-Reviews-M_Cafe_Bar-Washington_DC_District_of_Columbia.html,5.0,15,"Washington, DC",slinde77,38.8949549,-77.0366456,36.29884975,-82.35919661,342.4862108550794,False,342.0
4.0,Great food! Went in just by chance,It was a Saturday night and we were walking up and down 14th street trying to decide on a restaurant. We happened to choose M and we were not disappointed. The service was very good and the food was excellent. I had Tortellacci with butternut squash & pumpkin seeds and ate every bit of it. I highly recommend this restaurant.,M Cafe Bar,35,19,"November 12, 2014","media, pa",/Restaurant_Review-g28970-d4783905-Reviews-M_Cafe_Bar-Washington_DC_District_of_Columbia.html,5.0,15,"Washington, DC",thealinda,38.8949549,-77.0366456,39.9167783,-75.387693,112.94339145864934,False,326.0
4.0,"Brunch, no waiting","We were in DC for a wedding and walked from our hotel at Thomas Circle. A friend had recommended at French place further up 14th but the wait was over an hour. We started walking back, having passed many other restaurants on our way, when we noticed the M Cafe Bar. It was not crowded, the menu out front was...


More",M Cafe Bar,13,7,"November 2, 2014","Pittsburgh, Pennsylvania",/Restaurant_Review-g28970-d4783905-Reviews-M_Cafe_Bar-Washington_DC_District_of_Columbia.html,5.0,15,"Washington, DC",NDubu,38.8949549,-77.0366456,40.4416941,-79.99008609999998,190.20109114526173,False,318.0
4.0,Very good Italian food!,"I loved the food, very close to an Italian experience! The lemon sorbet was just as I remember it in Positano this summer; the fish was very tasty, the vegetable accompanying it also. Good wine also, as recommended by the waiter. Overall good experience, would go again on a next trip to Washington, sincerely I don't understand why this restaurant...


More",M Cafe Bar,21,3,"October 25, 2014",Bucharest,/Restaurant_Review-g28970-d4783905-Reviews-M_Cafe_Bar-Washington_DC_District_of_Columbia.html,5.0,15,"Washington, DC",Catinca C,38.8949549,-77.0366456,44.436139,26.1027436,4969.584274626875,False,358.0
4.0,Great meal,"Our first night in Washington
And we stumbled across this well presented eatery. What a bonus! We had the house special osso bucco with risotto and the risotto funghi. It was delicious! The new manager Luis was welcoming and engaging and we were well looked after by the wait staff. We might try and get back there again if our...


More",M Cafe Bar,30,21,"October 7, 2014","Panania, Australia",/Restaurant_Review-g28970-d4783905-Reviews-M_Cafe_Bar-Washington_DC_District_of_Columbia.html,5.0,15,"Washington, DC",HorraP,38.8949549,-77.0366456,-33.9483333,151.0011111,9774.564954192885,False,337.0
4.0,delightful meal on muggy evening,"We chose an outside table on a warm night.
I enjoyed a salad and out-of-this-world duck. The recommended wine not only went well with the meals, but was not the most expensive one on the menu.
Our waiter was very attentive, but didn't intrude. His descriptions of food choices were very accurate.
The staff kept our water glasses replenished --...


More",M Cafe Bar,204,75,"July 28, 2014","SF, CA",/Restaurant_Review-g28970-d4783905-Reviews-M_Cafe_Bar-Washington_DC_District_of_Columbia.html,4.0,15,"Washington, DC",sfgardener,38.8949549,-77.0366456,37.7792768,-122.41927040000002,2440.8398793230926,False,354.0
4.0,Very bad,We decided to try as it seems to be like a nice place. The service was slow and bad. For the price i would go somewhere else and it seems like a kid's meal hahaha. We tried the salmon and the chefs special. Dont waste your money here,M Cafe Bar,24,14,"June 14, 2014","Paris, France",/Restaurant_Review-g28970-d4783905-Reviews-M_Cafe_Bar-Washington_DC_District_of_Columbia.html,1.0,15,"Washington, DC",Zach R,38.8949549,-77.0366456,48.85650560000001,2.3521334,3841.106843868132,False,233.0
4.0,Good and Reliable,"Been there twice already, once for brunch (good) and once for dinner (also good). Not spectacular but consistently good with decent choices and a good serving staff. The outside seating allows us to being our dog which makes this more attractive. A good addition to the up and coming 14th street.",M Cafe Bar,60,23,"May 14, 2014","Washington, DC",/Restaurant_Review-g28970-d4783905-Reviews-M_Cafe_Bar-Washington_DC_District_of_Columbia.html,4.0,15,"Washington, DC",DCNike,38.8949549,-77.0366456,38.8949549,-77.03664559999999,1.3688331711774772e-12,True,296.0
4.0,Cute place,Service was awesome. The ambiance is beautiful. I ordered the Risotto and it was undercooked. The wine pours are very small. Too pricey for undercooked Risotto. Might give them a 2nd chance...,M Cafe Bar,2,1,"April 27, 2014","Washington, District of Columbia, United States",/Restaurant_Review-g28970-d4783905-Reviews-M_Cafe_Bar-Washington_DC_District_of_Columbia.html,3.0,15,"Washington, DC",Ricardo V,38.8949549,-77.0366456,38.8949549,-77.03664559999999,1.3688331711774772e-12,True,192.0
4.0,"Good Food, Great Service","Dined here with a group to celebrate a friend's birthday and we all enjoyed our time here. As one of the newer restaurants on 14th street, we (all DC residents) wanted to try this place. We came later in the night so they weren't so busy anymore. We ordered appetizers for the table: cheese plate, salumi plate, fried calamari and...


More",M Cafe Bar,248,109,"January 28, 2014",Washington DC,/Restaurant_Review-g28970-d4783905-Reviews-M_Cafe_Bar-Washington_DC_District_of_Columbia.html,4.0,15,"Washington, DC",WashingtonJonDC,38.8949549,-77.0366456,38.8949549,-77.03664559999999,1.3688331711774772e-12,True,340.0
4.0,"service left much to be desired, but the foundation is there","My partner and I ate at M Cafe Bar for a Friday night date, and overall I felt it was a pretty good addition to the hip 14th Street restaurants, but it is clearly still working out the kinks.
First of all, it was packed when we arrived, so that's a good sign that there's buzz surrounding a new restaurant....


More",M Cafe Bar,489,320,"September 27, 2013",WashingtonDC,/Restaurant_Review-g28970-d4783905-Reviews-M_Cafe_Bar-Washington_DC_District_of_Columbia.html,3.0,15,"Washington, DC",jg325,38.8949549,-77.0366456,,,,,316.0
4.0,"New, Growing Pains but EXCELLENT Food","Open only 10 days, this is going to be one of THE spots on 14th Street! The best pasta we've had in years!
The octopus is to die for!
The staff is great! The management is matches the staff. They are also attentive and excellent.
Nice outside seating!
Nice private room for parties
WELL worth the reservation",M Cafe Bar,124,56,"September 3, 2013","Washington, DC",/Restaurant_Review-g28970-d4783905-Reviews-M_Cafe_Bar-Washington_DC_District_of_Columbia.html,4.0,15,"Washington, DC",HillTraveller,38.8949549,-77.0366456,38.8949549,-77.03664559999999,1.3688331711774772e-12,True,308.0
4.0,Splendid modern Italian addition to the 14th and U neighborhood,"We decided to try something different for our weekly 'night out' and were very impressed with this restaurant, open only since August 22. 14th Street has an embarrassing surplus of new places--all full almost from when they open--M Cafe/Bar is a worthy addition.
We were greeted warmly, and decided to sit inside near one of the big windows overlooking the...


More",M Cafe Bar,141,67,"September 2, 2013","Washington DC, District of Columbia",/Restaurant_Review-g28970-d4783905-Reviews-M_Cafe_Bar-Washington_DC_District_of_Columbia.html,4.0,15,"Washington, DC",boybanker,38.8949549,-77.0366456,38.8949549,-77.03664559999999,1.3688331711774772e-12,True,366.0
4.0,Good beers and burgers,"Four of us had beers and burgers at The Black Squirrel. The beers were great and they had a good variety. We were able try ten plus different beers and they were all pretty solid. The burgers were great and I am picky about burgers. Plus the sweet potato fries were good too. Our service was decent. I highly recommend...


More",The Black Squirrel,134,62,"September 13, 2015",Washington DC,/Restaurant_Review-g28970-d1051589-Reviews-The_Black_Squirrel-Washington_DC_District_of_Columbia.html,5.0,31,"Washington, DC",J J A,38.8949549,-77.0366456,38.8949549,-77.03664559999999,1.3688331711774772e-12,True,328.0
4.0,great hamburger,"Went to Dc 19th-21 of July. My wife and I had dinner at the Black Squirrel It was worth it . We stayed close to here so we walked . I had the hamburger And my wife had the fish and chips, both were excellent. We also had craft beer which they have a good selection",The Black Squirrel,43,7,"July 23, 2015","Munroe Falls, Ohio",/Restaurant_Review-g28970-d1051589-Reviews-The_Black_Squirrel-Washington_DC_District_of_Columbia.html,4.0,31,"Washington, DC",danc25,38.8949549,-77.0366456,41.1390358,-81.4400215,280.18479221502577,False,264.0
4.0,Great beers,"Great variety of beers, great location, fun atmosphere, fun croud. Food is a bar food, but very nice.",The Black Squirrel,30,6,"April 9, 2015","New York City, New York",/Restaurant_Review-g28970-d1051589-Reviews-The_Black_Squirrel-Washington_DC_District_of_Columbia.html,5.0,31,"Washington, DC",Barbara C,38.8949549,-77.0366456,40.730599100000006,-73.9865812,205.8262086077873,False,101.0
4.0,very disappointing,"After reading all the positives reviews here, I had dinner at the Black Squirrel tonight and was very disappointed. My order of chicken wings was undercooked and had to be sent back to the kitchen, the veggie burger was super plain, no flavor whatsoever. And the worst part: a side order of fries costs 11 $ at this place. The...


More",The Black Squirrel,1,1,"March 21, 2015","Washington DC, District of Columbia",/Restaurant_Review-g28970-d1051589-Reviews-The_Black_Squirrel-Washington_DC_District_of_Columbia.html,2.0,31,"Washington, DC",James E,38.8949549,-77.0366456,38.8949549,-77.03664559999999,1.3688331711774772e-12,True,336.0
