restaurant_overall_rating,user_review_title,user_review,restaurant_name,user_num_reviews,user_helpful_reviews,user_review_date,user_location,restaurant_url,user_rating,restaurant_num_reviews,restaurant_location,user_name,restaurant_latitude,restaurant_longitude,user_latitude,user_longitude,user_restaurant_distance,user_is_local,user_review_length
4.0,Great reasonably-priced Asian food w friendly staff,"I live in the Adams Morgan area and eat at Wok and Roll at least 7 times a year, especially when the patio is open on a sunny day. This spot is one of the few quality places in AdMo that is open for lunch. Affordable quality food and friendly staff. Great lunch specials and happy hour specials. Asian cuisine...


More",Wok and Roll Asian Bistro,158,53,"September 22, 2014","Washington DC, District of Columbia",/Restaurant_Review-g28970-d2088858-Reviews-Wok_and_Roll_Asian_Bistro-Washington_DC_District_of_Columbia.html,4.0,58,"Washington, DC",JT M,38.8949549,-77.0366456,38.8949549,-77.03664559999999,1.3688331711774772e-12,True,319.0
4.0,Excellent sushi,I had the dragon roll and the spider roll. Excellent. Service was also quite good. Definitely will go back for the sushi.,Wok and Roll Asian Bistro,244,79,"September 17, 2014","Bethesda, Maryland",/Restaurant_Review-g28970-d2088858-Reviews-Wok_and_Roll_Asian_Bistro-Washington_DC_District_of_Columbia.html,4.0,58,"Washington, DC",Margaret C,38.8949549,-77.0366456,38.984826500000004,-77.0946459,6.94236273210927,True,121.0
4.0,Really good Chinese food,"We came upon this restaurant by accident. Following an awful meal the night before in J.Paul's we were hoping for a better dining experience in D.C. And we thoroughly enjoyed the street-side dining experience. The staff were really charming and the did was really good, the best tasting Chinese food I've had in ages. Flavoursome, fresh, crispy and we'll presented....


More",Wok and Roll Asian Bistro,83,38,"August 26, 2014","Las Rozas, Spain",/Restaurant_Review-g28970-d2088858-Reviews-Wok_and_Roll_Asian_Bistro-Washington_DC_District_of_Columbia.html,4.0,58,"Washington, DC",Sisyphus1,38.8949549,-77.0366456,40.483444,-3.2366487999999998,3813.2913268956872,False,375.0
4.0,Crunchy Avocado Salmon Roll YUM YUM!,"Using a groupon I had the opportunity to visit Wok and Roll. From the outside the restaurant looks campy and a little on the sketchy side, but the interior is a stark contrast! Hardwood floors, stable cherry wood tables, and a rear bar make Wok and Roll and intimate setting to enjoy light sushi and asian fare.
I ordered the...


More",Wok and Roll Asian Bistro,7,4,"August 5, 2014","Washington DC, District of Columbia",/Restaurant_Review-g28970-d2088858-Reviews-Wok_and_Roll_Asian_Bistro-Washington_DC_District_of_Columbia.html,4.0,58,"Washington, DC",Ayanna M,38.8949549,-77.0366456,38.8949549,-77.03664559999999,1.3688331711774772e-12,True,335.0
4.0,Almost...,"Food was frankly fine. I asked for super spicy and they gave me as close to it as you can in a restaurant; that's a good thing. The service was great. They were friendly, polite and fast. My fifth star was not given because of the garlic eggplant. Good but not the best. We will, however, go back.",Wok and Roll Asian Bistro,81,24,"June 9, 2014","Washington DC, District of Columbia, USA",/Restaurant_Review-g28970-d2088858-Reviews-Wok_and_Roll_Asian_Bistro-Washington_DC_District_of_Columbia.html,4.0,58,"Washington, DC",TravelingTartar,38.8949549,-77.0366456,38.8949549,-77.03664559999999,1.3688331711774772e-12,True,297.0
4.0,Food was delicious!,"We were wondering around Adams Morgan and looking for a late dinner. We happened upon Wok and Roll and were able to get a table immediately. Our server was busy and not as attentive as we would have liked and she brought me the wrong drink at one point, but other than that, the food was really great and the...


More",Wok and Roll Asian Bistro,65,34,"April 10, 2014","Manchester, Connecticut",/Restaurant_Review-g28970-d2088858-Reviews-Wok_and_Roll_Asian_Bistro-Washington_DC_District_of_Columbia.html,4.0,58,"Washington, DC",MHolmes73,38.8949549,-77.0366456,41.775932399999995,-72.52147540000001,310.32276184079575,False,318.0
4.0,Pan Asian,"We ate lunch at a new place in Chinablock, DC. Wok and Roll is good fake Chinese and Japanese food. Nancy's fortune: ""Only tears can bring a dreamer back to earth.""",Wok and Roll Asian Bistro,253,117,"November 7, 2013","Washington DC, District of Columbia",/Restaurant_Review-g28970-d2088858-Reviews-Wok_and_Roll_Asian_Bistro-Washington_DC_District_of_Columbia.html,4.0,58,"Washington, DC",innerbum1,38.8949549,-77.0366456,38.8949549,-77.03664559999999,1.3688331711774772e-12,True,164.0
4.0,Decent stop,Quick service. Decent food. Went there twice in two days for dinner. Serve tea by cup instead of pot. Still enjoyable,Wok and Roll Asian Bistro,3,0,"October 14, 2013",,/Restaurant_Review-g28970-d2088858-Reviews-Wok_and_Roll_Asian_Bistro-Washington_DC_District_of_Columbia.html,5.0,58,"Washington, DC",Ted R,38.8949549,-77.0366456,,,,,117.0
4.0,"Nice food, sushi","Sushi is good and innovative. Service good.
It has a karaok too.
However, it charges 18% tip for dinner.",Wok and Roll Asian Bistro,1,0,"October 8, 2013","Arlington, Virginia",/Restaurant_Review-g28970-d2088858-Reviews-Wok_and_Roll_Asian_Bistro-Washington_DC_District_of_Columbia.html,4.0,58,"Washington, DC",wcambridge,38.8949549,-77.0366456,38.890396100000004,-77.0841585,2.5805753532034976,True,104.0
4.0,FUN!,"This place we went on a groupon. The service and selection were excellent. The sushi was delicious and the atmosphere was FUN! Great for families, friends, couples, anyone!",Wok and Roll Asian Bistro,4,0,"September 4, 2013","Baltimore, Maryland, United States",/Restaurant_Review-g28970-d2088858-Reviews-Wok_and_Roll_Asian_Bistro-Washington_DC_District_of_Columbia.html,5.0,58,"Washington, DC",Kristen L,38.8949549,-77.0366456,39.2908608,-76.61080729999998,35.63562299880662,True,172.0
4.0,Great Outdoor Patio,"Pleasantly surprised. I have been to the one in China Town, that was a bit cramped. This one has an outdoor patio. You can also choose to eat by the bar counter, which is also outdoor. The sushi platter was not bad (bearing in mind you cannot compare of what you have in Japan) my only criticism was that the...


More",Wok and Roll Asian Bistro,537,159,"June 25, 2013","Washington DC, District of Columbia",/Restaurant_Review-g28970-d2088858-Reviews-Wok_and_Roll_Asian_Bistro-Washington_DC_District_of_Columbia.html,4.0,58,"Washington, DC",Superlegalbabe,38.8949549,-77.0366456,38.8949549,-77.03664559999999,1.3688331711774772e-12,True,318.0
4.0,moderate Asian cuisine,"I have eaten here many times over the years because it is near the Gallery Place/Chinatown subway station.
I ate tuna carpaccio, cut raw tuna with a pineapple sauce, and soft-shell crab with a ginger sauce. The items are expensive, $12 for tuna, and $22 for crab, but I was splurging for a special event. I had eaten both items...


More",Wok and Roll Asian Bistro,36,16,"May 22, 2013",Baltimore,/Restaurant_Review-g28970-d2088858-Reviews-Wok_and_Roll_Asian_Bistro-Washington_DC_District_of_Columbia.html,4.0,58,"Washington, DC",ColasBaltimore,38.8949549,-77.0366456,39.2908608,-76.61080729999998,35.63562299880662,True,337.0
4.0,"Great service, ok food","A couple of my coworkers and I had a Groupon for Wok and Roll so we headed there for lunch recently. Spending $40 on lunch was tough but the server worked with us to make sure we got pretty darn close ($39) and was super nice about it unlike some servers dealing with Groupon holders. The curry chicken was only...


More",Wok and Roll Asian Bistro,80,20,"May 7, 2013","Arlington, Virginia, United States",/Restaurant_Review-g28970-d2088858-Reviews-Wok_and_Roll_Asian_Bistro-Washington_DC_District_of_Columbia.html,4.0,58,"Washington, DC",Belle W,38.8949549,-77.0366456,38.890396100000004,-77.0841585,2.5805753532034976,True,321.0
4.0,This place is perfect if you are dining alone.,"The food was out of sight. Their sushi is fresh and very creative in preparation. It is not the fanciest of restaurants, but the food is!",Wok and Roll Asian Bistro,8,0,"May 2, 2013","Easton, MD, USA",/Restaurant_Review-g28970-d2088858-Reviews-Wok_and_Roll_Asian_Bistro-Washington_DC_District_of_Columbia.html,5.0,58,"Washington, DC",Jhms48,38.8949549,-77.0366456,38.7742826,-76.07633050000003,52.475281842479454,False,137.0
4.0,Good sushi.,"Wok and Roll is your better than average Chinese restaurant. Try the sushi platter! It's 12.95 and very good sushi, and great portions! I tried my friends chicken. They ordered orange and I think it was very good. They thought it was too spicy, and sent it back. They then ordered sesame chicken which was less spicy. I didn't think...


More",Wok and Roll Asian Bistro,18,7,"April 17, 2013",,/Restaurant_Review-g28970-d2088858-Reviews-Wok_and_Roll_Asian_Bistro-Washington_DC_District_of_Columbia.html,4.0,58,"Washington, DC",Volkscollector,38.8949549,-77.0366456,,,,,342.0
4.0,Sushi before the game... YEAH,"If your going to the Verizon Center in DC, this is a great alternative to the crowds on 7th st. Wide variety of Asian and Sushi items, reasonably priced. Quality is very good. Atmosphere is standard. Not top of the line but certainly acceptable.
Try the Sushi Sampler. Only $12.95 for a nice portion.",Wok and Roll Asian Bistro,160,66,"April 8, 2013","Silver Spring, MD",/Restaurant_Review-g28970-d2088858-Reviews-Wok_and_Roll_Asian_Bistro-Washington_DC_District_of_Columbia.html,4.0,58,"Washington, DC",FenwickBill,38.8949549,-77.0366456,38.9906657,-77.026088,6.626692030412591,True,300.0
4.0,Excellent food and a historic location too,"I always believe in asking locals where to eat and after taking a City Segway tour asked our guide what she could recommend in Chinatown, we were not disappointed. Our food was very good and inexpensive - didnt try the sushi but heard it was very good. The menu had a large variety with large portions, my husband is picky...


More",Wok and Roll Asian Bistro,32,24,"April 4, 2013","Moncton, Canada",/Restaurant_Review-g28970-d2088858-Reviews-Wok_and_Roll_Asian_Bistro-Washington_DC_District_of_Columbia.html,5.0,58,"Washington, DC",canuckx3NewBrunswick,38.8949549,-77.0366456,46.0915426,-64.7952367,797.0364449362339,False,332.0
4.0,Best Chinese in Chinatown,"Of all the Chinese restaurants in Chinatown, this place is the best!
The staff is so nice and fast and the food is amazing.
I recommend the sesame chicken and chicken fried rice!",Wok and Roll Asian Bistro,4,3,"April 4, 2013","Philadelphia, Pennsylvania",/Restaurant_Review-g28970-d2088858-Reviews-Wok_and_Roll_Asian_Bistro-Washington_DC_District_of_Columbia.html,5.0,58,"Washington, DC",jkeyes2,38.8949549,-77.0366456,39.952335,-75.16378900000002,123.94015589510353,False,178.0
4.0,Wok and Roll all night long!,"Hubby and I were in DC for a concert at the Verizon Center and were also staying in a nearby hotel so we were looking for a quick & yummy dinner within walking distance of both. The desk clerk at our hotel recommended Wok and Roll and we were quick to see why he did...the food was awesome!! As a...


More",Wok and Roll Asian Bistro,12,7,"April 4, 2013",Virginia,/Restaurant_Review-g28970-d2088858-Reviews-Wok_and_Roll_Asian_Bistro-Washington_DC_District_of_Columbia.html,5.0,58,"Washington, DC",frenchienut,38.8949549,-77.0366456,37.1232245,-78.4927721,145.75460982304784,False,306.0
4.0,Great find in Chinatown,"Good food, excellent service, very inexpensive lunch specials. Good variety of Chinese, Japanese, sushi. Would go again.",Wok and Roll Asian Bistro,101,55,"March 20, 2013","Hartford, Connecticut",/Restaurant_Review-g28970-d2088858-Reviews-Wok_and_Roll_Asian_Bistro-Washington_DC_District_of_Columbia.html,4.0,58,"Washington, DC",Vacati0nMania,38.8949549,-77.0366456,41.7634935,-72.68305229999999,303.28033104428346,False,120.0
4.0,Great small Asian Joint,"We enjoyed a great night out. Its inexpensive with a casual, fun atmosphere. We got a mix of sushi and chinese dishes. The food was great",Wok and Roll Asian Bistro,433,201,"February 28, 2013","New York City, New York",/Restaurant_Review-g28970-d2088858-Reviews-Wok_and_Roll_Asian_Bistro-Washington_DC_District_of_Columbia.html,4.0,58,"Washington, DC",lollygal,38.8949549,-77.0366456,40.730599100000006,-73.9865812,205.8262086077873,False,137.0
4.0,"Famous Restaurant location, and we didn't know it!","We recently went to Wok and Roll since it was near the DC Engineering Show we had just visited. It was in Chinatown and as we looked at the menu, we overheard someone saying that this was the restaurant where Lincoln's kidnappers were plotting their evil deeds! Sure enough, when we researched it later, a previous owner was in on...


More",Wok and Roll Asian Bistro,77,36,"February 26, 2013","North Collins, New York",/Restaurant_Review-g28970-d2088858-Reviews-Wok_and_Roll_Asian_Bistro-Washington_DC_District_of_Columbia.html,4.0,58,"Washington, DC",300kathyd,38.8949549,-77.0366456,42.5953379,-78.94114609999998,274.18001669156223,False,340.0
4.0,Best sushi ever!,"It looks deceiving - yet the food is simply so well presented and very tasty.
The Sunset Roll had mayo crab, avocado, topped salmon and tobitos / spicy mayo!!!",Wok and Roll Asian Bistro,3,1,"January 6, 2013","Bath, United Kingdom",/Restaurant_Review-g28970-d2088858-Reviews-Wok_and_Roll_Asian_Bistro-Washington_DC_District_of_Columbia.html,5.0,58,"Washington, DC",FelipeUK,38.8949549,-77.0366456,51.3813864,-2.3596963,3585.5508879001677,False,159.0
4.0,Reliably yummy,"You can not go wrong with this place... they serve good standard Chinese food one expects from Chino-American restaurant and they also dish out some very nice Japanese rolls... Well located in the heart of china town for a lunch break while you stroll through the museums. Try their bubble teas too... service is surprisingly friendly and accommodating. Portions are...


More",Wok and Roll Asian Bistro,134,138,"December 25, 2012","London, United Kingdom",/Restaurant_Review-g28970-d2088858-Reviews-Wok_and_Roll_Asian_Bistro-Washington_DC_District_of_Columbia.html,4.0,58,"Washington, DC",PastaSnob,38.8949549,-77.0366456,51.5073219,-0.1276474,3674.6806319924717,False,376.0
4.0,It's Just OK,There is nothing outstanding about Wok and Roll. I went there one afternoon for lunch and had chicken and broccoli in garlic sauce. It was edible and tasted alright. Nothing great. The service was good and quick. The dining area is quaint but dark. It was an alright dining experience. Prices were on par with the D.C. area.,Wok and Roll Asian Bistro,71,26,"December 15, 2012","Baltimore, Maryland",/Restaurant_Review-g28970-d2088858-Reviews-Wok_and_Roll_Asian_Bistro-Washington_DC_District_of_Columbia.html,3.0,58,"Washington, DC",Tflipp,38.8949549,-77.0366456,39.2908608,-76.61080729999998,35.63562299880662,True,324.0
4.0,Best Fried Rice!,"Normal pricing for the area. The atmosphere was cute. Very small/intimate place. We had just a couple drinks and appetizers and just got fried rice. However the fried rice was one of the best we ever tasted. I am from New York and I know good asian food. This was by far one of the best. A good choice for...


More",Wok and Roll Asian Bistro,83,28,"December 11, 2012",Orlando,/Restaurant_Review-g28970-d2088858-Reviews-Wok_and_Roll_Asian_Bistro-Washington_DC_District_of_Columbia.html,4.0,58,"Washington, DC",travelgirl713,38.8949549,-77.0366456,28.5421175,-81.3790462,755.8243190989905,False,315.0
4.0,Not Chinatown's best effort,"Had dined here in the past to ok sushi but today had the worst meal ever. Mediocre sushi at best smothered in some random sauce that added nothing to the dish and on the contrary, you might as well have put ketchup on my sushi! A roll, miso soup and glass of wine came to almost $40 for one person....


More",Wok and Roll Asian Bistro,122,65,"December 6, 2012","Washington DC, District of Columbia",/Restaurant_Review-g28970-d2088858-Reviews-Wok_and_Roll_Asian_Bistro-Washington_DC_District_of_Columbia.html,1.0,58,"Washington, DC",globetrottertoday,38.8949549,-77.0366456,38.8949549,-77.03664559999999,1.3688331711774772e-12,True,308.0
4.0,Best Egg Rolls!,Looking for outstanding Chinese food? Visit the Wok and Roll! Best Egg Rolls and Chinese food I have ever had. Portions are huge and you won't be disappointed! $$ prices.,Wok and Roll Asian Bistro,77,20,"November 14, 2012",Stafford,/Restaurant_Review-g28970-d2088858-Reviews-Wok_and_Roll_Asian_Bistro-Washington_DC_District_of_Columbia.html,5.0,58,"Washington, DC",pearx4,38.8949549,-77.0366456,52.8063157,-2.1163818,3567.1574096493327,False,170.0
4.0,"""Nice outdoor atmosphere, good Asian food""","Huge selection of all the regular Chinese entre choices. My party chose a selection of the sushi rolls, all of which were fresh and delicious. Also tried the Orange Beef, as well as a pork and eggplant entre. All were delicious. We sat at a patio table for a lovely Sunday evening meal. Weather was humid, as usual for DC....


More",Wok and Roll Asian Bistro,194,62,"July 30, 2012","Redwood City, California",/Restaurant_Review-g28970-d2088858-Reviews-Wok_and_Roll_Asian_Bistro-Washington_DC_District_of_Columbia.html,4.0,58,"Washington, DC",Bernadette G,38.8949549,-77.0366456,37.4852152,-122.2363548,2436.9443451976595,False,332.0
4.0,OK But Not Great Food,"We ate at this Chinatown restaurant this evening. They have a selection of Chinese food and sushi. Our meals were very ordinary. They were not very flexible about substituing noodles for rice, etc. The service was good. My wife did not like what she ordered and they brought her something else and did not charge. We have had much better.",Wok and Roll Asian Bistro,526,205,"June 29, 2012","Palm Bay, Florida",/Restaurant_Review-g28970-d2088858-Reviews-Wok_and_Roll_Asian_Bistro-Washington_DC_District_of_Columbia.html,3.0,58,"Washington, DC",JackofPBFL,38.8949549,-77.0366456,28.0331886,-80.64296949999998,776.8274434233498,False,338.0
4.0,Not great food,"The food was average, service not so good. A kid vomited in the restaurant and staff didn't respond until customers said something. We had to request to be moved. Prices are reasonable and food is decent but do not go here for nice atmosphere and good service.",Wok and Roll Asian Bistro,21,5,"June 28, 2012",,/Restaurant_Review-g28970-d2088858-Reviews-Wok_and_Roll_Asian_Bistro-Washington_DC_District_of_Columbia.html,3.0,58,"Washington, DC",Mmmck,38.8949549,-77.0366456,,,,,260.0
4.0,Good delivery,"Not wanting to walk any more after a long day of tourist fun, our family decided to try Wok and Roll for delivery to our hotel in the conference center. It arrived quickly, hot and well prepared. My wife loved her soft shell crab dish, I found my moo shoo pork delicious, one son's lo mein was fresh and delicate....


More",Wok and Roll Asian Bistro,41,15,"June 1, 2012","Kirksville, Missouri",/Restaurant_Review-g28970-d2088858-Reviews-Wok_and_Roll_Asian_Bistro-Washington_DC_District_of_Columbia.html,4.0,58,"Washington, DC",Kiernan820,38.8949549,-77.0366456,40.1947539,-92.58324959999999,834.1163806621919,False,323.0
4.0,Great cuisine,Great selection of chinese and japanese food -- sushi was fresh. This restaurant is also housed in a historical landmark -- Mary Surratt's boarding house (where the conspiracy was plotted to assassinate President Lincoln). Staff were friendly and service was very good.,Wok and Roll Asian Bistro,18,8,"May 27, 2012",,/Restaurant_Review-g28970-d2088858-Reviews-Wok_and_Roll_Asian_Bistro-Washington_DC_District_of_Columbia.html,4.0,58,"Washington, DC",kimbarry95,38.8949549,-77.0366456,,,,,269.0
4.0,Don't let the funky name keep you away.,"We ate at Wok & Roll on two consecutive evenings in May 2012 because we were so happy after the first one. We took advantage of ""happy hour"" sushi for appetizers, and the nigiri were quite tasty --- particularly the yellowtail. Peking Duck is available w/out advance ordering and was delicious, cooked so it wasn't at all greasy. The Schezuan...


More",Wok and Roll Asian Bistro,156,52,"May 18, 2012","Bellingham, Washington",/Restaurant_Review-g28970-d2088858-Reviews-Wok_and_Roll_Asian_Bistro-Washington_DC_District_of_Columbia.html,4.0,58,"Washington, DC",HeadingOut98229,38.8949549,-77.0366456,48.754402,-122.4788602,2332.8317284479085,False,352.0
4.0,Great affordable place,"We have eaten at this place in Chinatown twice and it was great both times. The food is great (we did not try the shushi). This is not the fanciest place but the lunch price, quantity and quality was a great value. The building is touted as the place where the assasins plotted the murder of President Lincoln. Don't be...


More",Wok and Roll Asian Bistro,80,30,"April 2, 2012","Boone, Iowa",/Restaurant_Review-g28970-d2088858-Reviews-Wok_and_Roll_Asian_Bistro-Washington_DC_District_of_Columbia.html,4.0,58,"Washington, DC",IowaBilly,38.8949549,-77.0366456,42.017179799999994,-93.9254114,914.1808449823495,False,329.0
4.0,I wish read the trip advisor review first,"The web site is not like the real thing, the restaurant is CRAP. I guess when there is a tv in restaurant and a table in the corner is the family office it pretty much says it all.
Do not go to this place, food is 2/10 beer isn't cold, service poor.
Stay away.",Wok and Roll Asian Bistro,23,4,"December 20, 2011",Australia,/Restaurant_Review-g28970-d2088858-Reviews-Wok_and_Roll_Asian_Bistro-Washington_DC_District_of_Columbia.html,1.0,58,"Washington, DC",Nick-Australia,38.8949549,-77.0366456,-27.0,133.0,10525.28895734562,False,260.0
4.0,Inedible food,"The vegetable pot stickers were mostly thick heavy dough with 1 or 2 pieces of corn and peas inside, absolutely inedible! The shrimp in the tempura shrimp sushi roll must have been fried days ago in a month-old oil that stunk like fish and eggrolls. The kani salad was not what I was expecting (it didn't have fish roe or...


More",Wok and Roll Asian Bistro,1,0,"August 22, 2011",,/Restaurant_Review-g28970-d2088858-Reviews-Wok_and_Roll_Asian_Bistro-Washington_DC_District_of_Columbia.html,3.0,58,"Washington, DC",tammybog18,38.8949549,-77.0366456,,,,,331.0
5.0,Jewel in georgetown,"We had a great dinner at After Peacock Room. A small menu, but everything we ordered was delicious. The service was great. We complained about the music(type and loudness) and they reacted immediately. It is very attractive and in a residential street that really needs a nice dining option! Really a nice addition to Georgetown. Our only complaint is that...


More",After Peacock Room,69,36,"September 28, 2015","Washington DC, District of Columbia",/Restaurant_Review-g28970-d7653395-Reviews-After_Peacock_Room-Washington_DC_District_of_Columbia.html,4.0,4,"Washington, DC",mkg2805,38.8949549,-77.0366456,38.8949549,-77.03664559999999,1.3688331711774772e-12,True,366.0
5.0,Carefully Crafted Delicious Food in a Casual Yet Elegant Restaurant,"The French chef creates delicious combinations using fresh ingredients. Dishes are artful and satisfying. Staff are friendly, attentive and unobtrusive. The restaurant is quiet so that conversations are easy. It feels like you are dining in a special private home rather than in a restaurant. Romantic setting that is equally welcoming to groups, families or business diners.",After Peacock Room,13,9,"July 18, 2015","Washington DC, District of Columbia",/Restaurant_Review-g28970-d7653395-Reviews-After_Peacock_Room-Washington_DC_District_of_Columbia.html,5.0,4,"Washington, DC",Sara N,38.8949549,-77.0366456,38.8949549,-77.03664559999999,1.3688331711774772e-12,True,375.0
5.0,The Trifecta,"Begin at the Peacock Room at the Freer Art Museum, then stroll next door to the Peacock Room Remix (what the Peacock Room might look like if allowed to deteriorate) then hop in a cab to Georgetown to enjoy teas and latte with sweet cookies, macrons and cakes at the After Peacock Room cafe. The decor evokes the Peacock Room...


More",After Peacock Room,13,7,"June 11, 2015","Delray Beach, Florida, United States",/Restaurant_Review-g28970-d7653395-Reviews-After_Peacock_Room-Washington_DC_District_of_Columbia.html,5.0,4,"Washington, DC",EDGC,38.8949549,-77.0366456,26.4614625,-80.07282009999999,874.7193192552809,False,334.0
5.0,"Intimate, delightful, amazing, unusual food","On a cold wintry night we were delighted to find this new restaurant bustling with happy couples enjoying both atmosphere and marvelous food and service--with a delightful staff overseen personally by the charming owner herself, Heewong Ra, an artist/designer originally from Korea. Our starters of Roasted Chicken Soup and Hamachi Crudo sushi were exceptional--beyond ordinary by far, and served with...


More",After Peacock Room,23,28,"January 30, 2015","Washington DC, District of Columbia",/Restaurant_Review-g28970-d7653395-Reviews-After_Peacock_Room-Washington_DC_District_of_Columbia.html,5.0,4,"Washington, DC",Mac O,38.8949549,-77.0366456,38.8949549,-77.03664559999999,1.3688331711774772e-12,True,411.0
4.5,Love the Coffee,Best coffee we had our whole trip to DC. We were just walking by and decided to stop in to get a coffee as we walked to the National Mall. Service was quick and friendly. I don't think they are open on Saturdays or Sunday.,Juan Valdez Cafe,62,35,"September 29, 2015","Mokena, IL",/Restaurant_Review-g28970-d4946642-Reviews-Juan_Valdez_Cafe-Washington_DC_District_of_Columbia.html,5.0,8,"Washington, DC",KSue63,38.8949549,-77.0366456,41.52614370000001,-87.8892189,601.6065439597925,False,222.0
