restaurant_overall_rating,user_review_title,user_review,restaurant_name,user_num_reviews,user_helpful_reviews,user_review_date,user_location,restaurant_url,user_rating,restaurant_num_reviews,restaurant_location,user_name,restaurant_latitude,restaurant_longitude,user_latitude,user_longitude,user_restaurant_distance,user_is_local,user_review_length
3.5,Good service. Great food. good atmosphere that wasn't intrusive.,Title says it all. Perhaps not a young and hip place but a good eatery. We were very satisfied eating there three times on our four nights in DC.,The Front Page Restaurant & Grill,16,21,"November 9, 2008","London, England",/Restaurant_Review-g28970-d481212-Reviews-The_Front_Page_Restaurant_Grill-Washington_DC_District_of_Columbia.html,4.0,183,"Washington, DC",managementtrainer1,38.8949549,-77.0366456,51.5073219,-0.1276474,3674.6806319924717,False,145.0
3.5,I have never eaten here...,"I have never eaten here, but have gone for happy hour and late-night dancing. There are two exits, which makes it great to escape uncomfortable conversation",The Front Page Restaurant & Grill,1,0,"November 9, 2008",,/Restaurant_Review-g28970-d481212-Reviews-The_Front_Page_Restaurant_Grill-Washington_DC_District_of_Columbia.html,3.0,183,"Washington, DC",A TripAdvisor reviewer on Facebook,38.8949549,-77.0366456,,,,,156.0
3.5,"i'd only go again if someone took me, and then i'd stick with basic beef or chicken items.","i'd only go again if someone took me, and then i'd stick with basic beef or chicken items.",The Front Page Restaurant & Grill,1,0,"August 18, 2008",,/Restaurant_Review-g28970-d481212-Reviews-The_Front_Page_Restaurant_Grill-Washington_DC_District_of_Columbia.html,2.0,183,"Washington, DC",A TripAdvisor reviewer on Facebook,38.8949549,-77.0366456,,,,,90.0
3.5,According to a friend of...,"According to a friend of mine, the celery is awesome!",The Front Page Restaurant & Grill,1,0,"July 16, 2008",,/Restaurant_Review-g28970-d481212-Reviews-The_Front_Page_Restaurant_Grill-Washington_DC_District_of_Columbia.html,3.0,183,"Washington, DC",A TripAdvisor reviewer on Facebook,38.8949549,-77.0366456,,,,,53.0
3.5,Decent...,Decent...,The Front Page Restaurant & Grill,1,0,"June 8, 2008",,/Restaurant_Review-g28970-d481212-Reviews-The_Front_Page_Restaurant_Grill-Washington_DC_District_of_Columbia.html,2.0,183,"Washington, DC",A TripAdvisor reviewer on Facebook,38.8949549,-77.0366456,,,,,9.0
3.5,"my very favorite happy hour place! Hlaf price burgers on tues, or half price apps - and cheap beer","my very favorite happy hour place! Hlaf price burgers on tues, or half price apps - and cheap beer",The Front Page Restaurant & Grill,1,0,"May 21, 2008",,/Restaurant_Review-g28970-d481212-Reviews-The_Front_Page_Restaurant_Grill-Washington_DC_District_of_Columbia.html,4.0,183,"Washington, DC",A TripAdvisor reviewer on Facebook,38.8949549,-77.0366456,,,,,98.0
3.5,"good food, good beer...pretty crowded, but was a good crowd. Will go back.","good food, good beer...pretty crowded, but was a good crowd. Will go back.",The Front Page Restaurant & Grill,19,9,"April 12, 2008","Arlington, VA",/Restaurant_Review-g28970-d481212-Reviews-The_Front_Page_Restaurant_Grill-Washington_DC_District_of_Columbia.html,4.0,183,"Washington, DC",Devaney22,38.8949549,-77.0366456,38.8903961,-77.0841585,2.580575353203579,True,74.0
3.5,great sunday brunch,great sunday brunch,The Front Page Restaurant & Grill,1,0,"April 11, 2008",,/Restaurant_Review-g28970-d481212-Reviews-The_Front_Page_Restaurant_Grill-Washington_DC_District_of_Columbia.html,4.0,183,"Washington, DC",A TripAdvisor reviewer on Facebook,38.8949549,-77.0366456,,,,,19.0
3.5,I used to go there a lot...,I used to go there a lot about 15 years ago. I have not recently. Happy hour was fine. Traditional American food (burgers and the works). Nice service. Open late.,The Front Page Restaurant & Grill,1,0,"February 14, 2008",,/Restaurant_Review-g28970-d481212-Reviews-The_Front_Page_Restaurant_Grill-Washington_DC_District_of_Columbia.html,2.0,183,"Washington, DC",A TripAdvisor reviewer on Facebook,38.8949549,-77.0366456,,,,,162.0
3.5,Passable,Passable,The Front Page Restaurant & Grill,1,0,"February 4, 2008",,/Restaurant_Review-g28970-d481212-Reviews-The_Front_Page_Restaurant_Grill-Washington_DC_District_of_Columbia.html,3.0,183,"Washington, DC",A TripAdvisor reviewer on Facebook,38.8949549,-77.0366456,,,,,8.0
3.5,Okay place to watch a game.,Okay place to watch a game.,The Front Page Restaurant & Grill,11,0,"January 7, 2008",,/Restaurant_Review-g28970-d481212-Reviews-The_Front_Page_Restaurant_Grill-Washington_DC_District_of_Columbia.html,3.0,183,"Washington, DC",JoahS,38.8949549,-77.0366456,,,,,27.0
3.5,tenders. mmm.,tenders. mmm.,The Front Page Restaurant & Grill,1,0,"December 31, 2007",,/Restaurant_Review-g28970-d481212-Reviews-The_Front_Page_Restaurant_Grill-Washington_DC_District_of_Columbia.html,4.0,183,"Washington, DC",A TripAdvisor reviewer on Facebook,38.8949549,-77.0366456,,,,,13.0
3.5,Crowded and smells.,Crowded and smells.,The Front Page Restaurant & Grill,1,0,"December 18, 2007",,/Restaurant_Review-g28970-d481212-Reviews-The_Front_Page_Restaurant_Grill-Washington_DC_District_of_Columbia.html,3.0,183,"Washington, DC",A TripAdvisor reviewer on Facebook,38.8949549,-77.0366456,,,,,19.0
3.5,Fun Times!,We stumbled upon this restaurant and had a good time. The doorman was rude but the service was great and the crab cakes were AWESOME!,The Front Page Restaurant & Grill,3,9,"December 2, 2007",Carlsbad,/Restaurant_Review-g28970-d481212-Reviews-The_Front_Page_Restaurant_Grill-Washington_DC_District_of_Columbia.html,4.0,183,"Washington, DC",Carlsbad,38.8949549,-77.0366456,33.158093300000004,-117.3505939,2273.4251927148994,False,133.0
3.5,its fine when it's not college night. i love the cheap beer as much as the next girl but i'm all set with college kids...,its fine when it's not college night. i love the cheap beer as much as the next girl but i'm all set with college kids now,The Front Page Restaurant & Grill,1,0,"November 28, 2007",,/Restaurant_Review-g28970-d481212-Reviews-The_Front_Page_Restaurant_Grill-Washington_DC_District_of_Columbia.html,3.0,183,"Washington, DC",A TripAdvisor reviewer on Facebook,38.8949549,-77.0366456,,,,,122.0
3.5,"Loads of bimbos, young meat.","Loads of bimbos, young meat.",The Front Page Restaurant & Grill,1,0,"November 18, 2007",,/Restaurant_Review-g28970-d481212-Reviews-The_Front_Page_Restaurant_Grill-Washington_DC_District_of_Columbia.html,1.0,183,"Washington, DC",A TripAdvisor reviewer on Facebook,38.8949549,-77.0366456,,,,,28.0
3.5,Mmm... breakfast brunch...,"Mmm... breakfast brunch with Belgium Waffles, homefries and fruitbowl. Very tasty. They have an extensive brunch buffet on the weekends. The service does lack some attention to it's patrons... and never dine in the bar. But the food has always been delicious.",The Front Page Restaurant & Grill,1,0,"November 13, 2007",,/Restaurant_Review-g28970-d481212-Reviews-The_Front_Page_Restaurant_Grill-Washington_DC_District_of_Columbia.html,4.0,183,"Washington, DC",A TripAdvisor reviewer on Facebook,38.8949549,-77.0366456,,,,,259.0
3.5,Yuck,"Outside patio smelt so we moved inside. Food inedible, coffee old and stale. However, the manager did waive the check when this was brought to their attention. Avoid.",The Front Page Restaurant & Grill,1,0,"September 3, 2007","Seal Beach, California",/Restaurant_Review-g28970-d481212-Reviews-The_Front_Page_Restaurant_Grill-Washington_DC_District_of_Columbia.html,1.0,183,"Washington, DC",jcmcgarrigle,38.8949549,-77.0366456,33.741176,-118.1046356,2299.37885690302,False,166.0
3.5,Management is RUDE!,"On Thursday 09 NOV 06 at 6 pm I went to the Front Page. My friend and I sat at a four person table outside because we were expecting two other people to join us. Our friends brought two extra people for dinner, so there were six of us. We were standing around the table trying to figure out how...


More",The Front Page Restaurant & Grill,3,4,"November 10, 2006",Dc,/Restaurant_Review-g28970-d481212-Reviews-The_Front_Page_Restaurant_Grill-Washington_DC_District_of_Columbia.html,1.0,183,"Washington, DC",areukiddinme,38.8949549,-77.0366456,38.89366125,-76.987883153882,2.630158223611332,True,304.0
4.0,NY prices…,Loeb's is near my office and I've been a few times. The food is pretty good but the prices are comparable to NY ($6 for a tiny matzoh ball soup?!),Loeb's NY Delicatessen,327,134,"July 29, 2015",Washington DC,/Restaurant_Review-g28970-d6280821-Reviews-Loeb_s_NY_Delicatessen-Washington_DC_District_of_Columbia.html,4.0,12,"Washington, DC",laysadc,38.8949549,-77.0366456,38.8949549,-77.03664559999999,1.3688331711774772e-12,True,146.0
4.0,Very NY Delicatessen,I travel regularly to New York on business and if I had been given house made pickles to munch on while waiting for my pastrami I would have thought I was in Manhattan. The pastrami is sooo good!,Loeb's NY Delicatessen,492,148,"July 10, 2015","Washington DC, District of Columbia",/Restaurant_Review-g28970-d6280821-Reviews-Loeb_s_NY_Delicatessen-Washington_DC_District_of_Columbia.html,4.0,12,"Washington, DC",SeatOfMyPntsTravelr,38.8949549,-77.0366456,38.8949549,-77.03664559999999,1.3688331711774772e-12,True,195.0
4.0,DC Deli,"If you are from the south, the brisket sandwich will not be what you expect. While it was ok it isn't really what I'd call ""brisket"". The sandwich has coleslaw and is a good size. Note I purchased the sandwich, a tea, and a brownie for a total of $17. I would not recommend the brownie.",Loeb's NY Delicatessen,29,6,"May 24, 2015","Anchorage, Alaska",/Restaurant_Review-g28970-d6280821-Reviews-Loeb_s_NY_Delicatessen-Washington_DC_District_of_Columbia.html,3.0,12,"Washington, DC",AKReviewer2014,38.8949549,-77.0366456,61.2163129,-149.89485219999997,3369.0457529346754,False,286.0
4.0,Almost as good as Katz's...,"As a frequent traveler to NYC, I have so many great choices for an authentic pastrami sandwich. However, until recently I had to make do with really poor facsimiles of the real thing...you know what I mean. However, a couple weeks ago a pal of mine introduced me to a credible DC alternative - Loeb's.
Pros: reasonable prices, delicious food...


More",Loeb's NY Delicatessen,51,33,"April 3, 2015","Washington DC, District of Columbia",/Restaurant_Review-g28970-d6280821-Reviews-Loeb_s_NY_Delicatessen-Washington_DC_District_of_Columbia.html,4.0,12,"Washington, DC",Theron T,38.8949549,-77.0366456,38.8949549,-77.03664559999999,1.3688331711774772e-12,True,351.0
4.0,Best Sandwiches Ever,"I've tried their chopped chicken liver sandwich which is just amazing and I've tried their lox and bagel which is perfect.
I rate this place as 8.8/10
Oh and did I mention that it's Kosher and that the server Marlene is really nice :-)",Loeb's NY Delicatessen,33,9,"March 14, 2015",,/Restaurant_Review-g28970-d6280821-Reviews-Loeb_s_NY_Delicatessen-Washington_DC_District_of_Columbia.html,5.0,12,"Washington, DC",Retro T,38.8949549,-77.0366456,,,,,235.0
4.0,Good food; fast service,"I found Loeb's simply by walking past it during a lunch break. I stopped in. I had the turkey pastrami on rye. It was a very good sandwich. That plus a diet coke was roughly $13. Again the sandwich was really good, a decent amount of turkey without it spilling all over. Service was fast. The line of customers kept...


More",Loeb's NY Delicatessen,86,32,"February 26, 2015","Grand Rapids, Michigan",/Restaurant_Review-g28970-d6280821-Reviews-Loeb_s_NY_Delicatessen-Washington_DC_District_of_Columbia.html,3.0,12,"Washington, DC",DDBjen,38.8949549,-77.0366456,42.96324050000001,-85.66786390000001,531.4248747256894,False,325.0
4.0,Breakfast? Go here,"I've been here before for pastrami on rye (seriously recommended). This time I was here for breakfast, and it didn't disappoint- the menu is wide and it is all freshly cooked. Avoid the chain restaurants and get it done well- this is your place.",Loeb's NY Delicatessen,106,53,"February 16, 2015","alicante, spain",/Restaurant_Review-g28970-d6280821-Reviews-Loeb_s_NY_Delicatessen-Washington_DC_District_of_Columbia.html,4.0,12,"Washington, DC",grooverjlazerus,38.8949549,-77.0366456,38.37564915,-0.5314365254545871,4006.4566873138738,False,245.0
4.0,Big & Fast!,"This is a good spot for a big fat deli sandwich that comes to you fast. The food is excellent and the size is usually more than enough. The only knock is the price, but then you're in the big city and this isn't the dollar menu at a fast food joint!",Loeb's NY Delicatessen,36,18,"February 2, 2015","Dover, Delaware",/Restaurant_Review-g28970-d6280821-Reviews-Loeb_s_NY_Delicatessen-Washington_DC_District_of_Columbia.html,4.0,12,"Washington, DC",Harry W,38.8949549,-77.0366456,39.158168,-75.5243682,83.37117250825818,False,249.0
4.0,Great NY Deli -- I'll Be Back!,"Arrived early in the AM prior to a client meeting in downtown DC. Asked for a Pastrami Sandwich @ 6:50 AM. Not only were they not surprised, but they were very accommodating, packing each sandwich component indivdually to avoid sogginess and allowing me to assemble the sandwich when I was ready to eat it. The people were courteous and it...


More",Loeb's NY Delicatessen,225,57,"December 10, 2014","Sterling, Virginia",/Restaurant_Review-g28970-d6280821-Reviews-Loeb_s_NY_Delicatessen-Washington_DC_District_of_Columbia.html,4.0,12,"Washington, DC",mshapiro99,38.8949549,-77.0366456,39.0016194,-77.40320109999998,21.071349710484796,True,349.0
4.0,Stopped for breakfast and was pleasently surprised,Just walking down the street and saw this place. Typical deli set up but not typical food. Family owned and they cared. Food (breakfast) was excellent for a deli and the employees were friendly. We want to go back and try them for lunch. Check this place out,Loeb's NY Delicatessen,42,11,"November 3, 2014","New Oxford, Pennsylvania",/Restaurant_Review-g28970-d6280821-Reviews-Loeb_s_NY_Delicatessen-Washington_DC_District_of_Columbia.html,5.0,12,"Washington, DC",SteveofPA,38.8949549,-77.0366456,39.8637087,-77.0558143,66.8386473866843,False,258.0
4.0,"Traditional NY Deli in Washington, D.C.","*Doesn't seem like TripAdvisor will move this listing from Pennsylvania to Washington, D.C., where it is actually located*
Don't let the quaint front fool you, Loeb's is well worth the visit! This is DC's traditional New York Deli, and it certainly lives up to New York standards. Perhaps most known for Walter's Favorite, a large serving of pastrami, muenster, slaw...


More",Loeb's NY Delicatessen,42,23,"July 6, 2014","Arlington, Virginia",/Restaurant_Review-g28970-d6280821-Reviews-Loeb_s_NY_Delicatessen-Washington_DC_District_of_Columbia.html,5.0,12,"Washington, DC",fotoflow,38.8949549,-77.0366456,38.8903961,-77.0841585,2.580575353203579,True,376.0
4.0,A little piece of NY in DC,"This place is great. I eat there every time I am in DC for work. The food is delicious, the portions are generous, the staff are great, the price is reasonable.",Loeb's NY Delicatessen,31,14,"February 15, 2014","Boston, Massachusetts",/Restaurant_Review-g28970-d6280821-Reviews-Loeb_s_NY_Delicatessen-Washington_DC_District_of_Columbia.html,5.0,12,"Washington, DC",JRiley13,38.8949549,-77.0366456,42.3604823,-71.0595678,394.6971339457478,False,160.0
3.5,Good food and casual place to rest your feet,"We happened to walk by this diner and were lured in by the cheesy appearance. Their steak sandwiches were awesome, their fry seasoning is fabulous, and their beer is reasonably priced. We came more than once to enjoy a casual place to put up our feet after walking through DC all day. The interior is definitely showing its age, but...


More",Ollie's Trolley,27,0,"October 13, 2015","Calgary, Canada",/Restaurant_Review-g28970-d450573-Reviews-Ollie_s_Trolley-Washington_DC_District_of_Columbia.html,5.0,238,"Washington, DC",Erin D,38.8949549,-77.0366456,51.0530588,-114.0625614,1972.5719355285164,False,342.0
3.5,Kind of scuzzy,"This place could really use a makeover as it is pretty worn at the heels. There is a stale old grease smell hanging in the air that goes well with the oil pooling on their french fries. The breakfast sarny was bland and the bread was under toasted.
Won't come in here again.",Ollie's Trolley,215,46,"September 30, 2015",,/Restaurant_Review-g28970-d450573-Reviews-Ollie_s_Trolley-Washington_DC_District_of_Columbia.html,2.0,238,"Washington, DC",Scrappleking,38.8949549,-77.0366456,,,,,274.0
3.5,Worst Burger in DC,"Honestly, there are much better places out there you could eat than Ollie's Trolley. My elderly mother and I ate there one day while walking around DC and let me just say, the food was TERRIBLE, not to mention the service! I had ordered a ""Big Fish Sandwich"" while my mom ordered an ""Ollie Burger"". ""Big Fish Sandwich""? More like...


More",Ollie's Trolley,4,2,"September 13, 2015","Stoddard, Wisconsin",/Restaurant_Review-g28970-d450573-Reviews-Ollie_s_Trolley-Washington_DC_District_of_Columbia.html,2.0,238,"Washington, DC",Della D,38.8949549,-77.0366456,43.6619143,-91.21846670000001,806.8608581474127,False,339.0
3.5,Hold the grease,"Ollies Trolley is a spot that should be featured on Dinners, Drive In's and Dives. It is a Dive. You line up and order a very limited menu (vegans and vegetarians should not enter the premise.
After paying (cash only) they have an ATM in the back, you wait for you number to be called and take your trey of...


More",Ollie's Trolley,34,28,"September 13, 2015",Holmd,/Restaurant_Review-g28970-d450573-Reviews-Ollie_s_Trolley-Washington_DC_District_of_Columbia.html,2.0,238,"Washington, DC",Spooly1,38.8949549,-77.0366456,,,,,316.0
3.5,Best Burger in DC,"The burger was just the definition of what a burger should be, it was cooked and seasoned to perfections. Also the buns where made from potato bread I would love to franchise such an enterprise",Ollie's Trolley,25,5,"September 10, 2015","Cairo, Egypt",/Restaurant_Review-g28970-d450573-Reviews-Ollie_s_Trolley-Washington_DC_District_of_Columbia.html,5.0,238,"Washington, DC",Marwan S,38.8949549,-77.0366456,30.0488185,31.2436663,5821.600231352588,False,193.0
3.5,they dont take credit cards-cash only,"I have made multiple visits to this place. when the tourists are not here the food is quick. but for some reason when the tourists find this place the service slows down. the bbq sandwich is great. eastern nc style with slaw, fries and drink for around $10.",Ollie's Trolley,278,75,"September 1, 2015",DC,/Restaurant_Review-g28970-d450573-Reviews-Ollie_s_Trolley-Washington_DC_District_of_Columbia.html,3.0,238,"Washington, DC",mad155,38.8949549,-77.0366456,38.89366125,-76.98788315,2.630158432758043,True,257.0
3.5,Best burger I have ever had,"I always heard my parents talking about going to this place when they were growing up. I spotted it one day when walking with some friends. I have been back numerous time ever since. I can confidently say that this is the best hamburger I have ever had. I absolutely love this place and I go out of my way...


More",Ollie's Trolley,7,3,"August 27, 2015",,/Restaurant_Review-g28970-d450573-Reviews-Ollie_s_Trolley-Washington_DC_District_of_Columbia.html,5.0,238,"Washington, DC",mrsalty1223,38.8949549,-77.0366456,,,,,315.0
3.5,Delicious!,"My teenagers were automatically drawn to Ollie’s as we passed by in a cab on our way to our hotel due to the colorful exterior. We choose to circle back for dinner.
Ollie’s is a fascinating place that is filled with memorabilia and relics of carnivals or a county fair where the burgers are fixed the old fashioned way and...


More",Ollie's Trolley,52,37,"August 23, 2015","Akron, OH",/Restaurant_Review-g28970-d450573-Reviews-Ollie_s_Trolley-Washington_DC_District_of_Columbia.html,4.0,238,"Washington, DC",BarnzGirls,38.8949549,-77.0366456,41.0830643,-81.5184854,281.6558614148275,False,336.0
3.5,Great!,"Good fresh meat, great fries, nice portions, friendly service, and fair prices.
Second time there after three years and nothing has changed at all.
I will gladly return on my next visit to DC.",Ollie's Trolley,166,51,"August 7, 2015",Israel,/Restaurant_Review-g28970-d450573-Reviews-Ollie_s_Trolley-Washington_DC_District_of_Columbia.html,5.0,238,"Washington, DC",B B,38.8949549,-77.0366456,30.8760272,35.0015196,5947.268554826997,False,192.0
3.5,Found On Trip Advisor; Didn't Disappoint,"You know how sometimes the ""hole in the wall"" restaurants are good??? This is one. It has its own character,. Take some cash! No cards allowed. Their food was delicious and the atmosphere is all its own. It was incredibly crowded the afternoon I was in town. If you have plenty of time and love adventurous eats, this is for...


More",Ollie's Trolley,36,12,"August 6, 2015",Somerset,/Restaurant_Review-g28970-d450573-Reviews-Ollie_s_Trolley-Washington_DC_District_of_Columbia.html,4.0,238,"Washington, DC",AbiHutch,38.8949549,-77.0366456,51.083333,-3.0,3565.0351017264356,False,334.0
3.5,Good Food,"Surprisingly good food for an old diner. Only cash is accepted. Good service. Very quaint, but perfect for a good, fast meal. The burgers are excellent.",Ollie's Trolley,71,9,"August 5, 2015","Orlando, Florida",/Restaurant_Review-g28970-d450573-Reviews-Ollie_s_Trolley-Washington_DC_District_of_Columbia.html,4.0,238,"Washington, DC",Sarahjay192,38.8949549,-77.0366456,28.5421175,-81.3790462,755.8243190989905,False,152.0
3.5,keep going... terrible food.. dirty... cash only.. heard enough?,"Just keep walking.... Cash only... outrageous prices for greasy spoon burgers and waaay to salty fries. No free refills on beverages.... no one wiping down tables after patrons self bus their tables. Huge sticky mess on every table. dropped food ground into the floor in many places. Weird tacky ""antiques"" (dirty, nasty flea market finds) dropped throughout the dining room....


More",Ollie's Trolley,51,21,"August 4, 2015","Chester County, PA",/Restaurant_Review-g28970-d450573-Reviews-Ollie_s_Trolley-Washington_DC_District_of_Columbia.html,2.0,238,"Washington, DC",pyrsandplanes,38.8949549,-77.0366456,39.9829308,-75.7652424,101.28404832770119,False,385.0
3.5,"Expensive, Greasy, Diner Food","It was okay-all 7 of us ordered at 8pm and we were starving because we'd just gotten into town from a LONG drive. When she gave us the total (it was handwritten on sandwich paper) she said they take cash only. UGH, there went our cash supply-over $100! I was hoping for that diner price that the food would be...


More",Ollie's Trolley,187,121,"July 28, 2015",Iowa,/Restaurant_Review-g28970-d450573-Reviews-Ollie_s_Trolley-Washington_DC_District_of_Columbia.html,3.0,238,"Washington, DC",KatherineNoel,38.8949549,-77.0366456,41.9216734,-93.3122705,881.985330253534,False,319.0
3.5,Breakfast disappointing,We were in first thing for breakfast and the place smelt a bit weird. However we'd read some good reviews so stayed. Wish we hadn't. Very basic food on paper plates for the same price as somewhere nice.,Ollie's Trolley,6,2,"July 23, 2015","Edinburgh, United Kingdom",/Restaurant_Review-g28970-d450573-Reviews-Ollie_s_Trolley-Washington_DC_District_of_Columbia.html,1.0,238,"Washington, DC",Martin D,38.8949549,-77.0366456,55.9483544,-3.1931187000000003,3470.149060246335,False,202.0
3.5,Overpriced and undercooked...,"When you order they have a sign that states all burners all cooked medium unless otherwise ordered. When we got our food, 3 out of 4 were almost raw in part of the patty. The cooks obviously have no idea how to cook a burger evenly. We thought it was overpriced and not very special at all. Take a look...


More",Ollie's Trolley,5,3,"July 19, 2015","Charlotte, NC",/Restaurant_Review-g28970-d450573-Reviews-Ollie_s_Trolley-Washington_DC_District_of_Columbia.html,2.0,238,"Washington, DC",jrproffi,38.8949549,-77.0366456,35.2270869,-80.8431268,328.9098342000259,False,312.0
3.5,Okay,Not working hat I expected. ... but not only do well if I expected the breakfast looks pretty good .. they are little overpriced and I would only recommend the breakfast,Ollie's Trolley,2,0,"July 19, 2015",,/Restaurant_Review-g28970-d450573-Reviews-Ollie_s_Trolley-Washington_DC_District_of_Columbia.html,3.0,238,"Washington, DC",Dianna B,38.8949549,-77.0366456,,,,,169.0
3.5,Great Burgers for a good Price,Great made to order burgers and fries. Everyone in our party was happy with their food. Located in the Hotel Harrington. Great location.,Ollie's Trolley,20,5,"July 13, 2015","Prairie du Sac, Wisconsin",/Restaurant_Review-g28970-d450573-Reviews-Ollie_s_Trolley-Washington_DC_District_of_Columbia.html,5.0,238,"Washington, DC",Deb M,38.8949549,-77.0366456,43.2869331,-89.7240116,727.399793892729,False,136.0
3.5,"The older the place, the better the food.","Don't let the older looks chase you away. The older the place the better the food. If you are looking for a burger while in DC, you've got to try Olle's Trolley. They grind their own meat and cook it over on open flame. Good fries as well",Ollie's Trolley,15,5,"July 12, 2015","Clearwater, Minnesota, Usa",/Restaurant_Review-g28970-d450573-Reviews-Ollie_s_Trolley-Washington_DC_District_of_Columbia.html,5.0,238,"Washington, DC",Carla A,38.8949549,-77.0366456,47.5643825,-95.37478440000001,1098.0049731802967,False,238.0
3.5,Good Burgers,"The burgers at Ollie's Trolley were very good and I would highly recommend them to anyone visiting the area. The rest of the meal was okay and service was mediocre. Still, the burgers were well worth the visit and the place was interesting and kind of quirky.",Ollie's Trolley,116,30,"July 7, 2015","Denton, TX",/Restaurant_Review-g28970-d450573-Reviews-Ollie_s_Trolley-Washington_DC_District_of_Columbia.html,4.0,238,"Washington, DC",diannek,38.8949549,-77.0366456,33.1734745,-97.23481586,1194.848762843886,False,259.0
