restaurant_overall_rating,user_review_title,user_review,restaurant_name,user_num_reviews,user_helpful_reviews,user_review_date,user_location,restaurant_url,user_rating,restaurant_num_reviews,restaurant_location,user_name,restaurant_latitude,restaurant_longitude,user_latitude,user_longitude,user_restaurant_distance,user_is_local,user_review_length
4.0,The Fajita Steak... so good!,"I went here with friends with a groupon deal. I had absolutely zero expectations for how good the food would be, but I was so pleasantly surprised. I had the fajita steak taco salad, and the steak was sooooo delicious. (And the taco shell was different from others I've had. I don't know what made it different, but I liked...


More",Haydee's,83,63,"August 9, 2013","College Park, Maryland",/Restaurant_Review-g28970-d794674-Reviews-Haydee_s-Washington_DC_District_of_Columbia.html,4.0,17,"Washington, DC",Erin M,38.8949549,-77.0366456,38.980666,-76.9369189,7.9889229258145225,True,333.0
4.0,Fun atmosphere and great service,What distinguished this restaurant from hundreds of other Tex Mex variations is that this is not a chain and has an ever present and very friendly owner whose enthusiasm is shared by the entire staff. Fun atmosphere and good food.,Haydee's,304,132,"June 22, 2013","Boulder, Colorado",/Restaurant_Review-g28970-d794674-Reviews-Haydee_s-Washington_DC_District_of_Columbia.html,4.0,17,"Washington, DC",Peter V,38.8949549,-77.0366456,40.0149856,-105.2705456,1505.6279577908297,False,230.0
4.0,Good Latin food but Ercilia's is better,"I like this place a lot. The food is great. Beans are fantastic. Salvadoran tacos are great. Decent tequila selection. On a street with several latin places, this is the second best. I thought it was the best until I tried Ercilia's. Haydee's is the best place that serves booze. But if you just want a decent pupusa go to...


More",Haydee's,39,14,"June 13, 2013","Washington DC, District of Columbia",/Restaurant_Review-g28970-d794674-Reviews-Haydee_s-Washington_DC_District_of_Columbia.html,3.0,17,"Washington, DC",OldBarnacleJaffee,38.8949549,-77.0366456,38.8949549,-77.03664559999999,1.3688331711774772e-12,True,332.0
4.0,Very good service!,"The service here is great! The food and alcoholic beverages are good and priced right. Although the restaurant doesnt open until after 4pm it is a joy that it stays open late into the night when most other restaurants have closed. After certain hours and on certain days the upstairs becomes a ""nightclub"". Im not a big fan of having...


More",Haydee's,68,16,"February 22, 2013",Washington DC,/Restaurant_Review-g28970-d794674-Reviews-Haydee_s-Washington_DC_District_of_Columbia.html,4.0,17,"Washington, DC",TinkWDC,38.8949549,-77.0366456,38.8949549,-77.03664559999999,1.3688331711774772e-12,True,343.0
4.0,Just OK.,"I purchased a Living Social coupon for $20 off at Haydees and just visited there recently. We arrived a few minutes before 5PM on a Sunday and the place was near empty, with only two tables occupied. We ordered veggie fajitas, soft chicken tacos, a house margarita and a Cuervo margarita.
The Good: The vegetables that came with the fajita...


More",Haydee's,99,187,"February 4, 2013","Washington DC, District of Columbia",/Restaurant_Review-g28970-d794674-Reviews-Haydee_s-Washington_DC_District_of_Columbia.html,3.0,17,"Washington, DC",Jontae1,38.8949549,-77.0366456,38.8949549,-77.03664559999999,1.3688331711774772e-12,True,349.0
4.0,Tons of good reasons to love this place,"The food here is really good. I've often gotten lucky to come here when there is live music too. The place is large so I've never had issues with getting a table ever and I've been here a lot. The best part though is that they are open incredibly late. I can't even tell you when they close because I've...


More",Haydee's,118,37,"August 2, 2012",Virginia,/Restaurant_Review-g28970-d794674-Reviews-Haydee_s-Washington_DC_District_of_Columbia.html,5.0,17,"Washington, DC",zellywelly,38.8949549,-77.0366456,37.1232245,-78.4927721,145.75460982304784,False,313.0
4.0,Great local spot,"Haydees is my local go-to Mexican restaurant. It's worth pointing out that Mexican in DC is just not the same as in The southwestern United States. However, the food is tasty and the service is excellent. The margaritas are good, I would recommend sticking with the inexpensive ones as the do the job very well.
Overall, this is a solid...


More",Haydee's,7,0,"May 27, 2012",,/Restaurant_Review-g28970-d794674-Reviews-Haydee_s-Washington_DC_District_of_Columbia.html,4.0,17,"Washington, DC",Josh N,38.8949549,-77.0366456,,,,,346.0
4.0,Meh...I've had better,"Tried this place after buying a Groupon. In a nutshell, the food was good but there were other things that really annoyed me.
First the food. Remember this is a Groupon deal....it was for dinner for tow - two margaritas with Chicken and Steak Fajitas for two. The food was good....very tasty. We also ordered the guacamole....meh. It had sour...


More",Haydee's,132,68,"September 25, 2011","Washington, DC",/Restaurant_Review-g28970-d794674-Reviews-Haydee_s-Washington_DC_District_of_Columbia.html,3.0,17,"Washington, DC",athena381,38.8949549,-77.0366456,38.8949549,-77.03664559999999,1.3688331711774772e-12,True,352.0
4.0,"Fun place for local fare, margaritas, and mariachi!","Fun place for local fare, margaritas, and mariachi!",Haydee's,1,0,"March 27, 2010",,/Restaurant_Review-g28970-d794674-Reviews-Haydee_s-Washington_DC_District_of_Columbia.html,3.0,17,"Washington, DC",A TripAdvisor reviewer on Facebook,38.8949549,-77.0366456,,,,,51.0
4.0,College Hangout,"I love this place! Very good food, but a little bit pricey for what you get. However, not many places in DC get rice right and Poppabox does. The cute building and style of the whole place are a major plus. Perfect for college students.",Poppabox,21,2,"September 24, 2015","Washington DC, District of Columbia",/Restaurant_Review-g28970-d6662624-Reviews-Poppabox-Washington_DC_District_of_Columbia.html,5.0,8,"Washington, DC",Lexi S,38.8949549,-77.0366456,38.8949549,-77.03664559999999,1.3688331711774772e-12,True,236.0
4.0,Quick and tasty,"While walking down Pennsylvania Ave. on the way to the White House with my daughter, we wanted a quick, substantial, but healthy lunch. We decided to try this cute little restaurant. Several doors were open on this beautiful Fall day and there were a limited number of tables. Went up to the counter and I ordered the mini bulgogi and...


More",Poppabox,25,6,"September 12, 2015","Bloomfield Hills, Michigan",/Restaurant_Review-g28970-d6662624-Reviews-Poppabox-Washington_DC_District_of_Columbia.html,4.0,8,"Washington, DC",Millie22_12,38.8949549,-77.0366456,42.583645,-83.24548829999998,413.2950565804679,False,344.0
4.0,Quick smoothie/boba!,"This was a great first experience! My friend told me I had to try a boba drink, so I got the honeydew, and it was pretty good! The restaurant itself was nice, too, in that there was plenty of seating, it was cool on a hot day, and the doors were open, so it was pleasant even on a hot...


More",Poppabox,1807,1906,"July 6, 2015","Washington DC, District of Columbia",/Restaurant_Review-g28970-d6662624-Reviews-Poppabox-Washington_DC_District_of_Columbia.html,4.0,8,"Washington, DC",WhitO5214,38.8949549,-77.0366456,38.8949549,-77.03664559999999,1.3688331711774772e-12,True,294.0
4.0,Poppabox,"A quick and reasonably priced breakfast. Close to Hotel Lombardy. Only a handful of tables, but lots of people were doing takeout.",Poppabox,7,2,"March 1, 2015","Auburn Hills, Michigan",/Restaurant_Review-g28970-d6662624-Reviews-Poppabox-Washington_DC_District_of_Columbia.html,4.0,8,"Washington, DC",Jody A,38.8949549,-77.0366456,42.6647495,-83.23093751,416.00969800787374,False,130.0
4.0,Don't just walk by at lunchtime,"Located near GWU and the IMF this place is great for both student and businessperson. The options are fast Korean, Japanese, wraps or waffle sandwiches. You can even get fried chicken and waffles here! What I really like is that they have a ""Mini-bowl"" option which is the perfect amount if you have limited time and/or don't typically stuff yourself.",Poppabox,492,148,"November 7, 2014","Washington DC, District of Columbia",/Restaurant_Review-g28970-d6662624-Reviews-Poppabox-Washington_DC_District_of_Columbia.html,4.0,8,"Washington, DC",SeatOfMyPntsTravelr,38.8949549,-77.0366456,38.8949549,-77.03664559999999,1.3688331711774772e-12,True,351.0
4.0,"Tasty fusion ""fast food""","Easy to grab a healthy, tasty lunch with lots of veggies and if no tables, eat in the park across the street. Wraps, bowls, and boxes featuring seafood, pork and chicken with an Asian flare.",Poppabox,11,0,"August 19, 2014","Edmond, Oklahoma",/Restaurant_Review-g28970-d6662624-Reviews-Poppabox-Washington_DC_District_of_Columbia.html,5.0,8,"Washington, DC",lynn k,38.8949549,-77.0366456,35.6571367,-97.4649038,1145.1386507438895,False,190.0
4.0,Good for a Quick Bite,"Poppabox is an interesting little place on the corner. I decided on the waffles and eggs with ham. Everything was served in a “to-go” box even if you want to “eat-in.” Here’s what I got: Two mini-waffles (cut in half), 3 paper-thin slices of ham, and two eggs. It was all good but different. Sort of a mini-breakfast-in-a-box and a...


More",Poppabox,424,203,"August 1, 2014",North Hills,/Restaurant_Review-g28970-d6662624-Reviews-Poppabox-Washington_DC_District_of_Columbia.html,3.0,8,"Washington, DC",Robert L,38.8949549,-77.0366456,40.7809343,-73.6765187,221.03454029540205,False,351.0
4.0,Bubble tea,"It's a small Asian inspired place located b/t N 19th St & N 20th St (close to Georgetown). It's good for a quick lunch or just to grab a bubble tea or ice cream.
I had a mango bubble tea. It was a little too sweet for my taste and also a bit expensive ($6).
Nice staff.",Poppabox,2343,1184,"May 20, 2014","Washington DC, District of Columbia",/Restaurant_Review-g28970-d6662624-Reviews-Poppabox-Washington_DC_District_of_Columbia.html,3.0,8,"Washington, DC",HelenaGuerra,38.8949549,-77.0366456,38.8949549,-77.03664559999999,1.3688331711774772e-12,True,269.0
4.0,"Delightful, cozy and delicious",We chose this restaurant based on proximity to the Russell Senate bldg and wanted Italian. The food was great! The neighborhood that it's in is very quaint. So glad that we found it!,Bistro Italiano,25,4,"October 5, 2015",,/Restaurant_Review-g28970-d524856-Reviews-Bistro_Italiano-Washington_DC_District_of_Columbia.html,5.0,51,"Washington, DC",Melissa C,38.8949549,-77.0366456,,,,,182.0
4.0,Nice escape from DC hustle and bustle,"This was a quaint, quiet, home cooked, quality, tasty, appropriately portioned, reasonably priced meal served without hustle and bustle like many other high priced DC restaurants. A hidden treasure. Glad to have found it!",Bistro Italiano,6,12,"August 24, 2015","Utica, New York",/Restaurant_Review-g28970-d524856-Reviews-Bistro_Italiano-Washington_DC_District_of_Columbia.html,4.0,51,"Washington, DC",1L0ve2Trave1,38.8949549,-77.0366456,43.1009031,-75.2326641,305.1519756150609,False,221.0
4.0,Nice broad menu. Lots of choices,"Had a lovely spicy diabolo red sauce with scallops. Clean, neat, good service. Nice to have lots of choices in noodles, meats, and sauces in a small restaurant. Also priced very well, less than many in this area",Bistro Italiano,11,8,"August 10, 2015",wyoming,/Restaurant_Review-g28970-d524856-Reviews-Bistro_Italiano-Washington_DC_District_of_Columbia.html,4.0,51,"Washington, DC",GCK,38.8949549,-77.0366456,43.1700264,-107.5685348,1613.1269823328746,False,211.0
4.0,Average,We had read reviews and so we were a bit disappointed. The salad was very basic and the red sauce on the spaghetti was a bit runny and had a smokey bbq flavor. The server was pleasant put quite tentative; probably just lacking experience.,Bistro Italiano,16,6,"May 28, 2015",,/Restaurant_Review-g28970-d524856-Reviews-Bistro_Italiano-Washington_DC_District_of_Columbia.html,3.0,51,"Washington, DC",Doyle C,38.8949549,-77.0366456,,,,,238.0
4.0,Quaint place with good food,Found this place by walking through the neighborhood. It's small but has good food and the service was decent even though our server seemed to be the only one working the tables. She was very cheerful and attentive. The food portions were large and hearty. I would definitely come back when I visit again.,Bistro Italiano,50,14,"April 4, 2015","Salt Lake City, Utah",/Restaurant_Review-g28970-d524856-Reviews-Bistro_Italiano-Washington_DC_District_of_Columbia.html,4.0,51,"Washington, DC",ShanersD,38.8949549,-77.0366456,40.7670126,-111.8904308,1846.2390931376406,False,305.0
4.0,Red sauce Italian with tablecloth,"This was my first chance to eat in my daughter and son-in-law's favorite neighborhood Italian restaurant. I am looking forward to going back. My calamari fra diabolo was the best I've ever had. The squid was tender and briny, and the red sauce was rich. My wife's shrimp (wild I think) and eggplant with linguini and marinara was equally good....


More",Bistro Italiano,30,9,"March 23, 2015","Millburn, NJ",/Restaurant_Review-g28970-d524856-Reviews-Bistro_Italiano-Washington_DC_District_of_Columbia.html,5.0,51,"Washington, DC",Robert Y,38.8949549,-77.0366456,40.7244443,-74.3069069,192.40615796414505,False,353.0
4.0,Quaint,Very small little joint that accommodated our large group happily then supplied us with a free round of champagne to thank us for our often thankless jobs (9-1-1 dispatchers). The pasta dishes were fantastic and the portions were plentiful.,Bistro Italiano,41,17,"February 27, 2015","Otis, CO",/Restaurant_Review-g28970-d524856-Reviews-Bistro_Italiano-Washington_DC_District_of_Columbia.html,4.0,51,"Washington, DC",i911,38.8949549,-77.0366456,40.1488722,-102.9629926,1383.0145778579767,False,240.0
4.0,It was ok...,The food was really good but I wouldn't describe everything as Italian food and they had some mistakes on the menu. Our waitress was very friendly and attentive.,Bistro Italiano,13,6,"February 7, 2015","Purcellville, Virginia",/Restaurant_Review-g28970-d524856-Reviews-Bistro_Italiano-Washington_DC_District_of_Columbia.html,3.0,51,"Washington, DC",Tiffany H,38.8949549,-77.0366456,39.1367717,-77.7147153,40.12223825979874,True,161.0
4.0,It was okay,"The food was good, but as Italian restaurant the desserts should be real Italian and not kind of. Especially the ""tiramisu"" was nothing to be called Italian tiramisu. And even the manager didn't know, why the ""Italian rum cake"" is called Italian. Btw the Tullamore Dew whiskey is from Ireland and not scotch whisky. The waitress was really friendly and...


More",Bistro Italiano,1,0,"February 3, 2015","Nals, Italy",/Restaurant_Review-g28970-d524856-Reviews-Bistro_Italiano-Washington_DC_District_of_Columbia.html,3.0,51,"Washington, DC",DanielUnterrainer,38.8949549,-77.0366456,46.54348710000001,11.2046272,4282.509323539686,False,362.0
4.0,Nice lunch close to friends,"I've only been here for lunch several times. The pizzas are very large for a single. The veal parmagean is good, nothing special but good. The Lasagne is also good.",Bistro Italiano,108,46,"December 6, 2014","Washington DC, District of Columbia",/Restaurant_Review-g28970-d524856-Reviews-Bistro_Italiano-Washington_DC_District_of_Columbia.html,3.0,51,"Washington, DC",Tom P,38.8949549,-77.0366456,38.8949549,-77.03664559999999,1.3688331711774772e-12,True,164.0
4.0,Neighborhood small restaurant. Nice staff.,"Reservation accepted in this small italian restaurant. Not so busy but sll tables taken at some point. Menu has the essential italiam dishes. I found portions relatively small vs what we get in our neighborhood restaurants in nj. Staff was corteous and helpful selecting menu items. The sponge chocolate mousse cake was one of the best i ever had. Really...


More",Bistro Italiano,176,110,"November 8, 2014","Long Valley, New Jersey",/Restaurant_Review-g28970-d524856-Reviews-Bistro_Italiano-Washington_DC_District_of_Columbia.html,4.0,51,"Washington, DC",MCNICE9,38.8949549,-77.0366456,40.7859331,-74.7801645,177.251052588093,False,364.0
4.0,Neighborhood Italian Restaurant,Came in with a large group. Very small restaurant with great service and wonderful food. We appreciated the service and the food was good.,Bistro Italiano,78,24,"November 5, 2014","Jacksonville, Florida",/Restaurant_Review-g28970-d524856-Reviews-Bistro_Italiano-Washington_DC_District_of_Columbia.html,5.0,51,"Washington, DC",Traveler10531558,38.8949549,-77.0366456,30.3321838,-81.655651,646.0287497473273,False,138.0
4.0,OK but not more,"food was good but not outstanding (in particular the garden salad with one slice of cucumber and two cherry tomatoes was very average), no stars in the American wine selection and service was just OK (had to remind them that we had ordered some wine)",Bistro Italiano,28,7,"October 2, 2014","Perth, Australia",/Restaurant_Review-g28970-d524856-Reviews-Bistro_Italiano-Washington_DC_District_of_Columbia.html,3.0,51,"Washington, DC",Neville H,38.8949549,-77.0366456,-31.95271210000001,115.8604796,11569.704978330006,False,250.0
4.0,Little neighborhood Italian place on Senate side,"I've eaten at Bistro Italiano for years and owe them this review. It's small and has a fairly basic Italian menu, but they consistently provide a good meal with kind, understated service. I refer friends there often and they always fall in love with it. Many DC folks don't know it's there because it's tucked in a row of houses....


More",Bistro Italiano,65,31,"September 19, 2014","Alexandria, Virginia",/Restaurant_Review-g28970-d524856-Reviews-Bistro_Italiano-Washington_DC_District_of_Columbia.html,5.0,51,"Washington, DC",MODSquadT4,38.8949549,-77.0366456,38.8051095,-77.0470229,6.222766826830365,True,339.0
4.0,Very good and great value!,This is a great place to eat while in DC. In a quiet area. Great Italian food. Loved the antipasto salad. Family had spaghetti and chicken parmesan.,Bistro Italiano,63,26,"July 5, 2014",South Carolina,/Restaurant_Review-g28970-d524856-Reviews-Bistro_Italiano-Washington_DC_District_of_Columbia.html,5.0,51,"Washington, DC",etzv,38.8949549,-77.0366456,33.687438799999995,-80.4363743,406.0378060824851,False,148.0
4.0,Pizza Delivery No-Show!,"Ordered a pizza at 9:30 pm, called back at 10:20 -- no answer, no pizza. Why take an order if you don't intend to deliver?",Bistro Italiano,4,3,"July 3, 2014","Woodland Park, Colorado",/Restaurant_Review-g28970-d524856-Reviews-Bistro_Italiano-Washington_DC_District_of_Columbia.html,1.0,51,"Washington, DC",TapleyJordanwood,38.8949549,-77.0366456,39.00993625,-105.045002603329,1502.6222609039762,False,122.0
4.0,Nice place off of the beaten path.,"We came across this place on the internet and decided to give it a shot as it got good reviews. It is built in to the end of a row house and could easily missed, so keep your eyes open when searching for it. The place is very cozy and well decorated and makes you feel like you are eating...


More",Bistro Italiano,139,78,"March 28, 2014","Rome, New York",/Restaurant_Review-g28970-d524856-Reviews-Bistro_Italiano-Washington_DC_District_of_Columbia.html,4.0,51,"Washington, DC",Brian C,38.8949549,-77.0366456,43.2128473,-75.45573040000002,309.17697836538304,False,298.0
4.0,Simple and affordable,"This place has a simple menu that offers great selections of Italian dish's.
Located about 5 minutes East of the Washington, D.C. Metro, you might miss this place if no one recommends it for you. It is hidden in the middle of some homes. In fact, it appears to have been a home at one point or another since the...


More",Bistro Italiano,51,27,"February 28, 2014","Imperial Valley, CA",/Restaurant_Review-g28970-d524856-Reviews-Bistro_Italiano-Washington_DC_District_of_Columbia.html,4.0,51,"Washington, DC",DJTOBY,38.8949549,-77.0366456,32.69694804,-115.5003935,2185.6482171481166,False,321.0
4.0,Friday Dinner,"Found the restaurant while close to Union Station. Very cozy, reminding me of a restaurant in a small town of Italy.
Wonderful smells of food hit you as you are seated and ready to order. Very good menu selections and price.
Enjoyed spaghetti and meatballs along with chicken castellana.
Would not suggest large parties but more 2-4.",Bistro Italiano,45,18,"October 26, 2013",,/Restaurant_Review-g28970-d524856-Reviews-Bistro_Italiano-Washington_DC_District_of_Columbia.html,4.0,51,"Washington, DC",Invinoveritas79,38.8949549,-77.0366456,,,,,333.0
4.0,Quaint restautant with fair prices is a great find near the capitol,"This small restautant (I counted 32 seats) had great food for dinner and was a terrific value. My family and I went with traditional Italian food which was excellent, but I did notice that quite a few pizzas were sold while we were there. Finally, we had great service and experienced a lovely atmosphere.",Bistro Italiano,7,1,"August 5, 2013","Columbus, Ohio",/Restaurant_Review-g28970-d524856-Reviews-Bistro_Italiano-Washington_DC_District_of_Columbia.html,5.0,51,"Washington, DC",gnagy5,38.8949549,-77.0366456,39.9622601,-83.00070649999998,327.39742252612587,False,305.0
4.0,Nice having an American-Italian joint in the 'hood,"No, it's not high-end, but if you're craving a plate of spaghetti and meatballs, or a simple pizza, and you don't want to break the bank, this is your place. DC doesn't have nearly enough red-check table-cloth Italian places like this one.",Bistro Italiano,10,2,"July 21, 2013","Washington, DC",/Restaurant_Review-g28970-d524856-Reviews-Bistro_Italiano-Washington_DC_District_of_Columbia.html,3.0,51,"Washington, DC",uhang,38.8949549,-77.0366456,38.8949549,-77.03664559999999,1.3688331711774772e-12,True,239.0
4.0,Nice little hidden gem,"This is a small place, twelve to fifteen tables at most, tucked amid brownstones with a single front pane window. We stopped by late of an evening, about nine o'clock and were pleasantly surprised. The baked ziti was rich with melted cheese and a sweet sort of marinara sauce and generously portioned enough to take home for next day lunch....


More",Bistro Italiano,10,2,"May 17, 2013",Tucson,/Restaurant_Review-g28970-d524856-Reviews-Bistro_Italiano-Washington_DC_District_of_Columbia.html,4.0,51,"Washington, DC",Jude J,38.8949549,-77.0366456,32.2217422,-110.9264759,1951.8242584749091,False,350.0
4.0,Not that good food,"We have found the restaurant via TripAdvisor and we thought that we would give it a try even if it had received some mixed reviews.
We both got spaghetti with tomato sauce and meatballs together with a ceasar salad. The dish was very boring as it was as if they did not use any herbs and spices in either the...


More",Bistro Italiano,16,1,"May 10, 2013",,/Restaurant_Review-g28970-d524856-Reviews-Bistro_Italiano-Washington_DC_District_of_Columbia.html,2.0,51,"Washington, DC",Lundepyg,38.8949549,-77.0366456,,,,,318.0
4.0,very good tomato sauce,"Six of us ate here in April 2013. They are family friendly.
We had mussels and several entree dishes. Most had a delicious, thick red tomato sauce. Service was excellent, atmosphere was excellent.
The only disappointment was the tiramisu, which was really a tiramisu layer cake.",Bistro Italiano,107,34,"April 24, 2013","Haverhill, Massachusetts, United States",/Restaurant_Review-g28970-d524856-Reviews-Bistro_Italiano-Washington_DC_District_of_Columbia.html,4.0,51,"Washington, DC",GwenM100,38.8949549,-77.0366456,42.7762015,-71.0772796,411.2362670830068,False,278.0
4.0,Got better when I wasn't paying attention!,"My visit to this lovely tucked-away-just-off-Massachusetts Capitol Hill restaurant surprised me in a good way. A friend and I chose it mainly because a private party closed our intended restaurant; an earlier visit there had been light on ambiance and over-heavy on garlic.
Some renovations, perhaps not so recently, have changed things. We found attentive service, improved surroundings, and tasty...


More",Bistro Italiano,126,33,"March 22, 2013","Washington DC, District of Columbia",/Restaurant_Review-g28970-d524856-Reviews-Bistro_Italiano-Washington_DC_District_of_Columbia.html,4.0,51,"Washington, DC",Kim T,38.8949549,-77.0366456,38.8949549,-77.03664559999999,1.3688331711774772e-12,True,408.0
4.0,Real Old Time Italian,"Bistro Italiano is old time Italian done right. Cute little restaurant in the Capitol Hill neighborhood - 3 long blks from Union Station - an easy walk and well worth it!
Nice wine list and reasonably priced
The food is classic old Italian comfort food
Very reasonably priced",Bistro Italiano,124,56,"March 6, 2013","Washington, DC",/Restaurant_Review-g28970-d524856-Reviews-Bistro_Italiano-Washington_DC_District_of_Columbia.html,4.0,51,"Washington, DC",HillTraveller,38.8949549,-77.0366456,38.8949549,-77.03664559999999,1.3688331711774772e-12,True,275.0
4.0,Nice neighborhood cafe,"Food is very good and priced reasonably. Service is friendly and prompt. Great place to meet friends for good food and a glass of wine on Capitol hill just a block and a half from Union Station and a few blocks from the Capitol. Only seats around 25, so call ahead for dinner.",Bistro Italiano,76,37,"December 27, 2012","Oxford, Mississippi",/Restaurant_Review-g28970-d524856-Reviews-Bistro_Italiano-Washington_DC_District_of_Columbia.html,4.0,51,"Washington, DC",OleManRiver,38.8949549,-77.0366456,34.366412700000005,-89.5187664,759.8573017332686,False,276.0
