restaurant_overall_rating,user_review_title,user_review,restaurant_name,user_num_reviews,user_helpful_reviews,user_review_date,user_location,restaurant_url,user_rating,restaurant_num_reviews,restaurant_location,user_name,restaurant_latitude,restaurant_longitude,user_latitude,user_longitude,user_restaurant_distance,user_is_local,user_review_length
4.0,"I wanted to love it, but didn't even like it","The location is excellent and the restaurant itself is really lovely, with inside seating that flows to the patio. The decor is well-designed. I was so excited to have another restaurant option in the Tenley/Friendship Heights area as there aren't a lot of great food choices in this area. However, both of my visits left me disappointed. First, the server...


More",Bread and Salt,136,54,"May 18, 2015","Washington DC, District of Columbia",/Restaurant_Review-g28970-d7270048-Reviews-Bread_and_Salt-Washington_DC_District_of_Columbia.html,3.0,18,"Washington, DC",WFleet,38.8949549,-77.0366456,38.8949549,-77.03664559999999,1.3688331711774772e-12,True,366.0
4.0,A Jewel of a Find,"My wife and I were passing by last evening and liked the physical plant. We went into a delightful place, large comfortably spaced tables, very nicely (and expensively) decorated. The service was great and the food was delicious. I was in the mood for a pizza and it was very good. My wife had the trout in a light,
buttery...


More",Bread and Salt,12,8,"May 16, 2015","Washington DC, District of Columbia",/Restaurant_Review-g28970-d7270048-Reviews-Bread_and_Salt-Washington_DC_District_of_Columbia.html,5.0,18,"Washington, DC",Richatd K,38.8949549,-77.0366456,38.8949549,-77.03664559999999,1.3688331711774772e-12,True,333.0
4.0,Mint juleps & the Kentucky Derby,"Very good drinks, beautiful restaurant, plentiful, responsive staff, appetizers were good - though not Mediterranean to me- we did not try them but dessert looked amazing",Bread and Salt,70,22,"May 2, 2015","Tampa, Florida",/Restaurant_Review-g28970-d7270048-Reviews-Bread_and_Salt-Washington_DC_District_of_Columbia.html,4.0,18,"Washington, DC",redhead1015,38.8949549,-77.0366456,27.947759499999997,-82.458444,816.5042548703759,False,170.0
4.0,Nice lunch option in Tenleytown,"A friend and I visited Bread and Salt for lunch on a weekday. We were impressed. The menu had a good variety of lunch foods. I ordered the Ahi Tuna Salad - presentation was great, the ingredients were delicious, and the food was tasty. Also got a fresh baked cookie for desert, because there were so many enticing baked goods...


More",Bread and Salt,105,88,"March 25, 2015","Washington DC, District of Columbia",/Restaurant_Review-g28970-d7270048-Reviews-Bread_and_Salt-Washington_DC_District_of_Columbia.html,4.0,18,"Washington, DC",VanNessVoyager,38.8949549,-77.0366456,38.8949549,-77.03664559999999,1.3688331711774772e-12,True,335.0
4.0,AAffordable Lunch Venue,"Try the Ahi Tuna Salad (with great tomatoes) and the Chicken pot pie. Both are delicious.
Then for to the bakery section and take some dessert home! Chocolate eclairs, brownies, rum ball, apple strudel. Yum.",Bread and Salt,384,124,"March 20, 2015","Washington DC, District of Columbia",/Restaurant_Review-g28970-d7270048-Reviews-Bread_and_Salt-Washington_DC_District_of_Columbia.html,4.0,18,"Washington, DC",jrjojo,38.8949549,-77.0366456,38.8949549,-77.03664559999999,1.3688331711774772e-12,True,207.0
4.0,Everything was delicious,"On our way to tour American University, we were looking for a lunch place and happened upon Bread and Salt.
The service was great and the food was equally as good.
We had the omelette, pasta a la tenley, calzone, steak panini and an excellent Bloody Mary.",Bread and Salt,121,46,"February 13, 2015","Dallas, Texas",/Restaurant_Review-g28970-d7270048-Reviews-Bread_and_Salt-Washington_DC_District_of_Columbia.html,5.0,18,"Washington, DC",CathyCole,38.8949549,-77.0366456,32.7762719,-96.7968558,1183.8183629964524,False,255.0
4.0,"So delicious, I wanted to lick the plate...","My family in DC likes Bread and Salt and have been there 5 or 6 times. Yesterday was my third dinner there and it was delightful! The first two times I had the eggplant pizza - excellent though the 2nd time the large garlic halves were not necessary - the pizza is very good without them.
Yesterday evening I ordered...


More",Bread and Salt,7,5,"February 1, 2015","Washington DC, District of Columbia",/Restaurant_Review-g28970-d7270048-Reviews-Bread_and_Salt-Washington_DC_District_of_Columbia.html,5.0,18,"Washington, DC",Eileen K,38.8949549,-77.0366456,38.8949549,-77.03664559999999,1.3688331711774772e-12,True,326.0
4.0,Needs some quick revamping,"Went to this new place for lunch (about 1:00 pm). The receptionist greeted me with ""Can I help you with something?"" Not a great signal about staff training. I was taken to a table for two in the almost empty restaurant---the table was covered with dirty dishes. The receptionist said, ""no problem, take the next table over"". During the 45-minutes...


More",Bread and Salt,341,120,"December 27, 2014",Washington DC,/Restaurant_Review-g28970-d7270048-Reviews-Bread_and_Salt-Washington_DC_District_of_Columbia.html,2.0,18,"Washington, DC",BlueNWashington,38.8949549,-77.0366456,38.8949549,-77.03664559999999,1.3688331711774772e-12,True,356.0
4.0,Shaky first impression,"we,a party of three women, went there for the first time.Its a fairly new place, so I'll be a bit careful with my judgement.
Atmosphere: lively, but not too loud.Modern,open and not very ""cozy"".TV sets showing sports on mute.
Service: friendly ( a bit too friendly,since I don't like to be touched on the shoulder or back by the waiter),but...


More",Bread and Salt,33,7,"November 7, 2014","Washington DC, District of Columbia",/Restaurant_Review-g28970-d7270048-Reviews-Bread_and_Salt-Washington_DC_District_of_Columbia.html,3.0,18,"Washington, DC",Lotte F,38.8949549,-77.0366456,38.8949549,-77.03664559999999,1.3688331711774772e-12,True,350.0
4.0,Welcome newcomer,"Bread and Salt is just off Wisconsin Avenue, north of Public Tenley and Dancing Crab. Beautiful, all-new facility is surpassed only by its attentive wait staff and quality food. This is a welcome addition to the neighborhood and worth a cross-town trip.",Bread and Salt,170,42,"October 30, 2014",WDC,/Restaurant_Review-g28970-d7270048-Reviews-Bread_and_Salt-Washington_DC_District_of_Columbia.html,5.0,18,"Washington, DC",rockwell121,38.8949549,-77.0366456,42.291954499999996,-83.71752053,422.20091637118605,False,253.0
4.0,Excellent start,"My wife and I went for dinner, and it was really very good indeed. Antipasto--excellent; steak frites--beautifully presented and very tasty (including the freshly sauteed courgettes); but the best of all were the desserts: My wife had a tarte au chocolat--she is an expert on things chocolate, and she loved it; I had ""La Brunoise"" which was a confection of...


More",Bread and Salt,118,39,"October 11, 2014","Washington DC, District of Columbia",/Restaurant_Review-g28970-d7270048-Reviews-Bread_and_Salt-Washington_DC_District_of_Columbia.html,5.0,18,"Washington, DC",StevenBeller,38.8949549,-77.0366456,38.8949549,-77.03664559999999,1.3688331711774772e-12,True,367.0
4.0,Good if a bit odd,"Oops...didnt realise this place was vegetarian! Food was pretty good...I had a reuben sandwich and partner had a burger. We also had sides of potato salad and fries respectively which were OK. Bit odd that when we told the server we didnt want sides she said they were part of the original price...on seeing the receipt we realised they werent,...


More",Native Foods Cafe,183,52,"October 11, 2015",,/Restaurant_Review-g28970-d7939723-Reviews-Native_Foods_Cafe-Washington_DC_District_of_Columbia.html,4.0,25,"Washington, DC",stonerose5,38.8949549,-77.0366456,,,,,354.0
4.0,Good food.,"I'll give a 4 star because of the food, not because of the service. I had to re order after I already paid because what I ordered they didn't have it(My first wonder was why they didn't check first). The food itself was good but I did not appreciate the hassle to actually get the food. The location is really...


More",Native Foods Cafe,17,6,"October 10, 2015",,/Restaurant_Review-g28970-d7939723-Reviews-Native_Foods_Cafe-Washington_DC_District_of_Columbia.html,4.0,25,"Washington, DC",Kdm1061,38.8949549,-77.0366456,,,,,319.0
4.0,Good for lunchbreak,"I sometime eat here during my lunch break. I like it very much and the service is fast. I recommend the portobello sandwich. Nachos are also delicious, but it is better if you share it with others (big portion). Give it a chance even if you don't eat vegan usually.",Native Foods Cafe,5,0,"September 22, 2015",,/Restaurant_Review-g28970-d7939723-Reviews-Native_Foods_Cafe-Washington_DC_District_of_Columbia.html,4.0,25,"Washington, DC",Sara B,38.8949549,-77.0366456,,,,,265.0
4.0,Excellent vegan food,"It's true that good vegan food doesn't have to resemble meat, but when you get that craving, this place is fantastic! I had a grilled ""chicken"" and avocado wrap. Delicious. Huge portions.",Native Foods Cafe,3,2,"September 19, 2015",,/Restaurant_Review-g28970-d7939723-Reviews-Native_Foods_Cafe-Washington_DC_District_of_Columbia.html,5.0,25,"Washington, DC",Mark H,38.8949549,-77.0366456,,,,,187.0
4.0,Inconsistent at best.,"Up front, I'm a strict vegan and staunch proponent of animal rights. When I come across exclusively plant-based restaurants I can't help but to write a glowing review. Native Foods Café is, typically, no exception. I've dined often at several locations and their offerings are exceptional. That said--despite my universal enthusiasm for vegan restaurants--I'm objective. Management needs to take note:...


More",Native Foods Cafe,10,0,"September 7, 2015","Arlington, Virginia",/Restaurant_Review-g28970-d7939723-Reviews-Native_Foods_Cafe-Washington_DC_District_of_Columbia.html,2.0,25,"Washington, DC",michaelahlers,38.8949549,-77.0366456,38.890396100000004,-77.0841585,2.5805753532034976,True,412.0
4.0,Great lunch,We only realised this was a vegan cafe half way through ordering - not a problem at all but we are not even vegetarian. The food was very tasty and the portions are excellent. Nice iced teas as well which went down a treat on a very hot day. I'd go again.,Native Foods Cafe,57,17,"August 25, 2015","Manchester, United Kingdom",/Restaurant_Review-g28970-d7939723-Reviews-Native_Foods_Cafe-Washington_DC_District_of_Columbia.html,4.0,25,"Washington, DC",ClaireL81,38.8949549,-77.0366456,53.4791466,-2.2447445,3549.245165030904,False,255.0
4.0,A health and fun eating spot,Tucked next to the Navy memorial on Pennsylvania Ave this vegan restaurant offers a wide range of fresh food choices. The seasonal menu choices allow for a rotating selection of food. Service is friendly with patient explanations of menu selection. Outside patio seating gives diners a pleasant view of the Navy Monument and people watching.,Native Foods Cafe,21,5,"August 19, 2015","Washington DC, District of Columbia",/Restaurant_Review-g28970-d7939723-Reviews-Native_Foods_Cafe-Washington_DC_District_of_Columbia.html,5.0,25,"Washington, DC",Timitraveler,38.8949549,-77.0366456,38.8949549,-77.03664559999999,1.3688331711774772e-12,True,341.0
4.0,"Worth a visit, at least to READ the menu!","This café menu makes an effort to replicate foods that native American would have eaten. They are not uniformly delicious now, nor were then then, no doubt.",Native Foods Cafe,9,3,"August 18, 2015","Boston, Massachusetts",/Restaurant_Review-g28970-d7939723-Reviews-Native_Foods_Cafe-Washington_DC_District_of_Columbia.html,3.0,25,"Washington, DC",L-L F,38.8949549,-77.0366456,42.3604823,-71.0595678,394.6971339457478,False,157.0
4.0,"A pleasant, delicious restaurant!!! Not pretentious, first quality food.","My grandson didn't realize he had a vegan portobello and sausage burger until he noticed after the meal that the meat was vegan. My twister wrap was delicious!! If you get a chance to try the sweet potato fries, they are yummy as well.!! I will definitely be back!!",Native Foods Cafe,123,50,"August 8, 2015","Hagerstown, Maryland",/Restaurant_Review-g28970-d7939723-Reviews-Native_Foods_Cafe-Washington_DC_District_of_Columbia.html,5.0,25,"Washington, DC",Manmap,38.8949549,-77.0366456,39.64725705,-77.69661352,62.81423031122196,False,265.0
4.0,Food Mediocre,"I have tried Native Foods Cafe at least three times for weekday lunches. I am not vegetarian, or even vegan, but I do like most veggies & try to at healthfully. I was very excited to see this open on the Navy Memorial Plaza. Yet I have been disappointed by the menu and its reliance on ""fake meat."" If you...


More",Native Foods Cafe,294,185,"July 18, 2015","La Plata, Maryland",/Restaurant_Review-g28970-d7939723-Reviews-Native_Foods_Cafe-Washington_DC_District_of_Columbia.html,3.0,25,"Washington, DC",Tiffy_Bird,38.8949549,-77.0366456,38.52928770000001,-76.9752514,25.440442641229026,True,315.0
4.0,"Very good food, Great service","This is what I would call good vegan food, fast. I am not vegan but impressive food and choices. Very friendly staff.",Native Foods Cafe,7,4,"July 14, 2015","Richmond, Virginia",/Restaurant_Review-g28970-d7939723-Reviews-Native_Foods_Cafe-Washington_DC_District_of_Columbia.html,4.0,25,"Washington, DC",PMD53,38.8949549,-77.0366456,37.53850870000001,-77.4342799,96.02676126284274,False,117.0
4.0,"We love the food, however the service suffered on this day","We visited here for dinner on July 4. The lines were long. The ice machine was down. A few tables needed to be cleared off. All the food was being served in to go containers even if dining in. It was so obvious they did not have enough staff here on this day. They had also run out of certain...


More",Native Foods Cafe,227,116,"July 11, 2015",Delaware,/Restaurant_Review-g28970-d7939723-Reviews-Native_Foods_Cafe-Washington_DC_District_of_Columbia.html,4.0,25,"Washington, DC",dewey.nikhu,38.8949549,-77.0366456,38.6920451,-75.4013315,89.38097393866553,False,302.0
4.0,I dig this place and I'm not vegetarian!,"I'm not vegetarian but this place has me hooked to its tasty 'chicken' ranch burger. And the fresh drinks they offer, especially the amazing blueberry-hibiscus tea and the watermelon fresca. Perf for summer!
Confession: I actually thought the chicken was real chicken until I took my third bite and decided to inspect the burger LOL it was so good that...


More",Native Foods Cafe,26,7,"July 9, 2015",,/Restaurant_Review-g28970-d7939723-Reviews-Native_Foods_Cafe-Washington_DC_District_of_Columbia.html,4.0,25,"Washington, DC",Ayesha C,38.8949549,-77.0366456,,,,,362.0
4.0,Yummy Vegan Food and Drinks,"On our short visit in DC, we didn't wanna spend too much time for lunch so we just went to the next café that we saw - and it happened to be the Native Foods Café. The lady who worked there, Jasmine, was one of the nicest and most helpful people I have ever met, we were literally blown away...


More",Native Foods Cafe,87,29,"July 7, 2015","Sankt Polten, Austria",/Restaurant_Review-g28970-d7939723-Reviews-Native_Foods_Cafe-Washington_DC_District_of_Columbia.html,5.0,25,"Washington, DC",Alexander A,38.8949549,-77.0366456,48.204398499999996,15.622911800000002,4408.411141050758,False,303.0
4.0,I was shocked at how awful this food was,I rarely eat meat and I was so excited to try this. It was basically raw vegetables with a tasteless dressing and fake chicken tenders. Vegetarian food can be so much better than this. Prime lunch time and there were only tourists. That should have been a warning sign.,Native Foods Cafe,54,14,"July 6, 2015","Chicago, Illinois",/Restaurant_Review-g28970-d7939723-Reviews-Native_Foods_Cafe-Washington_DC_District_of_Columbia.html,1.0,25,"Washington, DC",Michele D,38.8949549,-77.0366456,41.8755546,-87.6244212,594.7825562837824,False,269.0
4.0,Delicious vegan fare next to Archives Metro,"Great place to grab a seat and delicious vegan fare. Easy to access--right next to Archives Metro. A bit noisier than the one at 18th and M, but food is every bit as delicious.",Native Foods Cafe,23,7,"July 1, 2015","Alexandria, Virginia",/Restaurant_Review-g28970-d7939723-Reviews-Native_Foods_Cafe-Washington_DC_District_of_Columbia.html,4.0,25,"Washington, DC",VACanary,38.8949549,-77.0366456,38.8051095,-77.0470229,6.222766826830365,True,176.0
4.0,Excellent Vegan,"All vegan that is really tasty. The sandwiches are all well prepared, and the soups are delicious. The staff is friendly. The combinations on the sandwiches/wraps are quite good, and although the cold drinks are not very sweet, they are refreshing.",Native Foods Cafe,7,26,"June 30, 2015","Washington, DC",/Restaurant_Review-g28970-d7939723-Reviews-Native_Foods_Cafe-Washington_DC_District_of_Columbia.html,5.0,25,"Washington, DC",Shawndc5,38.8949549,-77.0366456,38.8949549,-77.03664559999999,1.3688331711774772e-12,True,248.0
4.0,Delicious vegan food,"I ordered the ""chicken"" ranch sandwich, which was delicious! I told the cashier that it was my first time and she was very welcoming, explaining the concept of the restaurant. I have eaten lots of fake meat products, having been vegetarian for about a decade, but the ""chicken"" on my sandwich was phenomenal! Great taste, great texture. I also got...


More",Native Foods Cafe,28,1,"June 23, 2015","Rockville, Maryland",/Restaurant_Review-g28970-d7939723-Reviews-Native_Foods_Cafe-Washington_DC_District_of_Columbia.html,4.0,25,"Washington, DC",Katherine S,38.8949549,-77.0366456,39.0840054,-77.15275729999998,14.461735716840362,True,357.0
4.0,Good option for everyone,"We stopped in this restaurant after a long day of site seeing. Our vegan family member was very happy to find this place and the rest of us were also pleased. Good sandwiches and soups. The have great lemonade and other drinks. Also had really good desserts. Right next to a metro station, so convenient access. I would definitely recommend...


More",Native Foods Cafe,12,7,"June 18, 2015","Fayetteville, Georgia",/Restaurant_Review-g28970-d7939723-Reviews-Native_Foods_Cafe-Washington_DC_District_of_Columbia.html,4.0,25,"Washington, DC",Mo M,38.8949549,-77.0366456,33.4487257,-84.4549262,559.0785215899233,False,350.0
4.0,"Not a vegan, but this place could change me!","Had the chicken bacon avocado and it was insanely good! Son had something else and his was great as well. Fries were great and there were many kinds of tea. Worth the stop, right off the metro at Navy Memorial station.",Native Foods Cafe,7,0,"June 12, 2015",Michigan,/Restaurant_Review-g28970-d7939723-Reviews-Native_Foods_Cafe-Washington_DC_District_of_Columbia.html,5.0,25,"Washington, DC",Kristina W,38.8949549,-77.0366456,43.6211955,-84.6824346,514.2960438895891,False,218.0
4.0,Very Good for a Quick Bite,"The food and service were above what I expected for a fast-food style vegan restaurant. I had an avocado wrap and some lemon-dill potato salad that was to die for. The house-made lavender lemonade was very good too. The option for beer and wine was nice to have as well. The great thing about this place, is that you won't...


More",Native Foods Cafe,59,28,"June 3, 2015","Washington DC, District of Columbia",/Restaurant_Review-g28970-d7939723-Reviews-Native_Foods_Cafe-Washington_DC_District_of_Columbia.html,4.0,25,"Washington, DC",anniemh2o,38.8949549,-77.0366456,38.8949549,-77.03664559999999,1.3688331711774772e-12,True,332.0
4.0,Unusual menu of salads/sandwiches,"A delecious Reuben sandwich of sourkraut and a mystery meat which tasted like corned beef. Unusual menu but it was good. 4/5. Service: Fast food restaurant with friendly, prompt service. 5/5.
Decor: Looked brand new with immaculate, modern, beautiful uni-sex rest rooms. 5/5. Value: 4/5 $.
Would I return? Yes.",Native Foods Cafe,129,28,"June 1, 2015","Macon, Georgia, United States",/Restaurant_Review-g28970-d7939723-Reviews-Native_Foods_Cafe-Washington_DC_District_of_Columbia.html,4.0,25,"Washington, DC",H S G,38.8949549,-77.0366456,32.8406946,-83.6324022,557.5485754956092,False,310.0
4.0,Nice option for vegans or healthy eaters,"Good portions, big flavors. Even regular meat lovers will find something to enjoy here. Plus they have a nice selection of fresh made teas, lemonades and frescas. A little pricey but good.",Native Foods Cafe,41,27,"May 27, 2015","Washington DC, District of Columbia",/Restaurant_Review-g28970-d7939723-Reviews-Native_Foods_Cafe-Washington_DC_District_of_Columbia.html,4.0,25,"Washington, DC",MFred,38.8949549,-77.0366456,38.8949549,-77.03664559999999,1.3688331711774772e-12,True,188.0
4.0,Plant based and tasty!,"Wish this chain would make it to FL! The food has lots of items vegans will love with veggies and tofu. But it also has many flavors that everyone could enjoy.
The Japanese crusted sesame",Native Foods Cafe,411,197,"May 23, 2015","Fort Lauderdale, Florida",/Restaurant_Review-g28970-d7939723-Reviews-Native_Foods_Cafe-Washington_DC_District_of_Columbia.html,5.0,25,"Washington, DC",3RedDoxies,38.8949549,-77.0366456,26.122308399999998,-80.14337859999998,898.4746114829937,False,187.0
4.0,Eh,Ok. It's five guys so you know the burgers are good but I would really like to have seen a cleaner place to eat at. Seems typical of a place in the city though.,Five Guys,53,39,"October 2, 2015","Reno, Nevada",/Restaurant_Review-g28970-d4932366-Reviews-Five_Guys-Washington_DC_District_of_Columbia.html,3.0,23,"Washington, DC",reddogsailor,38.8949549,-77.0366456,39.529270000000004,-119.8136744,2274.080352121992,False,160.0
4.0,Try the Hots!,"We got in just before a bus load of tourists...good thing! The service was kinda slow, but the hots and burgers were great. Easy to walk to several local attractions and a great place for a quick lunch. Try the cheese, bacon hot dog with onions!",Five Guys,277,68,"July 10, 2015","Raleigh, North Carolina",/Restaurant_Review-g28970-d4932366-Reviews-Five_Guys-Washington_DC_District_of_Columbia.html,4.0,23,"Washington, DC",J L,38.8949549,-77.0366456,35.7804015,-78.6390779,232.19273986783782,False,245.0
4.0,Always good,Tons of fries!! Perfect burgers!! Never disappoints! Not far from Nationals stadium! And close to the navy yard metro stop,Five Guys,58,29,"April 10, 2015","Houma, Louisiana",/Restaurant_Review-g28970-d4932366-Reviews-Five_Guys-Washington_DC_District_of_Columbia.html,4.0,23,"Washington, DC",latink,38.8949549,-77.0366456,29.5957696,-90.7195348,1009.9971389635028,False,122.0
4.0,Good burgers,I ate hear after the winter classic on the way back to the hotel. The food was good and I got a ton of extra fries like usual.,Five Guys,204,86,"February 3, 2015","Lexington Park, Maryland",/Restaurant_Review-g28970-d4932366-Reviews-Five_Guys-Washington_DC_District_of_Columbia.html,4.0,23,"Washington, DC",BorkGordon,38.8949549,-77.0366456,38.2641725,-76.45310699999997,53.7707532531815,False,126.0
4.0,Great burgers!,"After exploring the eastern parts of The Mall and The Capitol we set the goal for this restaurant. Washington DC was our first stop during our roadtrip en northeast US and Canada and we hade decided to visit this place in advance as we've heard good things about their food.
And we were not disappointed! It might have taken quite...


More",Five Guys,164,73,"January 10, 2015","Malmo, Sweden",/Restaurant_Review-g28970-d4932366-Reviews-Five_Guys-Washington_DC_District_of_Columbia.html,4.0,23,"Washington, DC",Patrik D,38.8949549,-77.0366456,55.6052931,13.000156599999999,4074.2882200524136,False,340.0
4.0,"Great Burgers, fast Service, very clean","We always liked Five Guys but this Restaurant is one of our favorites. It is very clean, the staff is friendly and fast and the Burgers are great. We usually order four different burgers and two portions of Cancun fries with drinks. We are always satisfied and leave this place happy.",Five Guys,98,19,"December 27, 2014",,/Restaurant_Review-g28970-d4932366-Reviews-Five_Guys-Washington_DC_District_of_Columbia.html,4.0,23,"Washington, DC",Lenalein N,38.8949549,-77.0366456,,,,,284.0
4.0,Good burgers,"Good choice of burgers , not long to wait for your order, also not expensive. The local police seem to like the food quite a few eating in there.",Five Guys,4,0,"September 24, 2014",,/Restaurant_Review-g28970-d4932366-Reviews-Five_Guys-Washington_DC_District_of_Columbia.html,5.0,23,"Washington, DC",Barbara W,38.8949549,-77.0366456,,,,,145.0
4.0,Five Guys is the BEST,You cannot get a better burger anywhere. They say it and it's true! The fries are as good as the burgers. Beware those with peanut or sesame allergies.,Five Guys,31,24,"September 2, 2014","Arlington, Virginia",/Restaurant_Review-g28970-d4932366-Reviews-Five_Guys-Washington_DC_District_of_Columbia.html,5.0,23,"Washington, DC",Slevinelaw,38.8949549,-77.0366456,38.890396100000004,-77.0841585,2.5805753532034976,True,151.0
4.0,Nice gluten-free option,"It was really hard for me to find places to eat being new to eating gluten and dairy-free. Five Guys offers gluten-free fries and hamburgers without buns, placed in a bowl with all the toppings you want. It tasted great and it was close to our hotel!",Five Guys,67,32,"September 2, 2014","Panama City Beach, Florida",/Restaurant_Review-g28970-d4932366-Reviews-Five_Guys-Washington_DC_District_of_Columbia.html,4.0,23,"Washington, DC",gtaylor05,38.8949549,-77.0366456,30.1765914,-85.8054879,781.038401557456,False,250.0
