restaurant_overall_rating,user_review_title,user_review,restaurant_name,user_num_reviews,user_helpful_reviews,user_review_date,user_location,restaurant_url,user_rating,restaurant_num_reviews,restaurant_location,user_name,restaurant_latitude,restaurant_longitude,user_latitude,user_longitude,user_restaurant_distance,user_is_local,user_review_length
4.0,I love it!,"I used to come here for my birthday or my wedding anniversary. It's an authentic french restaurant with the typical tiny tables. The service is very good and the homemade pasta makes you feel like you are eating in Paris!
Important: This restaurant is very crowded, so I recommend with reservation.",Bistro Francais,163,37,"November 17, 2012","Washington DC, District of Columbia",/Restaurant_Review-g28970-d456728-Reviews-Bistro_Francais-Washington_DC_District_of_Columbia.html,5.0,206,"Washington, DC",Viajeroconbuengusto,38.8949549,-77.0366456,38.8949549,-77.03664559999999,1.3688331711774772e-12,True,298.0
4.0,Great Food,"This was our 3rd time dining here and probably the best. Our server, Thierry, was excellent. The restaurant was busy but he was very professional and was cool under fire. We noticed that many of the diners were speaking french which bodes well for the reputation of the restaurant. We had the ribeye steak w/wine sauce and coq st. jaques...


More",Bistro Francais,169,63,"November 15, 2012","Schuylkill Haven, Pennsylvania",/Restaurant_Review-g28970-d456728-Reviews-Bistro_Francais-Washington_DC_District_of_Columbia.html,5.0,206,"Washington, DC",gary r,38.8949549,-77.0366456,40.630646399999996,-76.171054,128.30785301194035,False,347.0
4.0,Old world charm and an excellent menu,"Walking through Georgetown we settled on this spot for wine and a late light lunch. They seated us at table next to two large opened windows that allowed us to take in the fall weather and people watch from the comfort of the interior. The wine list wasn't extensive but all of the choices were excellent and served promptly at...


More",Bistro Francais,75,39,"October 28, 2012","Jacksonville Beach, Florida",/Restaurant_Review-g28970-d456728-Reviews-Bistro_Francais-Washington_DC_District_of_Columbia.html,4.0,206,"Washington, DC",jax848,38.8949549,-77.0366456,30.2946859,-81.3931396,642.5101398513843,False,337.0
4.0,Great meal in Georgetown,"Everything everyone had at our table was fantastic at this restaurant. Fabulous duck breast, incredibly tasty steak. The prix fixe 3 course dinner at $37 was a terrific value and the atmosphere was very charming to boot. They were crowded and service was a little slow, so don't go if you are in a hurry and it is a Saturday...


More",Bistro Francais,4,1,"October 22, 2012","Chicago, Illinois",/Restaurant_Review-g28970-d456728-Reviews-Bistro_Francais-Washington_DC_District_of_Columbia.html,5.0,206,"Washington, DC",ChicagoTraveler633,38.8949549,-77.0366456,41.8755546,-87.6244212,594.7825562837824,False,334.0
4.0,John R.,"I have been a patron for more than 25 years. Birthdays, Sunday brunch, or a weekend treat I have never been disappointed. The food has always been delicious and the service excellent.",Bistro Francais,1,0,"October 16, 2012",,/Restaurant_Review-g28970-d456728-Reviews-Bistro_Francais-Washington_DC_District_of_Columbia.html,5.0,206,"Washington, DC",jreid348,38.8949549,-77.0366456,,,,,183.0
4.0,Great Bistro In The Heart of Georgetown,Stumbled on this wonderful find. Typical French bistro atmosphere and food. They are celebrating their 37th anniversary and are offering a special for $37.00. This includes from appetizer to dessert. Great staff - very attentive. We were all very pleased.,Bistro Francais,25,8,"October 6, 2012",,/Restaurant_Review-g28970-d456728-Reviews-Bistro_Francais-Washington_DC_District_of_Columbia.html,5.0,206,"Washington, DC",James M,38.8949549,-77.0366456,,,,,255.0
4.0,Nice French food in the center of Georgetown,A little bit of Paris in Georgetown. I always enjoy trying French restaurants whenever we travel and had dinner here on the last night of our trip to D.C. Well worth it as the food is delicious and the service was very friendly.,Bistro Francais,20,10,"October 6, 2012",New Jersey,/Restaurant_Review-g28970-d456728-Reviews-Bistro_Francais-Washington_DC_District_of_Columbia.html,5.0,206,"Washington, DC",flfama,38.8949549,-77.0366456,40.0757384,-74.4041622,162.5911551728727,False,228.0
4.0,Authentic French Bistro,"Bistro Francais is a French Bistro in every way. Every time we come to DC we have lunch there. Food is always excellent and the service is without fault. The ambiance is superb. Get a table near the front window and look out onto people coming and going in Georgetown. There lunch special is wonderful for $19;95: glass of french...


More",Bistro Francais,53,17,"August 9, 2012","Albuquerque, New Mexico",/Restaurant_Review-g28970-d456728-Reviews-Bistro_Francais-Washington_DC_District_of_Columbia.html,5.0,206,"Washington, DC",Roberto87112,38.8949549,-77.0366456,35.0841034,-106.6509851,1651.6825000539682,False,339.0
4.0,"Disappointing meal, average food and below average service","The restaurant is conveniently located in the heart of Georgetown and we had no problem getting reservations on the same day. We chose the ""early bird"" 3 course fixed price dinner. The vichyssoise was advertised as being served cold but came out hot, and without much flavor. Mussels Nicoise were flavorful. A long period passed between our starters and the...


More",Bistro Francais,31,57,"July 24, 2012","San Francisco, California",/Restaurant_Review-g28970-d456728-Reviews-Bistro_Francais-Washington_DC_District_of_Columbia.html,3.0,206,"Washington, DC",jwfromSF,38.8949549,-77.0366456,37.7792768,-122.41927040000002,2440.8398793230926,False,367.0
4.0,a bit price for what it is,"two persons - no starters - two main courses - two desserts - bottle of wine usd38 - 124usd.
We ordered the lamb shank with couscous however no shank and it was a mixture of different meats. Taste was weak.
Would i go back ? maybe",Bistro Francais,68,45,"July 19, 2012","Washington DC, District of Columbia",/Restaurant_Review-g28970-d456728-Reviews-Bistro_Francais-Washington_DC_District_of_Columbia.html,3.0,206,"Washington, DC",FrequentTraveller400,38.8949549,-77.0366456,38.8949549,-77.03664559999999,1.3688331711774772e-12,True,230.0
4.0,Great Spot,"The server was efficient and knowledgeable. Food was excellent, we arrived in time for the 3 course fixed price menu, good choices, and the food did not disappoint. Excellent wine list.
Worth a stop.",Bistro Francais,19,1,"July 19, 2012","Toronto, Canada",/Restaurant_Review-g28970-d456728-Reviews-Bistro_Francais-Washington_DC_District_of_Columbia.html,5.0,206,"Washington, DC",IMF57,38.8949549,-77.0366456,43.6529206,-79.3849008,350.3224729993701,False,199.0
4.0,Not as it was years ago--neither is Georgetown.,"Ate an early dinner this week for my BD. We sat at the open window hoping to see the passing crowds. Bus stop is directly in front and a bus stopped every 5 minutes or more. Not the crowd you want standing near your window, noisy bus, beeping, etc. Champagne was $15/glass, a bit steep for house champagne. Salad was...


More",Bistro Francais,352,135,"June 16, 2012",virginia,/Restaurant_Review-g28970-d456728-Reviews-Bistro_Francais-Washington_DC_District_of_Columbia.html,3.0,206,"Washington, DC",yahootraveler64,38.8949549,-77.0366456,37.1232245,-78.4927721,145.75460982304784,False,326.0
4.0,Late night treat!,"One thing about DC all travelers should be aware of is that places close early! However, Bistro Francais is a great late night venue! Great food and great staff!!",Bistro Francais,12,3,"June 11, 2012","Boston, Massachusetts",/Restaurant_Review-g28970-d456728-Reviews-Bistro_Francais-Washington_DC_District_of_Columbia.html,4.0,206,"Washington, DC",Hbone14,38.8949549,-77.0366456,42.3604823,-71.0595678,394.6971339457478,False,162.0
4.0,Unique ambience. Nice restaurant,"I went there late evening and ordered cesar salad. It was very fresh and was very delicious. One the best salads I have had for a long time.
In the next visit, I ordered the menu with crushed lamb sausage but it was only ok :(",Bistro Francais,83,46,"May 23, 2012","Jakarta, Indonesia",/Restaurant_Review-g28970-d456728-Reviews-Bistro_Francais-Washington_DC_District_of_Columbia.html,4.0,206,"Washington, DC",Eas_Bandung,38.8949549,-77.0366456,-6.1753941,106.82718259999999,10165.282406262297,False,226.0
4.0,A cosy and happy place in Georgetown,"Even thoug the chopped steak is not different from a meatball, Bistro Français offers a very cosy atmosphere with the happy crowd inside. You can try the meal of the day or just order seperately. I recommend the lamb steak.",Bistro Francais,50,40,"May 14, 2012",istanbul,/Restaurant_Review-g28970-d456728-Reviews-Bistro_Francais-Washington_DC_District_of_Columbia.html,5.0,206,"Washington, DC",hakanakdag58,38.8949549,-77.0366456,41.0096334,28.9651646,5230.413033956725,False,224.0
4.0,Taste of France,"The decor in this French bistro on M Street will make you feel as if you are in Paris. Although some of the selections are generously priced- such as a glass of wine for $11 and some of the main courses- you can eat exceptionally well by choosing from the prix fixe menu. From this menu I had a very...


More",Bistro Francais,23,13,"May 9, 2012","New York City, New York",/Restaurant_Review-g28970-d456728-Reviews-Bistro_Francais-Washington_DC_District_of_Columbia.html,4.0,206,"Washington, DC",stir-gently,38.8949549,-77.0366456,40.730599100000006,-73.9865812,205.8262086077873,False,309.0
4.0,Cute restaurant with OK food,"Quaint restaurant, good service, nice wine list. The food was mediocre at best.",Bistro Francais,122,56,"May 3, 2012","Princeton, NJ",/Restaurant_Review-g28970-d456728-Reviews-Bistro_Francais-Washington_DC_District_of_Columbia.html,4.0,206,"Washington, DC",susannTheGo,38.8949549,-77.0366456,40.3492744,-74.6592958,161.71220267037816,False,79.0
4.0,Still a great Restaurant,"We went there for a late diner, overall it was excellent, our server was very nice and polite. The food was simple, delicious and well prepared. I have not been to this restaurant in years and was not dissapointed.
Thank you.",Bistro Francais,23,9,"May 1, 2012",nashville,/Restaurant_Review-g28970-d456728-Reviews-Bistro_Francais-Washington_DC_District_of_Columbia.html,4.0,206,"Washington, DC",jcmpisco,38.8949549,-77.0366456,36.1622296,-86.774353,566.7091028370305,False,225.0
4.0,Georgetown Treasure,"We dined here at lunch with family who are regular customers - no wonder. Traditional atmosphere with friendly service in a quiet setting. We hear chefs dine here after their own places are closed - no wonder. The food was fabulous. I had the trout in beurre blanc and it was fantastic - my companions all loved their choices as...


More",Bistro Francais,111,85,"April 27, 2012","Toronto, Canada",/Restaurant_Review-g28970-d456728-Reviews-Bistro_Francais-Washington_DC_District_of_Columbia.html,5.0,206,"Washington, DC",Stewsview,38.8949549,-77.0366456,43.6529206,-79.3849008,350.3224729993701,False,338.0
4.0,Another decent 'local' GT bistro,"Good, simple, French fare. Decent adult resto. Not at all bad, I just don't like eating on the main street.",Bistro Francais,26,4,"April 20, 2012",DC,/Restaurant_Review-g28970-d456728-Reviews-Bistro_Francais-Washington_DC_District_of_Columbia.html,3.0,206,"Washington, DC",Jaaz182,38.8949549,-77.0366456,38.89366125,-76.98788315,2.630158432758043,True,107.0
4.0,Great Value. Real French Food.,"What a surprise here. I thought this might have been a mediocre bistro, you know, overpriced in Georgetown for tourists... No. This was great french food, better than bistro du coin in dupont. Here is why.
We got everything. The onion tart was tasty like quiche and fresh. The spinach salad was dressed perfectly, with chunks of blue cheese and...


More",Bistro Francais,55,27,"April 15, 2012","Vienna, Virginia",/Restaurant_Review-g28970-d456728-Reviews-Bistro_Francais-Washington_DC_District_of_Columbia.html,5.0,206,"Washington, DC",annite57,38.8949549,-77.0366456,38.9013013,-77.2651585,12.32559072155809,True,354.0
4.0,So fab!,"Delicious and authentic French food in Georgetown served by a charming French speaking, multiple lingual waiters. The food was excellent and the wine list superb. I would highly recommend.",Bistro Francais,158,77,"April 9, 2012","Okemos, Michigan",/Restaurant_Review-g28970-d456728-Reviews-Bistro_Francais-Washington_DC_District_of_Columbia.html,5.0,206,"Washington, DC",Lawflake,38.8949549,-77.0366456,42.721839,-84.42818299999998,468.66777884857277,False,188.0
4.0,Went for an impromptu lunch,"We LOVE this restaurant, so while on a day trip down to Georgetown, we had to stop in. It actually became our sole reason for going down, after our original plans did not pan out. We of course ordered the escargot, and I ended up w/ a remarkable chicken sandwich. Sounds simple, yes, but it was delicious! We have previously...


More",Bistro Francais,112,34,"April 8, 2012","Newark, Delaware",/Restaurant_Review-g28970-d456728-Reviews-Bistro_Francais-Washington_DC_District_of_Columbia.html,5.0,206,"Washington, DC",Shellyduchsk8s,38.8949549,-77.0366456,39.6852191,-75.75082890000002,87.87985389775722,False,334.0
4.0,Great restaurant,"Nice looking restaurant. Serves good, tasty food and the staff were very friendly and helpful. Bit pricey but worth it.",Bistro Francais,62,16,"March 27, 2012",Winchester,/Restaurant_Review-g28970-d456728-Reviews-Bistro_Francais-Washington_DC_District_of_Columbia.html,4.0,206,"Washington, DC",KFF77,38.8949549,-77.0366456,39.18577620000001,-78.1631434,63.83541603298927,False,119.0
4.0,Avoid this one.,"Bad reception by an unpleasant french woman (and I am french!). Tables are just next to one another. We sat, looked around, and left.",Bistro Francais,59,34,"March 25, 2012","Marseille, France",/Restaurant_Review-g28970-d456728-Reviews-Bistro_Francais-Washington_DC_District_of_Columbia.html,1.0,206,"Washington, DC",SFresh118,38.8949549,-77.0366456,43.2961743,5.3699525,4131.097233175229,False,133.0
4.0,"Dont do the steak, presentation a bit strange","My wife had the minute steak, which was very tough. I had the venison, which was great, but served with an unappetising looking chestnut puree. Good but expensive wine selection.",Bistro Francais,42,13,"March 17, 2012",,/Restaurant_Review-g28970-d456728-Reviews-Bistro_Francais-Washington_DC_District_of_Columbia.html,3.0,206,"Washington, DC",Mattnott118,38.8949549,-77.0366456,,,,,178.0
4.0,Underwhelming and a little tired,"Full disclosure: I was a sous-chef in a French restaurant in the US in the 1970s, and I lived in the south of France for 2 years. I groan whenever someone suggests a ""French"" restaurant in the US. This time, it was a old friends and I knew they wanted to dine there so I said sure. What a bore...


More",Bistro Francais,153,79,"February 24, 2012","Rochester, NY",/Restaurant_Review-g28970-d456728-Reviews-Bistro_Francais-Washington_DC_District_of_Columbia.html,3.0,206,"Washington, DC",jlle,38.8949549,-77.0366456,43.185475399999994,-77.61068605,297.5855423795792,False,303.0
4.0,True and Authentic Night at the Bistro,Bistro Francais was a great place for authentic French food. You have to start with the French Onion Soup. It was so super-tasty! The entrees were French comfort food. I felt like I was in a little place in Paris.,Bistro Francais,14,6,"February 21, 2012","Indianapolis, Indiana",/Restaurant_Review-g28970-d456728-Reviews-Bistro_Francais-Washington_DC_District_of_Columbia.html,5.0,206,"Washington, DC",carolynbs4,38.8949549,-77.0366456,39.7683331,-86.15835009999998,492.17491396310663,False,213.0
4.0,So noisy,"Food is ok most of the time, not a dining experience but convenient and well located but Hell so noisy",Bistro Francais,57,55,"February 19, 2012","Washington DC, District of Columbia",/Restaurant_Review-g28970-d456728-Reviews-Bistro_Francais-Washington_DC_District_of_Columbia.html,3.0,206,"Washington, DC",picalexandre,38.8949549,-77.0366456,38.8949549,-77.03664559999999,1.3688331711774772e-12,True,102.0
4.0,A Favorite.,"Bistro Francais is a must, whenever we go to DC. We have been going there for years. Love to sit at the little window tables, discuss the menu with the staff,order our meal, sit back relax and just enjoy the evening.",Bistro Francais,116,64,"February 11, 2012","EHT, NJ",/Restaurant_Review-g28970-d456728-Reviews-Bistro_Francais-Washington_DC_District_of_Columbia.html,4.0,206,"Washington, DC",vdas,38.8949549,-77.0366456,,,,,216.0
4.0,Best Eggs Benedict,"I have been going here for Eggs Benedict for more than 20 years. I am always tempted to get something else but I can't get past the eggs.
The eggs are perfectly cooked. The are served with McDonalds style french fries which are perfect with the hollandaise sauce. Just perfect. I",Bistro Francais,102,22,"January 30, 2012","Charlottesville, Virginia",/Restaurant_Review-g28970-d456728-Reviews-Bistro_Francais-Washington_DC_District_of_Columbia.html,4.0,206,"Washington, DC",VirginiaFarmer,38.8949549,-77.0366456,38.029306,-78.4766781,98.30399661912489,False,279.0
4.0,Touristy but fun.,"The food was ok - but it's a great deal for a French restaurant in super touristy Georgetown, and one of the only places open late at night. They have an early bird special that begins at 11pm. With a cool international crowd and old parisian atmosphere, it's got a lot of character.",Bistro Francais,10,0,"January 21, 2012","Washington DC, District of Columbia",/Restaurant_Review-g28970-d456728-Reviews-Bistro_Francais-Washington_DC_District_of_Columbia.html,3.0,206,"Washington, DC",DCLocal75,38.8949549,-77.0366456,38.8949549,-77.03664559999999,1.3688331711774772e-12,True,283.0
4.0,excellent early bird menu,it is a nece combination at lower price you can get before 7 pm.,Bistro Francais,379,305,"January 19, 2012","Washington DC, District of Columbia",/Restaurant_Review-g28970-d456728-Reviews-Bistro_Francais-Washington_DC_District_of_Columbia.html,4.0,206,"Washington, DC",darwinsail,38.8949549,-77.0366456,38.8949549,-77.03664559999999,1.3688331711774772e-12,True,64.0
4.0,The best French food you can find in DC,"I love to go this place for lunch as it has a three-course meal with glass of wine for only $19.95 and it feels just like you are in France! The bread is fresh, smooth and crusty and you have a choice of three starters, meat or fish typical French dishes for main and a tray of fresh delicious French...


More",Bistro Francais,20,20,"January 17, 2012","Washington DC, District of Columbia",/Restaurant_Review-g28970-d456728-Reviews-Bistro_Francais-Washington_DC_District_of_Columbia.html,5.0,206,"Washington, DC",globesurfer11,38.8949549,-77.0366456,38.8949549,-77.03664559999999,1.3688331711774772e-12,True,310.0
4.0,Delightful Dining in Georgetown,Lunch at Bistro is a real treat. The selection is excellent and the sauce on my beef kabob was delicious. The strawberry tart was delectable. What an excellent dining experience...,Bistro Francais,38,10,"January 17, 2012","Aldie, Virginia",/Restaurant_Review-g28970-d456728-Reviews-Bistro_Francais-Washington_DC_District_of_Columbia.html,5.0,206,"Washington, DC",hillbarb007,38.8949549,-77.0366456,38.9758064,-77.64284029999997,33.13211279953707,True,180.0
4.0,"Food is good , definitively pricy...","Had dinner with my wife. We shared a starter made of 6 snails, then each of us had a main meal. I chose Espadon, slightly overcooked unfortunately, but equally as disturbing was the thickness of the fish filet
Was still hungry, so had a creme brulee, just as thick as the fish...I know Georgetown is known to be expensive but...


More",Bistro Francais,38,13,"January 12, 2012","Denver, Colorado",/Restaurant_Review-g28970-d456728-Reviews-Bistro_Francais-Washington_DC_District_of_Columbia.html,3.0,206,"Washington, DC",Eric046,38.8949549,-77.0366456,39.7391536,-104.9847034,1492.6834111486821,False,335.0
4.0,A Delight!,We stopped in this little gem as a last-ditch effort for a nice dinner after an unsuccessful dining experience at a different restaurant several neighborhoods away. We loved it! The food was authentic and we felt like we were transported to Paris. A great surprise!,Bistro Francais,33,14,"January 10, 2012",Philadelphia,/Restaurant_Review-g28970-d456728-Reviews-Bistro_Francais-Washington_DC_District_of_Columbia.html,4.0,206,"Washington, DC",rubyred582,38.8949549,-77.0366456,39.952335,-75.16378900000002,123.94015589510353,False,265.0
4.0,If You Love Old-School French Bistro--This Is Your Place!,"After coming back from a nice after- Christmas weekend in DC, it occured to me that I had not written a review of this great place. We've been dining here for four years--since my daughter attended U of MD. We've always returned for a nice, relaxing, old-school, French Bistro meal here and have never been dissappointed.
Bistro Francais is situated...


More",Bistro Francais,91,143,"January 8, 2012","Philadelphia, Pennsylvania",/Restaurant_Review-g28970-d456728-Reviews-Bistro_Francais-Washington_DC_District_of_Columbia.html,5.0,206,"Washington, DC",jarona,38.8949549,-77.0366456,39.952335,-75.16378900000002,123.94015589510353,False,359.0
4.0,Excellent French Food,"At one time, french food was all the rage in DC. Now, you don't see it as much. This place is the standard for bistro fare in DC. Well prepared good service. The only problem is that it's in Georgetown and parking is a hassle. Drive around north of M and you'll find a space on the street. Or better...


More",Bistro Francais,124,95,"December 23, 2011",Northern Virginia,/Restaurant_Review-g28970-d456728-Reviews-Bistro_Francais-Washington_DC_District_of_Columbia.html,4.0,206,"Washington, DC",johnsmith47,38.8949549,-77.0366456,38.8389483,-77.11228799,5.618324263387656,True,309.0
4.0,Love their Menu and Prices,"Great place right on 'M' Street if you want a great meal at a reasonable price. Their chicken dishes are especially appealing even if you don't normally go 'French'. Service is great and they have a ""huge"" menu!!! A definite ""go to"" for me anytime I'm in town.",Bistro Francais,400,178,"December 14, 2011","Berkeley Heights, New Jersey",/Restaurant_Review-g28970-d456728-Reviews-Bistro_Francais-Washington_DC_District_of_Columbia.html,4.0,206,"Washington, DC",TonyK300,38.8949549,-77.0366456,40.6834349,-74.442653,185.14913230186647,False,260.0
4.0,Feels like you are in Paris,"I love to go here when I am in DC. While I've never had dinner here, I have been several times for lunch and always have enjoyed the food, the atmosphere and the service. They offer a wonderfully tasty and reasonably price lunch special with a number of choices off of the main menu. Great value!",Bistro Francais,55,29,"November 13, 2011","Frederick, Maryland",/Restaurant_Review-g28970-d456728-Reviews-Bistro_Francais-Washington_DC_District_of_Columbia.html,4.0,206,"Washington, DC",robtlinda,38.8949549,-77.0366456,39.414443,-77.4105783,41.080212231903225,True,296.0
4.0,value,Went at tea time special excllent food and value whilst on holiday in Georgetown,Bistro Francais,51,12,"October 8, 2011",doncaster,/Restaurant_Review-g28970-d456728-Reviews-Bistro_Francais-Washington_DC_District_of_Columbia.html,5.0,206,"Washington, DC",redleader57,38.8949549,-77.0366456,53.5227681,-1.1335312,3592.4568846793404,False,80.0
4.0,Not very good,I did not like my meal and had to send it back. As soon as the waiter brought me my plate of veal kidney I knew that it was not correct. The rest of my dinner was nothing to write about. Much better French food in DC.,Bistro Francais,29,15,"August 16, 2011","Washington DC, District of Columbia",/Restaurant_Review-g28970-d456728-Reviews-Bistro_Francais-Washington_DC_District_of_Columbia.html,2.0,206,"Washington, DC",kevinJ75,38.8949549,-77.0366456,38.8949549,-77.03664559999999,1.3688331711774772e-12,True,217.0
4.0,They double charged the drinks and the dessert in the Early Bird Menu,"As a tourist family, after along museum day, we dined at Bistro Francais. The protions were small, the bench my husband sat was low and uncomfortable. It looked more like a church bench then a bistro bank. We oredered a vegetarian salad, a soda, a coffee, two Early bird Menus and a childrens menu. The bill was 130 $. They...


More",Bistro Francais,6,2,"August 14, 2011",istanbul,/Restaurant_Review-g28970-d456728-Reviews-Bistro_Francais-Washington_DC_District_of_Columbia.html,1.0,206,"Washington, DC",neslihank,38.8949549,-77.0366456,41.0096334,28.9651646,5230.413033956725,False,333.0
4.0,Lovely Georgetown Bistro,"We first tried this Bistro for lunch and very much enjoyed the food and ambiance. We've come back twice with a group and had the back room reserved. The food and service have been outstanding and if you take advantage of the fixed-price menu for dining before 7pm, it is an extremely good value - under $25 for three courses...


More",Bistro Francais,101,55,"July 30, 2011",Washington,/Restaurant_Review-g28970-d456728-Reviews-Bistro_Francais-Washington_DC_District_of_Columbia.html,5.0,206,"Washington, DC",Azadia,38.8949549,-77.0366456,38.8949549,-77.03664559999999,1.3688331711774772e-12,True,334.0
4.0,Degoutant - 1st time I walked out of a restaurant,"Went in hungry - ordered the recommended wine, goat cheese salad and a nice fish for main course.
The wine's smell was suspicious - a strong acid smell - but I thought we would let it rest a bit.
Then the goat cheese salad arrived. The goat cheese was spread as paste on some bread and it smelled awful. Had...


More",Bistro Francais,15,20,"April 27, 2011",bartinbxl,/Restaurant_Review-g28970-d456728-Reviews-Bistro_Francais-Washington_DC_District_of_Columbia.html,1.0,206,"Washington, DC",bartinbxl,38.8949549,-77.0366456,,,,,317.0
