restaurant_overall_rating,user_review_title,user_review,restaurant_name,user_num_reviews,user_helpful_reviews,user_review_date,user_location,restaurant_url,user_rating,restaurant_num_reviews,restaurant_location,user_name,restaurant_latitude,restaurant_longitude,user_latitude,user_longitude,user_restaurant_distance,user_is_local,user_review_length
4.0,Nice little bar,"We had been out walking for most of the day and were passing by when we thought a drink would be good. We never realised that it was happy hour, so bonus. Staff were great and very friendly. I thought that the beer would arrive in small bottles so I ordered two, was wrong as two pints were put in...


More",Dirty Martini DC,131,65,"May 20, 2014","Glasgow, United Kingdom",/Restaurant_Review-g28970-d2000113-Reviews-Dirty_Martini_DC-Washington_DC_District_of_Columbia.html,4.0,63,"Washington, DC",Jimcrawley55,38.8949549,-77.0366456,55.861146999999995,-4.2499891,3431.3993560533527,False,307.0
4.0,Great Place,"Great location, very nice place. The food was great and martinis exceptional. I would recommend this for anyone in DC.",Dirty Martini DC,91,16,"May 6, 2014","Atlanta, Georgia",/Restaurant_Review-g28970-d2000113-Reviews-Dirty_Martini_DC-Washington_DC_District_of_Columbia.html,5.0,63,"Washington, DC",ttbryan1,38.8949549,-77.0366456,33.749098700000005,-84.39018490000002,542.0876431866226,False,118.0
4.0,Great dinner location,"I had dinner and drinks at Dirty Martini with a group of colleagues while in town for a conference. We all had great food and drinks and enjoyed the atmosphere. Ravindra was our server, and he took wonderful care of us and we very much enjoyed our evening.",Dirty Martini DC,15,11,"April 2, 2014","Saint Paul, Minnesota",/Restaurant_Review-g28970-d2000113-Reviews-Dirty_Martini_DC-Washington_DC_District_of_Columbia.html,5.0,63,"Washington, DC",AT_peterson,38.8949549,-77.0366456,44.9504037,-93.10150259999999,925.2623407657671,False,256.0
4.0,Great Food,"Had the Steak, Gorgonzola mashed potatoes and carrots. It was delicious. I came there for a chocolate martini and I was not disappointed. The decor is fantastic and makes a great venue for friends getting together or an intimate dinner.",Dirty Martini DC,5,2,"January 10, 2014","Rochester, New York",/Restaurant_Review-g28970-d2000113-Reviews-Dirty_Martini_DC-Washington_DC_District_of_Columbia.html,5.0,63,"Washington, DC",Lorrie H,38.8949549,-77.0366456,43.185475399999994,-77.61068605,297.5855423795792,False,236.0
4.0,Awesome drinks,They had a great variety of drinks here and they were very tasty! The bartender was extremely friendly and recommended some great drinks! All in all a great experience.,Dirty Martini DC,13,7,"January 3, 2014","Levittown, New York",/Restaurant_Review-g28970-d2000113-Reviews-Dirty_Martini_DC-Washington_DC_District_of_Columbia.html,5.0,63,"Washington, DC",Lauu_reenn,38.8949549,-77.0366456,40.7259336,-73.51429209999998,225.98308240331892,False,168.0
4.0,Fun!,Always a fun place! Great place to have business or Birthday parties too!!! Manager is a great guy. Very personable.,Dirty Martini DC,12,4,"December 23, 2013",Derwood,/Restaurant_Review-g28970-d2000113-Reviews-Dirty_Martini_DC-Washington_DC_District_of_Columbia.html,5.0,63,"Washington, DC",Pooja k,38.8949549,-77.0366456,39.11733,-77.16109159999998,16.738402886495518,True,116.0
4.0,Space for Large Groups,"This place is not for foodies, but they have great happy hour prices; and if you are looking for space for a large group (10-20) gathering in Dupont Circle, this is a contender. We were there for happy hour on a Thursday night, and the restaurant was nearly empty the entire time. With the location, that is pretty telling.",Dirty Martini DC,69,34,"December 5, 2013","Washington, D.C.",/Restaurant_Review-g28970-d2000113-Reviews-Dirty_Martini_DC-Washington_DC_District_of_Columbia.html,3.0,63,"Washington, DC",Aussiesig,38.8949549,-77.0366456,36.29884975,-82.35919661,342.4862108550794,False,323.0
4.0,Out with the guys,"First time to this place and what a surprise. The drinks were great, food yummy, and restaurant a hot spot.",Dirty Martini DC,16,4,"December 4, 2013",tdavid1,/Restaurant_Review-g28970-d2000113-Reviews-Dirty_Martini_DC-Washington_DC_District_of_Columbia.html,4.0,63,"Washington, DC",tdavid1,38.8949549,-77.0366456,,,,,107.0
4.0,Birthday Drinks,"Thanks to the amazing staff for a great cocktail birthday evening with snacks and plates. Service, food and drinks all fantastic and the value amazing. You made my special night. Thanks to all.",Dirty Martini DC,73,30,"November 27, 2013",,/Restaurant_Review-g28970-d2000113-Reviews-Dirty_Martini_DC-Washington_DC_District_of_Columbia.html,5.0,63,"Washington, DC",Chad S,38.8949549,-77.0366456,,,,,193.0
4.0,"Nice, but noisy","The food was good, priced ""fair"" for the location and decor. Excellent service. The first floor is often used for parties, and if you're there when there is a party upstairs, forget about having a conversation at the dinner table.",Dirty Martini DC,101,44,"November 14, 2013","New York City, New York",/Restaurant_Review-g28970-d2000113-Reviews-Dirty_Martini_DC-Washington_DC_District_of_Columbia.html,3.0,63,"Washington, DC",CaptainDanny,38.8949549,-77.0366456,40.730599100000006,-73.9865812,205.8262086077873,False,230.0
4.0,great drinks,The bar is very nice and well put together. The drinks are excellent and the music is very good. A nice place to unwind after a long day or week. The staff is courteous and pleasant to talk to.,Dirty Martini DC,3,1,"October 30, 2013","Reston, Virginia",/Restaurant_Review-g28970-d2000113-Reviews-Dirty_Martini_DC-Washington_DC_District_of_Columbia.html,5.0,63,"Washington, DC",deboulos,38.8949549,-77.0366456,38.9312353,-77.35702091,17.446389410965036,True,193.0
4.0,Not so happy with happy hour,"Went here for Happy Hour one evening. Sat outside which was fun atmosphere watching all the locals come and go. My dirty martini was OK, but not great. Ordered 3 of their happy hour eats...hated them all...I'm not that picky...but felt like ""you get what you pay for"". Hostess was great...but I would not return.",Dirty Martini DC,6,3,"October 22, 2013","Chico, California, United States",/Restaurant_Review-g28970-d2000113-Reviews-Dirty_Martini_DC-Washington_DC_District_of_Columbia.html,1.0,63,"Washington, DC",Jane T,38.8949549,-77.0366456,39.728494500000004,-121.8374777,2376.120461225728,False,312.0
4.0,Good place to have drink,I didn't eat. Just had a small plate and some drink. Nothing against it and nothing special about it either,Dirty Martini DC,2,0,"October 22, 2013","Washington DC, District of Columbia",/Restaurant_Review-g28970-d2000113-Reviews-Dirty_Martini_DC-Washington_DC_District_of_Columbia.html,3.0,63,"Washington, DC",Arash Z,38.8949549,-77.0366456,38.8949549,-77.03664559999999,1.3688331711774772e-12,True,107.0
4.0,wonderful Chocolate Martini,Super martini. A good assortment of tasty appetizers. So good we went back again the following night. Made us very welcome. A friendlt spot.,Dirty Martini DC,10,3,"September 29, 2013",Brantford,/Restaurant_Review-g28970-d2000113-Reviews-Dirty_Martini_DC-Washington_DC_District_of_Columbia.html,5.0,63,"Washington, DC",Sandra P,38.8949549,-77.0366456,43.1394204,-80.26358929999998,337.9145620614309,False,140.0
4.0,Great Find,"Excellent food. Went during restaurant week (08/23/2013) for dinner. The restaurant has wonderful lounge and seating areas. I came dressed in linen shorts and a polo, but the atmosphere of DM - I would say, warrants something more dressy. I highly recommend this restaurant for couples and groups!!!",Dirty Martini DC,57,16,"August 26, 2013",Washington DC,/Restaurant_Review-g28970-d2000113-Reviews-Dirty_Martini_DC-Washington_DC_District_of_Columbia.html,5.0,63,"Washington, DC",JDT82,38.8949549,-77.0366456,38.8949549,-77.03664559999999,1.3688331711774772e-12,True,299.0
4.0,Great place for a night out.,"This place has great atmmosphere whether you're with a group or a couple. Everyone is dressed for the night out, its not too loud and the drink are really good. The food was pretty good too, I had the lamb chops and my lady had the ravioli, no complaints from either of us.",Dirty Martini DC,10,5,"August 15, 2013","Bronx, New York",/Restaurant_Review-g28970-d2000113-Reviews-Dirty_Martini_DC-Washington_DC_District_of_Columbia.html,4.0,63,"Washington, DC",Righteous A,38.8949549,-77.0366456,40.852785499999996,-73.83905374,217.08689294289675,False,273.0
4.0,Great picky things to eat.,"Great atmosphere, can be a little loud but great Friday night place to hang out. No dislikes about this bar.",Dirty Martini DC,42,18,"July 29, 2013","West Calder, United Kingdom",/Restaurant_Review-g28970-d2000113-Reviews-Dirty_Martini_DC-Washington_DC_District_of_Columbia.html,5.0,63,"Washington, DC",Lindamackay,38.8949549,-77.0366456,55.851745799999996,-3.5707343999999996,3457.3382059455057,False,108.0
4.0,Manager Dylan was too much for me.,"I loved the service My waitress was adorable and very kind, food was great my only down fall why i cant give to more stars is they have a manager/owner he told me he was named Dylan, he came to our table 20 times asking how things were never once did we have a negative comment but he kept seeming...


More",Dirty Martini DC,1,0,"April 16, 2013","Bethesda, Maryland",/Restaurant_Review-g28970-d2000113-Reviews-Dirty_Martini_DC-Washington_DC_District_of_Columbia.html,3.0,63,"Washington, DC",kasey r,38.8949549,-77.0366456,38.984826500000004,-77.0946459,6.94236273210927,True,307.0
4.0,perfect drinks,"Went to the Dirty Martini for dinner April 10, 2013. Nice setting. GREAT drinks. I had a dirty martini made with Gin. Hubby had a sazarac. He claimed it was perfect as good as NOLA. We had a reservation for 6:00. The after work crowd were filtering in. You could eat on the street or inside. We chose inside. Very...


More",Dirty Martini DC,107,37,"April 11, 2013","New York City, New York",/Restaurant_Review-g28970-d2000113-Reviews-Dirty_Martini_DC-Washington_DC_District_of_Columbia.html,5.0,63,"Washington, DC",salihora,38.8949549,-77.0366456,40.730599100000006,-73.9865812,205.8262086077873,False,323.0
4.0,Excellent Service - Fun and Good Atmosphere,"It was Ladies Night Out and so with my long time girlfriends were looking for a place to relax after a show at the Improv. The concierge at the Mayflower Hotel recommended the Dirty Martini for our Saturday outing. We went to the top floor at first but the deal was a reserved table at $200 minimum (not bad for...


More",Dirty Martini DC,67,26,"March 24, 2013","Germantown, Maryland",/Restaurant_Review-g28970-d2000113-Reviews-Dirty_Martini_DC-Washington_DC_District_of_Columbia.html,4.0,63,"Washington, DC",CezWho,38.8949549,-77.0366456,39.173162100000006,-77.2716502,22.981875852500302,True,321.0
4.0,Nice atmoshpere and good drink,"After dinner I decided to have a drink and stopped here. Location is nice on two floors. TV screens everywhere and plenty of tables to enjoy the drink.
People of different ages; it is possible to have food too.",Dirty Martini DC,202,67,"March 16, 2013","Bassano Del Grappa, Italy",/Restaurant_Review-g28970-d2000113-Reviews-Dirty_Martini_DC-Washington_DC_District_of_Columbia.html,4.0,63,"Washington, DC",Michele B,38.8949549,-77.0366456,45.7669109,11.7345178,4330.398397766742,False,210.0
4.0,Love this Place,"I loved everything about this restaurant from the decor, the staff and the food. Oh my, the food was amazing. I had the beef tenderloin, it was cooked perfectly. The best steak house I've ever been to was Carnevino in Las Vegas, and this steak was on par with that. I had the pear martini and that was scrumptous.",Dirty Martini DC,15,4,"February 3, 2013","Washington DC, District of Columbia",/Restaurant_Review-g28970-d2000113-Reviews-Dirty_Martini_DC-Washington_DC_District_of_Columbia.html,5.0,63,"Washington, DC",Angela C,38.8949549,-77.0366456,38.8949549,-77.03664559999999,1.3688331711774772e-12,True,313.0
4.0,Great Decor and Flavorful Food,"We stopped here while visiting DC for the Inauguration. We had a reservation thru Savored and I forgot the mention the 30% discount we had. Of course, they didn't point it out either even though the reservation agent made sure we would receive it (I didn't remember until now). Oh well. We had the oxtail spring roll, some specialty virgin...


More",Dirty Martini DC,68,49,"January 31, 2013",New Jersey,/Restaurant_Review-g28970-d2000113-Reviews-Dirty_Martini_DC-Washington_DC_District_of_Columbia.html,4.0,63,"Washington, DC",AfricanVenus,38.8949549,-77.0366456,40.0757384,-74.4041622,162.5911551728727,False,349.0
4.0,Happy Birthday 1/2,"We booked a table at Dirty Martini after seeing a note on Open Table. The place looked interesting, and my pal loves martinis so we decided to give it a shot on a cold Saturday night. The place was pretty, although not as attractive as the photos on the website. The staff were extremely friendly and didn't mind that we...


More",Dirty Martini DC,55,20,"January 27, 2013","Washington,DC",/Restaurant_Review-g28970-d2000113-Reviews-Dirty_Martini_DC-Washington_DC_District_of_Columbia.html,4.0,63,"Washington, DC",jan2204,38.8949549,-77.0366456,38.8949549,-77.03664559999999,1.3688331711774772e-12,True,330.0
4.0,Dirty Martini has a great chef,"I've been to the Dirty Martini before for special events and I have always enjoyed the appetizers and the staff's service. Tonight friends and I decided to have dinner. The service was quite good-- prompt and friendly. The bruschetta was crazy good: their delicious bread topped with pesto verde, goat cheese, roasted red peppers, sautéed mushrooms and mozzarella--a must order...


More",Dirty Martini DC,69,24,"January 23, 2013","MD, DC metro",/Restaurant_Review-g28970-d2000113-Reviews-Dirty_Martini_DC-Washington_DC_District_of_Columbia.html,4.0,63,"Washington, DC",food_chick1,38.8949549,-77.0366456,38.9947802,-77.0325112,6.889666512855584,True,388.0
4.0,Disappointing Birthday Celebration,"I came to Dirty Martini for my birthday celebration. I made reservations about a week in advance. During the conversation with that employee, no mention of an event was going on that night. My reservations were for 8:30, which I thought was plenty of time to enjoy dinner and drinks and celebrate my birthday with my boyfriend. When we arrived,...


More",Dirty Martini DC,1,0,"December 9, 2012","Philadelphia, Pennsylvania",/Restaurant_Review-g28970-d2000113-Reviews-Dirty_Martini_DC-Washington_DC_District_of_Columbia.html,2.0,63,"Washington, DC",Annbanan1289,38.8949549,-77.0366456,39.952335,-75.16378900000002,123.94015589510353,False,354.0
4.0,Love it!,"So much fun. Great drinks, great environment, good looking ppl. What else can I ask for. Will definetely go back",Dirty Martini DC,1,0,"November 20, 2012","Washington DC, District of Columbia",/Restaurant_Review-g28970-d2000113-Reviews-Dirty_Martini_DC-Washington_DC_District_of_Columbia.html,4.0,63,"Washington, DC",Mary H,38.8949549,-77.0366456,38.8949549,-77.03664559999999,1.3688331711774772e-12,True,112.0
4.0,"Great chow,fun drinks","Staff all smile, great cocktail artists. Easy location. Knowledgable wait staff. Creativity is king at the bar.",Dirty Martini DC,40,20,"November 16, 2012","Sparks, Maryland",/Restaurant_Review-g28970-d2000113-Reviews-Dirty_Martini_DC-Washington_DC_District_of_Columbia.html,5.0,63,"Washington, DC",Rob L,38.8949549,-77.0366456,39.5303908,-76.6458407,48.59385394360447,True,111.0
4.0,A nice surprise,"After reading reviews from people saying the food was pretty good, we decided to have dinner here on a saturday evening. I wasn't very hungry, so I took the mini crab cakes. Very well-seasoned, maybe a tiny bit on the salty side, but very fresh and pretty filling for a small plate. The person with me got the Bison Burger....


More",Dirty Martini DC,60,25,"October 7, 2012",,/Restaurant_Review-g28970-d2000113-Reviews-Dirty_Martini_DC-Washington_DC_District_of_Columbia.html,4.0,63,"Washington, DC",MyriamMaas,38.8949549,-77.0366456,,,,,333.0
4.0,Wonderful Tiki Bar,"We started with a wonderfully mixed Mai Tai and worked our way through one of the most creative cocktail lists I've seen. The bartenders were a hoot and provided a lot of entertainment with these hand mixed (and shaken) specialties. There were a lot of really unique liquors used and we were told that the juices and syrups were prepared...


More",Dirty Martini DC,431,141,"October 4, 2012","Fairfax, Virginia",/Restaurant_Review-g28970-d2000113-Reviews-Dirty_Martini_DC-Washington_DC_District_of_Columbia.html,4.0,63,"Washington, DC",ace4444,38.8949549,-77.0366456,38.8462236,-77.3063733,14.928461059194033,True,347.0
4.0,Late Night treat,"The Dirty Martini was just up from our hotel, The Mayflower Renaissance. Very handy for a late night meal. Extremely friendly waiters and waitresses and very interesting place. Food was great. Staff were efficient. Good atmosphere",Dirty Martini DC,31,16,"September 22, 2012","Lake Macquarie, Australia",/Restaurant_Review-g28970-d2000113-Reviews-Dirty_Martini_DC-Washington_DC_District_of_Columbia.html,5.0,63,"Washington, DC",dlg1000,38.8949549,-77.0366456,-33.065,151.6011111,9719.529864917813,False,230.0
4.0,Great cocktails,"We had a recent dinner out with friends at Dirty Martini. When we walked in at 7:30 on a weekend evening, the place was rather empty, but it had filled up by the time we left. The decor is modern, the noise level was not too high, and the food and drinks were good. The cocktails included a variety of...


More",Dirty Martini DC,51,27,"September 6, 2012",DC,/Restaurant_Review-g28970-d2000113-Reviews-Dirty_Martini_DC-Washington_DC_District_of_Columbia.html,4.0,63,"Washington, DC",InHouseCounsel,38.8949549,-77.0366456,38.89366125,-76.98788315,2.630158432758043,True,311.0
4.0,Just so so,We went to hear the band and have a couple of drinks. We felt that the drinks were pretty pricey and not that great. Nice venue for music.,Dirty Martini DC,40,13,"August 31, 2012","Jackson, Michigan",/Restaurant_Review-g28970-d2000113-Reviews-Dirty_Martini_DC-Washington_DC_District_of_Columbia.html,3.0,63,"Washington, DC",1982PandB,38.8949549,-77.0366456,42.246503600000004,-84.4016963,451.0347090741243,False,138.0
4.0,"Great Service, Atmosphere and Food","My friends and I were hanging out in D.C. (my first time there) looking for somewhere to have a late lunch and Dirty Martini happened to be right there. It was around 3pm so the place was pretty empty, therefore we were seated immediately. The decor of the place was nice, clean and modern. I ordered the Jalisco Burger with...


More",Dirty Martini DC,28,13,"August 28, 2012","New York, New York, United States",/Restaurant_Review-g28970-d2000113-Reviews-Dirty_Martini_DC-Washington_DC_District_of_Columbia.html,5.0,63,"Washington, DC",Patricia L,38.8949549,-77.0366456,40.730599100000006,-73.9865812,205.8262086077873,False,334.0
4.0,Hit and Miss Happy Hour,"Some of the dishes aren't good at all. Some are okay. The drinks aren't even that good. But, this location and name makes it popular.",Dirty Martini DC,138,42,"August 3, 2012",Dhaka,/Restaurant_Review-g28970-d2000113-Reviews-Dirty_Martini_DC-Washington_DC_District_of_Columbia.html,2.0,63,"Washington, DC",MiksAdventures,38.8949549,-77.0366456,23.7593572,90.3788136,8044.530316473733,False,133.0
4.0,Order the mini burgers!!,Not the same as the dirty martini in covent garden london. the bar food very nice. great cocktails. you can even tell the barmen to make you something not on the menu!,Dirty Martini DC,75,17,"July 30, 2012",London,/Restaurant_Review-g28970-d2000113-Reviews-Dirty_Martini_DC-Washington_DC_District_of_Columbia.html,4.0,63,"Washington, DC",Tintana,38.8949549,-77.0366456,51.5073219,-0.1276474,3674.6806319924717,False,167.0
4.0,Great Place,"Great service and atmosphere. The food was excellent, I ordered the Lamb Chops and Ceviche both were delicious. My husband ordered the Pork Chops and Ox Tail Spring Rools equally delicious. The wine was great I dont have a single complaint. Good food good vibes.",Dirty Martini DC,62,31,"June 24, 2012","Wellington, Florida",/Restaurant_Review-g28970-d2000113-Reviews-Dirty_Martini_DC-Washington_DC_District_of_Columbia.html,4.0,63,"Washington, DC",Cco4242,38.8949549,-77.0366456,26.658677899999997,-80.24143570000003,863.4387851566964,False,262.0
4.0,Cool atmosphere,"Drinks are very good, not too weak, not too strong - but just right. They have a very cool atmosphere and 2 floors. I got a kick out of sign on the door of women's restroom ""Dirty girls"" :) ha ha ha Staff is corteous and friendly. Nice place for happy hour/drinks after work.",Dirty Martini DC,42,24,"June 12, 2012","Reston, Virginia",/Restaurant_Review-g28970-d2000113-Reviews-Dirty_Martini_DC-Washington_DC_District_of_Columbia.html,4.0,63,"Washington, DC",Ljd619,38.8949549,-77.0366456,38.9312353,-77.35702091,17.446389410965036,True,275.0
4.0,Happy Hour,"All appetizers were $6, and specials on drinks - good time!",Dirty Martini DC,17,27,"May 31, 2012","Grosse Pointe Woods, Michigan",/Restaurant_Review-g28970-d2000113-Reviews-Dirty_Martini_DC-Washington_DC_District_of_Columbia.html,4.0,63,"Washington, DC",Sunfire30,38.8949549,-77.0366456,42.443647799999994,-82.9068603,393.63466244941156,False,59.0
4.0,"Cool place, good music.","We were visiting DC for a long weekend and we stumbled into this place (literally). We were in the club part upstairs, not the restaurant.
It was great scene, good music, good drinks and a few dancers.",Dirty Martini DC,1,0,"May 28, 2012",,/Restaurant_Review-g28970-d2000113-Reviews-Dirty_Martini_DC-Washington_DC_District_of_Columbia.html,4.0,63,"Washington, DC",A TripAdvisor Member,38.8949549,-77.0366456,,,,,201.0
4.0,Upscale bar for excellently mixed cocktails,"I have never ordered food at this bar, just some olives or other light hors d'oeuvres to accompany the drinks, so I can't comment on the food or wait staff.
I chose this bar to visit with a friend who wasn't very familiar with the area and liked more upscale bars and restaurants. We have since gone several more times,...


More",Dirty Martini DC,50,20,"March 4, 2012","Washington DC, District of Columbia",/Restaurant_Review-g28970-d2000113-Reviews-Dirty_Martini_DC-Washington_DC_District_of_Columbia.html,4.0,63,"Washington, DC",Ana_Elisa_7,38.8949549,-77.0366456,38.8949549,-77.03664559999999,1.3688331711774772e-12,True,329.0
4.0,just ok,"Was ok, but honestly fell a bit flat, I would give it a second try but to be honest was kinda like a typical hang out for older wanna bees",Dirty Martini DC,83,33,"February 13, 2012","Washington DC, District of Columbia",/Restaurant_Review-g28970-d2000113-Reviews-Dirty_Martini_DC-Washington_DC_District_of_Columbia.html,3.0,63,"Washington, DC",DCFed,38.8949549,-77.0366456,38.8949549,-77.03664559999999,1.3688331711774772e-12,True,138.0
4.0,"Expensive, but worth it - great scene, top-level drinks",This is a really cool place. Was very busy Thursday evening. They seem to take the drinks menu seriously.,Dirty Martini DC,346,184,"January 28, 2012","London, United Kingdom",/Restaurant_Review-g28970-d2000113-Reviews-Dirty_Martini_DC-Washington_DC_District_of_Columbia.html,5.0,63,"Washington, DC",Valux01,38.8949549,-77.0366456,51.5073219,-0.1276474,3674.6806319924717,False,105.0
4.0,Fun Place Good Food,"Diverse menu, attentive wait staff, good food, good location.",Dirty Martini DC,109,42,"January 3, 2012","San Clemente, CA",/Restaurant_Review-g28970-d2000113-Reviews-Dirty_Martini_DC-Washington_DC_District_of_Columbia.html,4.0,63,"Washington, DC",SanClementeViajera,38.8949549,-77.0366456,33.4270275,-117.6124179,2280.7146998779194,False,61.0
4.0,One two many,"Just a quick visit last night ended in having around 7 different martini's.
The establishment is very nice and trendy.
The drinks are expensive but if only having a few it's not to bad.
Must say it was a good night.
Would return.
As far as Martini bars go I would rate it 4/5",Dirty Martini DC,23,4,"December 20, 2011",Australia,/Restaurant_Review-g28970-d2000113-Reviews-Dirty_Martini_DC-Washington_DC_District_of_Columbia.html,4.0,63,"Washington, DC",Nick-Australia,38.8949549,-77.0366456,-27.0,133.0,10525.28895734562,False,275.0
4.0,"The Dirty Martini falls short on service, food selection, availability and preparation.","The only positive comments I have are that I was able to get a table for six with only a couple hours' notice and the owner was very friendly. We were disappointed with the Dirty Martini for a number of reasons. The menu had far fewer selections than posted on their Web page with no meatless entrees and they were...


More",Dirty Martini DC,39,15,"November 16, 2011","El Paso, Texas",/Restaurant_Review-g28970-d2000113-Reviews-Dirty_Martini_DC-Washington_DC_District_of_Columbia.html,1.0,63,"Washington, DC",Nancy C,38.8949549,-77.0366456,31.8111305,-106.5013493,1725.75408072208,False,324.0
4.0,Amazing food!,"I had the Beef Tenderloin, my lady had the lamb chops. While the beef tenderloin was amazing, the lamb chops were even better. As the name suggests, they serve up a very good dirty martini too. It's a bit pricey ($12 for a well martini), but then again this is DC...",Dirty Martini DC,204,82,"October 27, 2011","Chandler, Arizona",/Restaurant_Review-g28970-d2000113-Reviews-Dirty_Martini_DC-Washington_DC_District_of_Columbia.html,5.0,63,"Washington, DC",xJEFFROx,38.8949549,-77.0366456,33.3067132,-111.84084890000001,1972.7583340582737,False,266.0
