restaurant_overall_rating,user_review_title,user_review,restaurant_name,user_num_reviews,user_helpful_reviews,user_review_date,user_location,restaurant_url,user_rating,restaurant_num_reviews,restaurant_location,user_name,restaurant_latitude,restaurant_longitude,user_latitude,user_longitude,user_restaurant_distance,user_is_local,user_review_length
4.0,Quick Service -- OK Food!!,Good place for a quick sandwich and chips!! Also offered a few select desserts!! We had a turkey sandwich on jalapeño bread -- large enough to share!!,The Supreme Court Cafeteria,134,44,"October 11, 2015","Sarasota, Florida",/Restaurant_Review-g28970-d538718-Reviews-The_Supreme_Court_Cafeteria-Washington_DC_District_of_Columbia.html,4.0,33,"Washington, DC",Dr Tim T,38.8949549,-77.0366456,27.3364347,-82.5306527,857.4429437544624,False,151.0
4.0,GREAT place for lunch!,"I can't believe I'm giving a Cafeteria a 4 star rating, but to be honest, my meal here of rotisserie chicken was one of my favorite during my visit to the DC area. The chicken was moist, the mashed potatoes and gravy tasty, and the Mac and Cheese, had a nice toasted covering of melted cheese. The lemon cake was...


More",The Supreme Court Cafeteria,27,6,"October 10, 2015","Minneapolis, Minnesota",/Restaurant_Review-g28970-d538718-Reviews-The_Supreme_Court_Cafeteria-Washington_DC_District_of_Columbia.html,4.0,33,"Washington, DC",Cara W,38.8949549,-77.0366456,44.9772995,-93.2654692,933.4296463460747,False,322.0
4.0,Good lunch spot!,"While touring the Supreme Court, we followed the good smells into the cafeteria and decided to have lunch there. Probably a good day to do it since court wasn't in session. We were pleased with their menu choices and enjoyed it very much.",The Supreme Court Cafeteria,130,24,"October 8, 2015","Bellevue, Washington",/Restaurant_Review-g28970-d538718-Reviews-The_Supreme_Court_Cafeteria-Washington_DC_District_of_Columbia.html,4.0,33,"Washington, DC",Ruth S,38.8949549,-77.0366456,47.6144219,-122.1923372,2321.1820170893325,False,238.0
4.0,Get off the mall and try it.,"An unexpected treat while in DC. I was there in Mid September, and even at noon, it was not busy. As a matter of fact, it was me, a guard, and a staff member. The food was great and affordable. Do yourself a favor and try it.",The Supreme Court Cafeteria,25,6,"September 20, 2015","Tulsa, Oklahoma",/Restaurant_Review-g28970-d538718-Reviews-The_Supreme_Court_Cafeteria-Washington_DC_District_of_Columbia.html,4.0,33,"Washington, DC",TsaLaGi,38.8949549,-77.0366456,36.1556805,-95.9929113,1056.183894382076,False,225.0
4.0,Must See Building with Great Cafeteria,"One of the best government cafeteria experiences in DC. In a very fascinating building. There are a lot of food choices, including custom-made deli sandwiches and a very good hot food line with a constantly changing menu. The salad bar is fresh. The seating area is ample. And quite a mix of people, especially on argument days. Can't miss.",The Supreme Court Cafeteria,431,115,"September 2, 2015","Olney, Maryland",/Restaurant_Review-g28970-d538718-Reviews-The_Supreme_Court_Cafeteria-Washington_DC_District_of_Columbia.html,5.0,33,"Washington, DC",bagnato1,38.8949549,-77.0366456,39.1532123,-77.0668408,17.889076855463696,True,340.0
4.0,Pleasant Surprise,I just happened to be at the Supreme Court around lunch and was hungry. I decided to eat there and was pleasantly surprised by how good the food was and also how nice the cafeteria is. I'd certainly eat there again.,The Supreme Court Cafeteria,140,122,"August 14, 2015","Madison, Wisconsin",/Restaurant_Review-g28970-d538718-Reviews-The_Supreme_Court_Cafeteria-Washington_DC_District_of_Columbia.html,4.0,33,"Washington, DC",Mathyew,38.8949549,-77.0366456,43.074761,-89.3837613,706.2216837592798,False,215.0
4.0,Slightly off the beaten track for food,"Fun for the novelty, but the food was so-so. It's a relatively small facility, but not as busy as some of the other Capitol Hill cafeterias",The Supreme Court Cafeteria,38,6,"August 4, 2015","Washington DC, District of Columbia",/Restaurant_Review-g28970-d538718-Reviews-The_Supreme_Court_Cafeteria-Washington_DC_District_of_Columbia.html,3.0,33,"Washington, DC",LEPCT,38.8949549,-77.0366456,38.8949549,-77.03664559999999,1.3688331711774772e-12,True,139.0
4.0,Where's my grilled cheese,It took 25 minutes to get a hot dog. I should've just got one off the street. There was only 1 guy working the cafeteria which was unfair for him since more staff were in the back within view not helping him during lunch hour.,The Supreme Court Cafeteria,41,27,"June 3, 2015","Washington DC, District of Columbia",/Restaurant_Review-g28970-d538718-Reviews-The_Supreme_Court_Cafeteria-Washington_DC_District_of_Columbia.html,2.0,33,"Washington, DC",MFred,38.8949549,-77.0366456,38.8949549,-77.03664559999999,1.3688331711774772e-12,True,226.0
4.0,Not as good as expected,"So, it is a cafeteria.
I had hoped for more as I generally agree with the reviews of restaurants that we select based on past reviews.
The reviews that caused us to visit were definitely over hyped!
The food wasn't bad at all. The price was good for Washington DC but just a little high for a cafeteria.
I won't...


More",The Supreme Court Cafeteria,19,3,"April 18, 2015",,/Restaurant_Review-g28970-d538718-Reviews-The_Supreme_Court_Cafeteria-Washington_DC_District_of_Columbia.html,3.0,33,"Washington, DC",Jerrie B,38.8949549,-77.0366456,,,,,321.0
4.0,Good food,"This cafeteria has lots of good options, especially for a government building. Since you can't take food or drink into government buildings, it's important to know where you can get food!",The Supreme Court Cafeteria,1807,1906,"April 13, 2015","Washington DC, District of Columbia",/Restaurant_Review-g28970-d538718-Reviews-The_Supreme_Court_Cafeteria-Washington_DC_District_of_Columbia.html,4.0,33,"Washington, DC",WhitO5214,38.8949549,-77.0366456,38.8949549,-77.03664559999999,1.3688331711774772e-12,True,187.0
4.0,Awful awful awful,"Queued for ages behind three guys just wanting a sandwich each. Eventually asked for a burger and was directed by a very sullen woman, to a keep-warm thing, where one, sad-looking, pathetic burger sat. Picked up some other things too. All really unpleasant and quite expensive. Avoid.",The Supreme Court Cafeteria,21,18,"April 10, 2015","London, UK",/Restaurant_Review-g28970-d538718-Reviews-The_Supreme_Court_Cafeteria-Washington_DC_District_of_Columbia.html,1.0,33,"Washington, DC",UK_Lab_5105,38.8949549,-77.0366456,51.5073219,-0.1276474,3674.6806319924717,False,284.0
4.0,Intimate institutional food but you never know who will be sitting next to you,"The charm of this cafeteria is not the food, which is adequate institutional food, but the chance to be sitting next to a Justice or a famous lawyer.",The Supreme Court Cafeteria,42,5,"February 20, 2015",DC,/Restaurant_Review-g28970-d538718-Reviews-The_Supreme_Court_Cafeteria-Washington_DC_District_of_Columbia.html,3.0,33,"Washington, DC",legaleagledc,38.8949549,-77.0366456,38.89366125,-76.98788315,2.630158432758043,True,149.0
4.0,Not supreme food!,"This was basic and limited cafeteria food at best. I was very impressed with the building itself and the gift shop (located immediately across from the cafeteria) was lovely as well but the cafeteria was just OK. Considering the grand surroundings and the historical nature of the location I was a bit surprised that this wasn't a bit more elegant...


More",The Supreme Court Cafeteria,50,19,"January 23, 2015","Chicago, Illinois",/Restaurant_Review-g28970-d538718-Reviews-The_Supreme_Court_Cafeteria-Washington_DC_District_of_Columbia.html,3.0,33,"Washington, DC",Andy R,38.8949549,-77.0366456,41.8755546,-87.6244212,594.7825562837824,False,357.0
4.0,A SUPRISING TREAT!,A rather unknown smallish but wonderful in prices and foods. This is a place to rest after the the heaviness of the building above. It has the soup to nuts completeness that is very unexpected in this corner of the Mall. Lower prices than the Capitol. Note it!,The Supreme Court Cafeteria,77,35,"December 2, 2014","Oak Park, Illinois",/Restaurant_Review-g28970-d538718-Reviews-The_Supreme_Court_Cafeteria-Washington_DC_District_of_Columbia.html,5.0,33,"Washington, DC",ewhite0640,38.8949549,-77.0366456,41.885031700000006,-87.7845025,602.8823993015033,False,260.0
4.0,Nice place to relax,"This was a nice place to relax after our tour of the Supreme Court. The coffee and food is good, but the atmosphere is the best. We've been there twice and are still hoping to see one of the Justices.",The Supreme Court Cafeteria,8,3,"September 29, 2014","Cincinnati, Ohio",/Restaurant_Review-g28970-d538718-Reviews-The_Supreme_Court_Cafeteria-Washington_DC_District_of_Columbia.html,4.0,33,"Washington, DC",BlueAsh1956,38.8949549,-77.0366456,39.1014537,-84.5124602,402.5502918458391,False,200.0
4.0,Quiet break during busy day,"For our family, just having a quiet, uncrowded, cool spot to sit and regroup was worth so much. (In the museum cafes we found wall to wall people.) We combined the Supreme Court with a tour of the Capital. Wasn't sure of what we would find at the court, but so glad we stopped in. Don't skip the banana bread...


More",The Supreme Court Cafeteria,5,3,"July 29, 2014","St. Johns, Florida",/Restaurant_Review-g28970-d538718-Reviews-The_Supreme_Court_Cafeteria-Washington_DC_District_of_Columbia.html,4.0,33,"Washington, DC",Alicia L,38.8949549,-77.0366456,29.9032284,-81.4145468,668.1224433513299,False,318.0
4.0,"Lovely, especially for Supreme Court fans like us","To have the chance to eat just a few feet from law clerks, and surrounded by Supreme Court litigating lawyers is not something you may experience every day. The food is good, the variety, large, and the prices are more than reasonable. The place is quiet, and the personnel is well mannered. We have been coming here once or twice...


More",The Supreme Court Cafeteria,247,120,"June 23, 2014","Buenos Aires, Argentina",/Restaurant_Review-g28970-d538718-Reviews-The_Supreme_Court_Cafeteria-Washington_DC_District_of_Columbia.html,5.0,33,"Washington, DC",StellaPilar,38.8949549,-77.0366456,-34.612869,-58.4459789,5195.329916584663,False,340.0
4.0,Hidden gem,"I stumbled on reviews of this cafeteria while looking for reviews of the Supreme Court as an attraction and immediately made plans to have lunch here the following day while we were visiting Capitol Hill. After having lunch at one of the Smithsonians the previous day, the Supreme Court cafeteria was a welcome find. The food was more reasonably priced,...


More",The Supreme Court Cafeteria,109,71,"June 1, 2014",St. Louis,/Restaurant_Review-g28970-d538718-Reviews-The_Supreme_Court_Cafeteria-Washington_DC_District_of_Columbia.html,4.0,33,"Washington, DC",StLouisMom3,38.8949549,-77.0366456,38.62727329999999,-90.1978889,710.4319339512166,False,363.0
4.0,Best food option in the area for tourists,"Like any DC location you have to go through security to get there. But the cafeteria at the Supreme Court is open later in the afternoon. They have the usual burgers but they also offer entrees and vegetable options once you get past the burger area. Food has been good whenever I have been here and it is a great...


More",The Supreme Court Cafeteria,23,9,"May 15, 2014","Vail, AZ",/Restaurant_Review-g28970-d538718-Reviews-The_Supreme_Court_Cafeteria-Washington_DC_District_of_Columbia.html,4.0,33,"Washington, DC",Bradley_T9L,38.8949549,-77.0366456,32.010070500000005,-110.697528,1945.2993950403534,False,323.0
4.0,Very Good Value,"No crowds, good basic food and less than $20 for a family of four breakfast. We were the only people in the cafeteria. Great stop for a quick breakfast.",The Supreme Court Cafeteria,18,6,"April 14, 2014",,/Restaurant_Review-g28970-d538718-Reviews-The_Supreme_Court_Cafeteria-Washington_DC_District_of_Columbia.html,5.0,33,"Washington, DC",West90,38.8949549,-77.0366456,,,,,152.0
4.0,wide selection,"I picked a sandwich. My daughter chose rice, chicken and green beans while my son tried pho. We had bought hot dog and sandwiches from the food stand in the National Mall area. We like the supreme court cafe a lot better.",The Supreme Court Cafeteria,16,19,"August 19, 2013",Orange County,/Restaurant_Review-g28970-d538718-Reviews-The_Supreme_Court_Cafeteria-Washington_DC_District_of_Columbia.html,5.0,33,"Washington, DC",citytiger98,38.8949549,-77.0366456,33.750037799999994,-117.8704931,2286.5699482847826,False,221.0
4.0,Perfect lunch stop during tour of Capital area,"Cafeteria with a non traditional cafeteria menu. Good soups, salads, sandwiches, entrees including Thai stir fry, and sides. Prices were affordable. Dining room was clean.",The Supreme Court Cafeteria,50,14,"July 28, 2013",,/Restaurant_Review-g28970-d538718-Reviews-The_Supreme_Court_Cafeteria-Washington_DC_District_of_Columbia.html,4.0,33,"Washington, DC",PsychMike71,38.8949549,-77.0366456,,,,,171.0
4.0,"Nice place, not crowded..","I knew about this from looking online and had planned for our group to have lunch here. It worked, there is a great selection for everyone. Pizza, hot foods, and a salad bar are the norms but, as you walk in there will be a huge line at the deli sandwich counter. Why is that you asked? I will tell...


More",The Supreme Court Cafeteria,130,105,"July 25, 2013","Scottsdale, Arizona",/Restaurant_Review-g28970-d538718-Reviews-The_Supreme_Court_Cafeteria-Washington_DC_District_of_Columbia.html,4.0,33,"Washington, DC",creeker000,38.8949549,-77.0366456,33.5091215,-111.8992365,1970.8723802317759,False,308.0
4.0,We stumbled on this and glad we did,After our tour we went to the gift shop and noticed the café... We thought it may have been just for people that work there but it is open to the public. The food is good and VERY reasonably priced. It was nice to be able to sit and relax on a very hot day.,The Supreme Court Cafeteria,77,44,"July 22, 2013",,/Restaurant_Review-g28970-d538718-Reviews-The_Supreme_Court_Cafeteria-Washington_DC_District_of_Columbia.html,4.0,33,"Washington, DC",Vacationnthree,38.8949549,-77.0366456,,,,,258.0
4.0,Best place to eat,"The Supreme Court Cafeteria is a great place to eat. We live in DC and frequent the museums and attractions several times a week. We have found the best food at the most reasonable prices can be found at this intimate, clean, well-appointed cafe. The chefs work very hard to create flavorful dishes. The salad are complex, the hot meals...


More",The Supreme Court Cafeteria,15,14,"May 9, 2013",chester,/Restaurant_Review-g28970-d538718-Reviews-The_Supreme_Court_Cafeteria-Washington_DC_District_of_Columbia.html,5.0,33,"Washington, DC",werehappytotravel,38.8949549,-77.0366456,53.1908873,-2.8908955,3528.8151508553606,False,346.0
4.0,Quick Place to Eat,This is a nice place to eat that was a little less crowded than some of the other cafeterias in the mall area. The food was much the same as the other cafeterias on the mall. It was a little expensive but good.,The Supreme Court Cafeteria,100,45,"May 2, 2013","Maplewood, Minnesota",/Restaurant_Review-g28970-d538718-Reviews-The_Supreme_Court_Cafeteria-Washington_DC_District_of_Columbia.html,4.0,33,"Washington, DC",Minnpink,38.8949549,-77.0366456,44.95302150000001,-92.9952153,920.4732118917178,False,210.0
4.0,A wonderful experience!,"I went to supreme court for visiting. I was about to leave when I found this cafe, the staff were friendly, food was good and price was unbeatable.... I definitely recommend this!",The Supreme Court Cafeteria,6,2,"January 23, 2013",,/Restaurant_Review-g28970-d538718-Reviews-The_Supreme_Court_Cafeteria-Washington_DC_District_of_Columbia.html,5.0,33,"Washington, DC",Kolman879,38.8949549,-77.0366456,,,,,179.0
4.0,A hidden gem,"After hours of walking and museuming, this cafeteria in the basement of the Supreme Cout is the place to stop, have lunch and recharge. There is a self seve salad bar. The chicken rice bowl is delicious with bourbon sauce. You can order any hot or cold sandwich which is expertly made before you. The staff is competent and welcoming....


More",The Supreme Court Cafeteria,14,12,"December 11, 2012",NY,/Restaurant_Review-g28970-d538718-Reviews-The_Supreme_Court_Cafeteria-Washington_DC_District_of_Columbia.html,5.0,33,"Washington, DC",Dedede,38.8949549,-77.0366456,43.1561681,-75.84499459999998,300.56164364751254,False,344.0
4.0,Normal nothing great,Just a regular cafeteria....I suggest going to Georgetown to eat. But is is nice for a quick bite. Prices are okay. It is clean.,The Supreme Court Cafeteria,45,32,"August 31, 2012","Lancaster, Pennsylvania",/Restaurant_Review-g28970-d538718-Reviews-The_Supreme_Court_Cafeteria-Washington_DC_District_of_Columbia.html,3.0,33,"Washington, DC",lyttle6,38.8949549,-77.0366456,40.03813,-76.3056686,88.01840888017756,False,128.0
4.0,Fair prices great location,"I did not expect to find the federal cages so nice. Very clean, food selections were nicer than anticipated. Lots of fresh fruit, some veggies and less fast-foolish than anticipated. These were welcome breaks in our day.",The Supreme Court Cafeteria,61,31,"December 19, 2011",Louisiana,/Restaurant_Review-g28970-d538718-Reviews-The_Supreme_Court_Cafeteria-Washington_DC_District_of_Columbia.html,4.0,33,"Washington, DC",NawlinsGuy,38.8949549,-77.0366456,30.8703881,-92.007126,1012.3733960008531,False,220.0
4.0,Food with appeal,"Cafeteria is small, but food was tasty, and prices comparable to Russell Office Building cafeteria. Less crowded (when court is not in session) than other better known venues.",The Supreme Court Cafeteria,31,24,"October 24, 2005","Clark, SD",/Restaurant_Review-g28970-d538718-Reviews-The_Supreme_Court_Cafeteria-Washington_DC_District_of_Columbia.html,4.0,33,"Washington, DC",GustafClark_SD,38.8949549,-77.0366456,44.877743,-97.7331411,1140.4763555571622,False,175.0
4.0,Off the beaten track,"Hidden, in the heart of Capitol Hill, is the Supreme Court cafe--a small, intimate, use-friendly place to eat. Everything is ala carte and you can order hot foods, prepare your own salad or just go for light sandwiches.
I'm a seventh generation Washingtonian and recommend the Supreme Court cafe hands down",The Supreme Court Cafeteria,1,0,"August 17, 2005",,/Restaurant_Review-g28970-d538718-Reviews-The_Supreme_Court_Cafeteria-Washington_DC_District_of_Columbia.html,5.0,33,"Washington, DC",A TripAdvisor Member,38.8949549,-77.0366456,,,,,306.0
4.5,Excellent find!,"In the mood for new and different quick food in the District, I came across this spot. Good all around. Food was great. Service was relatively fast (during the lunch hour). I had the Tom Nevers (Roasted turkey, shaved ham, bacon, lettuce, tomato and mayo on triple-decker toasted sourdough), which was absolutely superb. A bit expensive at $11.95, but, what...


More",Jetties,8,2,"September 17, 2015","Culpeper, Virginia",/Restaurant_Review-g28970-d3931234-Reviews-Jetties-Washington_DC_District_of_Columbia.html,4.0,9,"Washington, DC",luv2eat2261,38.8949549,-77.0366456,38.49122070000001,-77.9618216,57.244287276422114,False,367.0
4.5,Nice for Lunch,"Went based on a recommendation from someone who loves and frequents the Georgetown location. This location is relatively new. They make really ""good"" sandwiches. I had the tuna, which was just the way I like it, and the freshly made lemonade. The atmosphere is clean, simple, with outdoor seating. Will put this on my list for good lunch spots.",Jetties,25,20,"June 26, 2015","Greenbelt, Maryland",/Restaurant_Review-g28970-d3931234-Reviews-Jetties-Washington_DC_District_of_Columbia.html,4.0,9,"Washington, DC",Ava S,38.8949549,-77.0366456,39.0045544,-76.8755282,11.509849354162952,True,344.0
4.5,Great Sandwiches!,"My older kids and I went to Jetties for a weekday lunch on the recommendation of our Segway guide and it did not disappoint. The sandwiches were some of the best we've had and that's counting a lot of sandwiches! The bread was fresh, the turkey was carved off the bird in front of you, and the choices were many....


More",Jetties,54,15,"December 8, 2014","Tustin, California",/Restaurant_Review-g28970-d3931234-Reviews-Jetties-Washington_DC_District_of_Columbia.html,5.0,9,"Washington, DC",Manray1230,38.8949549,-77.0366456,33.7458511,-117.826166,2284.2891645412,False,322.0
4.5,Good food but expensive for a sandwich,Went to their new location in Chevy chase DC. Interesting menu but 11-15$ for a sandwich seems a bit much. May return but not often. Also no convenient parking.,Jetties,69,14,"November 12, 2014","Washington, District of Columbia, United States",/Restaurant_Review-g28970-d3931234-Reviews-Jetties-Washington_DC_District_of_Columbia.html,3.0,9,"Washington, DC",Eric_W844,38.8949549,-77.0366456,38.8949549,-77.03664559999999,1.3688331711774772e-12,True,160.0
4.5,Very Filling,"I ordered a Sconset (vegetarian - hummus, avocado, cukes, carrots, thick slice of fresh tomato - and maybe something else - on bread with sesame seeds) and it was very filling. The hummus tasted homemade - unlikely that it was off the shelf. The sandwich was almost overstuffed, which made it a little sloppy to eat. My friend had turkey...


More",Jetties,98,36,"August 26, 2014","Lutherville, Maryland",/Restaurant_Review-g28970-d3931234-Reviews-Jetties-Washington_DC_District_of_Columbia.html,4.0,9,"Washington, DC",Matt P,38.8949549,-77.0366456,39.4212175,-76.6260805,42.47530137491679,True,347.0
4.5,Great Sandwich Place!,"A former coworker suggested this place for great/hearty sandwiches. I tried them yesterday for the first time. I had the Surfside sandwich. It was large and had fresh carved turkey not the thin sliced stuff. Great flavor/taste. I'll be back! The address above is incorrect, per their website it's 1921 I (Eye) St. NW near Baja Fresh. The closest Metro...


More",Jetties,158,46,"August 12, 2014","Washington, DC",/Restaurant_Review-g28970-d3931234-Reviews-Jetties-Washington_DC_District_of_Columbia.html,4.0,9,"Washington, DC",AJP57,38.8949549,-77.0366456,38.8949549,-77.03664559999999,1.3688331711774772e-12,True,361.0
4.5,Great soup and sandwiches,"My wife and I stopped here on our way back to our hotel for a bite to eat and a place to sit since we were walking back from the Capitol to 20th and I (Eye) street. We were easily the oldest people in the place, by 40 years and yet were warmly welcomed in, assisted with recommendations and had...


More",Jetties,32,25,"April 16, 2013","Long Beach, CA",/Restaurant_Review-g28970-d3931234-Reviews-Jetties-Washington_DC_District_of_Columbia.html,5.0,9,"Washington, DC",RICHnCALongBeach_CA,38.8949549,-77.0366456,33.7774658,-118.1884871,2302.9934910197694,False,304.0
4.5,So happy we stumbled on this place for lunch,"My husband and I stayed at the Hotel Lombardy and on our walk back from sightseeing near the whitehouse we stopped here for lunch. I am sure it is newly opened as I saw Grand Opening signs on their doors. It was very clean and newly remodeled looking. We were happy to find a sandwich place open for lunch on...


More",Jetties,14,11,"March 4, 2013","Appleton, Wisconsin",/Restaurant_Review-g28970-d3931234-Reviews-Jetties-Washington_DC_District_of_Columbia.html,5.0,9,"Washington, DC",Tara S,38.8949549,-77.0366456,44.26113370000001,-88.40676040000002,694.9412758407431,False,318.0
4.0,Delicious shawarma!!,"I've been to this place several times in the few months they've been open.
I've only had the lamb and beef shawarma and the kafta and they were both delicious. They were full of meat, unlike other places that give you more extras than meat.
They do not make a fuss when you ask for extra hot peppers or other...


More",Micho's Lebanese Grill,15,11,"August 14, 2015","Washington DC, District of Columbia",/Restaurant_Review-g28970-d7139549-Reviews-Micho_s_Lebanese_Grill-Washington_DC_District_of_Columbia.html,5.0,6,"Washington, DC",Alia P,38.8949549,-77.0366456,38.8949549,-77.03664559999999,1.3688331711774772e-12,True,318.0
4.0,Chicken schawarma bowl over burrito bowl any day,I had a delicious chicken schawarma bowl with hummus the other day and it was glorious. Generous servings of chicken and hummus with tomatoes and lettuce and rice and pickled cucumbers. I was in heaven! It came quick and everything was fresh. It was great!,Micho's Lebanese Grill,91,15,"June 25, 2015","Washington DC, District of Columbia",/Restaurant_Review-g28970-d7139549-Reviews-Micho_s_Lebanese_Grill-Washington_DC_District_of_Columbia.html,4.0,6,"Washington, DC",Erin S,38.8949549,-77.0366456,38.8949549,-77.03664559999999,1.3688331711774772e-12,True,256.0
4.0,Not bad,"I was in the area and stopped in for lunch the staff were nice and informative. I ordered a wheat pita with kafta , pickled this and that, onions and garlic paste. It tasted very average and i wish i had ordered a platter as i was still hungry when i finished.I would go back and give it another shot...


More",Micho's Lebanese Grill,158,42,"June 15, 2015","Fairfax, Virginia",/Restaurant_Review-g28970-d7139549-Reviews-Micho_s_Lebanese_Grill-Washington_DC_District_of_Columbia.html,3.0,6,"Washington, DC",theplumbingmedi... .,38.8949549,-77.0366456,38.8462236,-77.3063733,14.928461059194033,True,310.0
4.0,Worth a try!,"As a vegan, it can be hard to find places that affordable, this is one of those places. Good food, great service... It also happened to be maybe three doors down from where my sister and I were staying. Great atmosphere, I'll be stopping by the next time I'm in town!",Micho's Lebanese Grill,4,0,"May 28, 2015",,/Restaurant_Review-g28970-d7139549-Reviews-Micho_s_Lebanese_Grill-Washington_DC_District_of_Columbia.html,4.0,6,"Washington, DC",Shakblak,38.8949549,-77.0366456,,,,,267.0
