restaurant_overall_rating,user_review_title,user_review,restaurant_name,user_num_reviews,user_helpful_reviews,user_review_date,user_location,restaurant_url,user_rating,restaurant_num_reviews,restaurant_location,user_name,restaurant_latitude,restaurant_longitude,user_latitude,user_longitude,user_restaurant_distance,user_is_local,user_review_length
3.5,"Fast, average food","Have had way better chinese food before, their menu did not offer any dinner options (entree, rice, eggroll etc) you had to buy each item separately which added up, but they gave you more than enough food to compensate for it. Their beef and broccoli was awful, it tasted sweet and had an unwelcome flavor. Sesame chicken was below average,...


More",Wok & Roll,141,61,"November 30, 2010","Reno, Nevada",/Restaurant_Review-g28970-d1143694-Reviews-Wok_Roll-Washington_DC_District_of_Columbia.html,3.0,103,"Washington, DC",jb2186,38.8949549,-77.0366456,39.52927,-119.8136744,2274.080352121992,False,350.0
3.5,Good cheap sushi,"Discovered this place in Chinatown upon the recommendation by a friend. Although the sushi wasn't the best I've ever had, it was definitely acceptable and very reasonably priced. The service was average, and the sushi came out quickly. They also serve a number of other dishes (mainly Chinese food) but I haven't tried those. If you want basic, good sushi...


More",Wok & Roll,22,8,"October 6, 2010","Riyadh, Saudi Arabia",/Restaurant_Review-g28970-d1143694-Reviews-Wok_Roll-Washington_DC_District_of_Columbia.html,3.0,103,"Washington, DC",benmacd,38.8949549,-77.0366456,24.6319692,46.7150648,6752.21430814507,False,365.0
3.5,"Inexpensive, fast service, OK food","I had the ribs as an appetizer - I'd skip that next time. Dried out, smothered in sauce. The Scallop and Shrimp in Garlic Sauce was well prepared, but the range of vegetables mixed in left a little to be desired. Really quick service at a good price. I'll probably go back again and try the sushi - that looked...


More",Wok & Roll,72,37,"September 23, 2010","Newport, RI",/Restaurant_Review-g28970-d1143694-Reviews-Wok_Roll-Washington_DC_District_of_Columbia.html,3.0,103,"Washington, DC",NewportFisherman,38.8949549,-77.0366456,41.48998270000001,-71.3137707,351.66715971897014,False,320.0
3.5,American Chinese food,"We walked in but decide not to sit down for lunch. Instead, we ordered the bubble tea only later. I won't say they are bad but it is designed toward American tastes. There is no problem to do but people need to be aware.",Wok & Roll,41,18,"August 2, 2010","Cedar Falls, Iowa",/Restaurant_Review-g28970-d1143694-Reviews-Wok_Roll-Washington_DC_District_of_Columbia.html,3.0,103,"Washington, DC",Taiwenese,38.8949549,-77.0366456,42.52776220000001,-92.4454654,845.5946704399039,False,220.0
3.5,Great Sushi,This restaurant was about 2 blocks from my hotel in Chinatown. Don't let the exterior fool you. Good food awaits within. Ate their twice and enjoyed their sushi quite a bit.,Wok & Roll,30,17,"July 3, 2010","Tampa, FL",/Restaurant_Review-g28970-d1143694-Reviews-Wok_Roll-Washington_DC_District_of_Columbia.html,4.0,103,"Washington, DC",Duke_Ward,38.8949549,-77.0366456,27.9477595,-82.458444,816.5042548703759,False,173.0
3.5,It was OK.,It was OK. It was close to hotel and service OK. Food more than adequate,Wok & Roll,31,26,"April 18, 2010",New Jersey,/Restaurant_Review-g28970-d1143694-Reviews-Wok_Roll-Washington_DC_District_of_Columbia.html,3.0,103,"Washington, DC",auntjudy325,38.8949549,-77.0366456,40.0757384,-74.4041622,162.5911551728727,False,72.0
3.5,"New favorite Chinese place. Much better than Tony Cheng's across the street. Servings are huge, they have a few beers...","New favorite Chinese place. Much better than Tony Cheng's across the street. Servings are huge, they have a few beers (good place to start before going to anything at the Verizon Center, or the movies. Regular eggrolls are large and and not vegetarian (fyi). The Moo Shu Pork has the best pancakes we've found. The Eggplant and ground pork in...


More",Wok & Roll,161,52,"March 15, 2010","Nashville, Tennessee",/Restaurant_Review-g28970-d1143694-Reviews-Wok_Roll-Washington_DC_District_of_Columbia.html,4.0,103,"Washington, DC",DC20something,38.8949549,-77.0366456,36.1622296,-86.774353,566.7091028370305,False,352.0
3.5,Peking Duck Nirvana,"We had the most authentic Peking Duck dinner at this hole-in-the-wall (actually it is the historical building where Lincoln's assassination was plotted). Great food and homemade receipes. We spent some time in China and this was a true delight finding this place. Our entire bill for the duck, dumplings, beer and tea was less than $40.00 and that was including...


More",Wok & Roll,82,28,"December 23, 2009","Banning, California",/Restaurant_Review-g28970-d1143694-Reviews-Wok_Roll-Washington_DC_District_of_Columbia.html,5.0,103,"Washington, DC",Sunlaker,38.8949549,-77.0366456,33.9255685,-116.875289,2228.757722434392,False,371.0
3.5,They have 1$ sushi happy hour during the week from 5-8PM!,"We had an early dinner here and really enjoyed it. We ordered a couple of pieces of sushi (salmon and spicy tuna-both very fresh and tasty), the steamed pork dumplings (very flavorful, but a little doughy), sesame chicken (nicely spiced, mostly thigh meat and a few pieces of broccoli) and a crispy beef dish off of the nightly specials menu...


More",Wok & Roll,10,5,"September 22, 2009","Birmingham, Alabama",/Restaurant_Review-g28970-d1143694-Reviews-Wok_Roll-Washington_DC_District_of_Columbia.html,4.0,103,"Washington, DC",travelpage,38.8949549,-77.0366456,33.5206824,-86.80243259999996,658.9874807770664,False,351.0
3.5,Excellent choice for authentic Chinese quisine!,"We were so glad that we ate here! Very authentic, freshly-prepared, high-quality Chinese food. My husband got the sesame chicken, I got the Peking Duck-both were delicious. Also tried the Passionfruit Daquiri-wasn't expecting a great cocktail in a Chinese/Japanese restaurant, but it sure was! Also, if you're a fellow history buff, this is Mary Surratt's boarding house! I can't recommend...


More",Wok & Roll,3,1,"September 13, 2009","Tampa Bay, FL",/Restaurant_Review-g28970-d1143694-Reviews-Wok_Roll-Washington_DC_District_of_Columbia.html,5.0,103,"Washington, DC",Goldielocksraj,38.8949549,-77.0366456,27.6886419,-82.5723193,835.6600756566646,False,399.0
3.5,"Highly Rated Because It’s Cheap, But The Food Is Not Up To ""Chinatown"" Par","Ate there with my son last night. We usually have a duck dish and a pan fried noodle dish. He had wonton soup and fried dumplings that were fine. I decided to try their “Tempura Appetizer”. Bad idea. It was composed of some string beans, maybe a carrot piece, two big shiitake chunks and two shrimp. Batter was not at...


More",Wok & Roll,29,8,"July 27, 2009","Millstone, New Jersey",/Restaurant_Review-g28970-d1143694-Reviews-Wok_Roll-Washington_DC_District_of_Columbia.html,3.0,103,"Washington, DC",ForensicDoc,38.8949549,-77.0366456,40.4992707,-74.5887679,171.0722760235719,False,331.0
3.5,Conspiracy and Sushi,"Fantastic affordable delicious food. Chinatown in DC is a great place to visit and to enjoy the local fare. The Wok and Roll is one of the best in the area. It is a short walk from the Smithsonian Museum Mall area and well worth the effort. I particularly enjoyed the Happy hour that is daily during the week from...


More",Wok & Roll,10,12,"July 8, 2009",LittleBread,/Restaurant_Review-g28970-d1143694-Reviews-Wok_Roll-Washington_DC_District_of_Columbia.html,5.0,103,"Washington, DC",LittleBread,38.8949549,-77.0366456,,,,,323.0
3.5,Mmmmmmmmmmmm!,"We ate at the Wok and Roll when we visited DC in April 2009. My kids and I LOVE chinese food, and this was the best meal we ever had! Please do yourself a favor and order a bubble tea, especially for the kids. What a great time!",Wok & Roll,13,13,"April 17, 2009",upstate NY,/Restaurant_Review-g28970-d1143694-Reviews-Wok_Roll-Washington_DC_District_of_Columbia.html,5.0,103,"Washington, DC",pegasus2017,38.8949549,-77.0366456,43.0408333,-76.1391667,289.90801106340155,False,228.0
3.5,good food,"good chinese food-- short walk from metro and arena where capitals play.
we really enjoyed our meal! =)",Wok & Roll,48,16,"March 18, 2009","Summerville, SC",/Restaurant_Review-g28970-d1143694-Reviews-Wok_Roll-Washington_DC_District_of_Columbia.html,4.0,103,"Washington, DC",scjulie11,38.8949549,-77.0366456,33.0000235,-80.18979261,443.1287228004703,False,103.0
3.5,Chinatown Surprise,"If you are looking for somewhere in DC that is not a chain and is very good, this is the place for you. My husband and I took the Metro to Chinatown and were looking for an authenic looking place for Asian food. This little place was on a busy sidewalk with delicious smells coming from inside. The outside of...


More",Wok & Roll,12,21,"August 22, 2008","Mountain Home, Arkansas",/Restaurant_Review-g28970-d1143694-Reviews-Wok_Roll-Washington_DC_District_of_Columbia.html,5.0,103,"Washington, DC",mrsgaston,38.8949549,-77.0366456,36.335344899999996,-92.3851593,859.2193732576555,False,319.0
4.5,Great place for fun!,"I've been to Muzette a few times over the past year. Each time was a lot of fun! Korean/Asian style karaoke rooms with different occupancies so you can have a cozy but not overcrowded room. A great song selection and fun lights. Food is pretty good too. Soju drinks are yum but I think they are a bit weak. Tip:...


More",Muzette Karaoke and Restaurant,3,0,"October 5, 2015",Arlington,/Restaurant_Review-g28970-d4734433-Reviews-Muzette_Karaoke_and_Restaurant-Washington_DC_District_of_Columbia.html,5.0,4,"Washington, DC",Grace K,38.8949549,-77.0366456,32.7355816,-97.1071186,1201.246463535423,False,321.0
4.5,Great karoake - large selection of songs,"When my husband and I initially went as part of a meetup group, I was afraid the singing would be on a stage in front of a group of strangers. We were still in front of a group of strangers, but the karaoke is actually in a room with couches along the walls and a table in the center. It...


More",Muzette Karaoke and Restaurant,14,1,"September 24, 2015","Washington DC, District of Columbia",/Restaurant_Review-g28970-d4734433-Reviews-Muzette_Karaoke_and_Restaurant-Washington_DC_District_of_Columbia.html,5.0,4,"Washington, DC",Christine20009,38.8949549,-77.0366456,38.8949549,-77.03664559999999,1.3688331711774772e-12,True,297.0
4.5,A fun time but not great customer service,"We had a 1 hour room rental and it was very fun. The service was adequate as far as drink/food orders, etc. However, our room had technical problems and since they were fully booked we weren't offered a different room. We also were not offered any compensation or break in price. Our colored ""stage"" lights didn't work and our machine...


More",Muzette Karaoke and Restaurant,42,18,"April 14, 2014",,/Restaurant_Review-g28970-d4734433-Reviews-Muzette_Karaoke_and_Restaurant-Washington_DC_District_of_Columbia.html,3.0,4,"Washington, DC",Jenj621,38.8949549,-77.0366456,,,,,344.0
4.5,Kareoke Fun!,"Loved this place! Went with a group of friends to celebrate a birthday. Drinks/food available, great location and huge song selection. Overall a great time!",Muzette Karaoke and Restaurant,1,0,"December 3, 2013","Arlington, Virginia, USA",/Restaurant_Review-g28970-d4734433-Reviews-Muzette_Karaoke_and_Restaurant-Washington_DC_District_of_Columbia.html,4.0,4,"Washington, DC",Adripartida,38.8949549,-77.0366456,38.8903961,-77.0841585,2.580575353203579,True,156.0
4.0,Small but good,"Good sandwiches and salads, good customer service, very small premises and food in store a tad on the expensive side",FoBoGro,89,46,"September 21, 2015",Washington,/Restaurant_Review-g28970-d6407048-Reviews-FoBoGro-Washington_DC_District_of_Columbia.html,4.0,17,"Washington, DC",EMA47,38.8949549,-77.0366456,38.8949549,-77.03664559999999,1.3688331711774772e-12,True,116.0
4.0,Toasty hot sandwiches and cold refreshing salad,"After a hot day sightseeing in DC we found this place sort of near the Lincoln Memorial. The sandwiches were freshly made, big, hot and flavorful and the salad so refreshingly cold. Nice, friendly quick service too. We ate it all on a park bench in the Anniversary Park right next to the shop. Yum! Recommend highly.",FoBoGro,7,1,"September 9, 2015","New South Wales, Australia",/Restaurant_Review-g28970-d6407048-Reviews-FoBoGro-Washington_DC_District_of_Columbia.html,4.0,17,"Washington, DC",Pam B,38.8949549,-77.0366456,-31.875983500000004,147.2869493,9919.050019229888,False,316.0
4.0,Good for a convience store,"I was staying at the State Plaza hotel just around the corner that has full kitchens available for guests, so I decided to utilize it by getting my own groceries from a nearby store to make breakfasts.
There are only real two options, the CVS pharmacy next door and the FOBOGRO at the rear of the hotel. There is a...


More",FoBoGro,105,72,"September 6, 2015","Toronto, Ontario",/Restaurant_Review-g28970-d6407048-Reviews-FoBoGro-Washington_DC_District_of_Columbia.html,3.0,17,"Washington, DC",ChrisfromTO,38.8949549,-77.0366456,43.6529206,-79.3849008,350.3224729993701,False,324.0
4.0,Quick Service and Good Food,"After a long day of seeing the sites around DC, we were whipped and hungry. A quick trip from our hotel (State Plaza) to the deli yielded great subs, prepared with a smile and friendly attitude. All in all a great experience.",FoBoGro,9,11,"August 11, 2015","Atlantic Beach, North Carolina, United States",/Restaurant_Review-g28970-d6407048-Reviews-FoBoGro-Washington_DC_District_of_Columbia.html,4.0,17,"Washington, DC",Jay S,38.8949549,-77.0366456,34.6990505,-76.7402108,289.799019919085,False,225.0
4.0,LOVE THIS HISTORIC GEM!,"FoBoGro has so much to offer!!! The inside store sells a ton of great staples and a super variety of beverage choices. I like that they offer a variety of wonderful wines! Their sandwich shop downstairs is very popular and the sandwiches are creative and delicious!!! The staff is extremely helpful and go out of their way to welcome and...


More",FoBoGro,82,23,"July 22, 2015",Washington DC,/Restaurant_Review-g28970-d6407048-Reviews-FoBoGro-Washington_DC_District_of_Columbia.html,5.0,17,"Washington, DC",laffinalot,38.8949549,-77.0366456,38.8949549,-77.03664559999999,1.3688331711774772e-12,True,347.0
4.0,not a great grocery,We read such good things about this little store however the selections were limited and the prices very high even for the area. Better to shop elsewhere.,FoBoGro,27,16,"November 20, 2014","Orlando, Florida",/Restaurant_Review-g28970-d6407048-Reviews-FoBoGro-Washington_DC_District_of_Columbia.html,2.0,17,"Washington, DC",labanana,38.8949549,-77.0366456,28.5421175,-81.3790462,755.8243190989905,False,154.0
4.0,Good food.,"Very good food and the price is great, fresh made deli sandwiches and beverages. In the basement door of the building, the upstairs is a small grocery.",FoBoGro,31,21,"November 6, 2014","Calgary, Canada",/Restaurant_Review-g28970-d6407048-Reviews-FoBoGro-Washington_DC_District_of_Columbia.html,5.0,17,"Washington, DC",Sharon M,38.8949549,-77.0366456,51.0530588,-114.0625614,1972.5719355285164,False,151.0
4.0,Fresh Sandwiches and Grocery Store,"GoBoGro is a locals sandwich/coffee shop with a grocery store. The hours are good to get a snack on the way to your hotel after touring all day. The is a good variety of sandwiches available that can be made to order and you can buy coffee, snacks, wine and beer as well as some basic necessities.",FoBoGro,131,71,"October 31, 2014","Miami, Florida",/Restaurant_Review-g28970-d6407048-Reviews-FoBoGro-Washington_DC_District_of_Columbia.html,4.0,17,"Washington, DC",jenniferwilliams7,38.8949549,-77.0366456,25.7742658,-80.1936589,922.5964265864908,False,297.0
4.0,Great sandwich,"good food, convenient location. Great for take-out breakfast or lunch sandwiches. Fresh and healthy.",FoBoGro,97,30,"August 22, 2014","New Paltz,NY",/Restaurant_Review-g28970-d6407048-Reviews-FoBoGro-Washington_DC_District_of_Columbia.html,5.0,17,"Washington, DC",catsaresmarter,38.8949549,-77.0366456,41.7464972,-74.08448940000002,250.9982513841133,False,100.0
4.0,Good sandwiches for lunch,"Freshly made sandwiches of moderate to good quality under $10 apiece here. The pesto was the big selling point and the ingredients are all fresh. This is great drunk food, and easy to eat while walking. It's about 10 mins walk from the White House and great for grabbing a quick mobile lunch while walking from Georgetown to the White...


More",FoBoGro,84,82,"May 19, 2014","Long Island City, New York",/Restaurant_Review-g28970-d6407048-Reviews-FoBoGro-Washington_DC_District_of_Columbia.html,4.0,17,"Washington, DC",Drerinny,38.8949549,-77.0366456,40.7455316,-73.9484995,208.0431060340906,False,344.0
4.0,Ok for basic grocery items,"Right next door to our hotel. All basic grocery items (no fresh meats), canned, dry goods, frozen items. Convenient.",FoBoGro,23,28,"May 13, 2014","Kernersville, NC",/Restaurant_Review-g28970-d6407048-Reviews-FoBoGro-Washington_DC_District_of_Columbia.html,3.0,17,"Washington, DC",Best_For_Last_71,38.8949549,-77.0366456,36.1198589,-80.07365329999998,253.8687345788099,False,116.0
4.0,Best sandwich shop ever!,"Great staff, awesome atmosphere, great location, delicious food, and rockin' music. What more could you ask for? Check it out you are guaranteed to love your experience!",FoBoGro,1,1,"March 10, 2014","Washington DC, District of Columbia",/Restaurant_Review-g28970-d6407048-Reviews-FoBoGro-Washington_DC_District_of_Columbia.html,5.0,17,"Washington, DC",Brittany S,38.8949549,-77.0366456,38.8949549,-77.03664559999999,1.3688331711774772e-12,True,169.0
4.0,Great view,"We were traveling with teens with very different appetites. The food was good, great variety, excellent view, minimal tourists.","Madison Cafe, Library of Congress",44,12,"July 28, 2015",michigan,/Restaurant_Review-g28970-d4020260-Reviews-Madison_Cafe_Library_of_Congress-Washington_DC_District_of_Columbia.html,4.0,24,"Washington, DC",mich4122,38.8949549,-77.0366456,43.6211955,-84.6824346,514.2960438895891,False,127.0
4.0,Not worth the walk,"An employee in the Library of Congress suggested we go for lunch so we trekked through the tunnel to the Madison building. What we found was a cafeteria with bad food. The ""view"" that was part of the recommendation was of smokestacks, cranes and office buildings. Go through the tunnel to the Capitol cafeteria, it was great.","Madison Cafe, Library of Congress",12,8,"July 20, 2015","Palm City, Florida",/Restaurant_Review-g28970-d4020260-Reviews-Madison_Cafe_Library_of_Congress-Washington_DC_District_of_Columbia.html,2.0,24,"Washington, DC",Ddbttravel,38.8949549,-77.0366456,27.1713925,-80.28422161034891,829.4497892866389,False,325.0
4.0,Good food in a cafeteria setting,"We wound up here at a workers recommendation. The atmosphere isn't much, it's a cafeteria. But the food was surprisingly fresh and good. I wouldn't go out of my way to go here, but don't walk by either.","Madison Cafe, Library of Congress",22,7,"July 16, 2015","Bradenton, Florida, United States",/Restaurant_Review-g28970-d4020260-Reviews-Madison_Cafe_Library_of_Congress-Washington_DC_District_of_Columbia.html,4.0,24,"Washington, DC",Scott M,38.8949549,-77.0366456,27.4989278,-82.5748194,847.9183665449625,False,202.0
4.0,Okay option if you are visiting the Library of Congress,"It's challenging to find and the food isn't fantastic. But there is a huge selection, from burgers to sushi, so everyone can find something to eat. There is a view, but it's a rather grim view of anonymous buildings.","Madison Cafe, Library of Congress",3,2,"July 13, 2015","Cincinnati, Ohio",/Restaurant_Review-g28970-d4020260-Reviews-Madison_Cafe_Library_of_Congress-Washington_DC_District_of_Columbia.html,3.0,24,"Washington, DC",Ohiotraveler26,38.8949549,-77.0366456,39.1014537,-84.5124602,402.5502918458391,False,216.0
4.0,Great place to take a lunch break after touring Capitol and Library of Congress,"As we had abit of time before our tour of Library of Congress, we went by the underground pathway to this cafe for lunch. We were so happy to have read about this place. The lunch hours are 11 am- 3pm. There is a huge variety of food available here- Asians such as Vietnamese pho soup, Japanese sushi etc and...


More","Madison Cafe, Library of Congress",217,227,"July 2, 2015",singapore,/Restaurant_Review-g28970-d4020260-Reviews-Madison_Cafe_Library_of_Congress-Washington_DC_District_of_Columbia.html,5.0,24,"Washington, DC",Kim025Singapore,38.8949549,-77.0366456,1.2904527,103.85203800000001,9664.483670762194,False,318.0
4.0,O k food.,The food is fresh and ok. The decor is basic bureaucracy. Not exactly warm and fuzzy. The coffee is good. Not much else to say.,"Madison Cafe, Library of Congress",28,7,"July 1, 2015","Oakland, California",/Restaurant_Review-g28970-d4020260-Reviews-Madison_Cafe_Library_of_Congress-Washington_DC_District_of_Columbia.html,3.0,24,"Washington, DC",uglug,38.8949549,-77.0366456,37.80445570000001,-122.2713563,2432.581400382682,False,127.0
4.0,if a coffee is what you need,then a coffe is what you get. After visiting the library is useful to sit down for a while and think about the past. Or just enjoy a drink and think of nothing,"Madison Cafe, Library of Congress",1,0,"June 29, 2015","Toronto, Canada",/Restaurant_Review-g28970-d4020260-Reviews-Madison_Cafe_Library_of_Congress-Washington_DC_District_of_Columbia.html,3.0,24,"Washington, DC",Ron T,38.8949549,-77.0366456,43.6529206,-79.3849008,350.3224729993701,False,159.0
4.0,A little hard to find but great variety!,"There is every type of buffet food here you could want, all very good and reasonably priced. You serve yourself and you are charged by the ounce. Great option in the Capitol area.","Madison Cafe, Library of Congress",228,92,"April 17, 2015","Martha's Vineyard, Massachusetts",/Restaurant_Review-g28970-d4020260-Reviews-Madison_Cafe_Library_of_Congress-Washington_DC_District_of_Columbia.html,5.0,24,"Washington, DC",Ellie B,38.8949549,-77.0366456,41.3924769,-70.6202643063347,380.80650337366825,False,179.0
4.0,Great Place to Refuel,"I was looking for a place to eat lunch after completing visits at the Capitol building and Supreme Court in the morning. Compared to the Supreme Court cafe the Madison cafe seems to have a bigger selection and there are lots of tables and a south facing view of DC. I spent less than $10 on selections from the salad...


More","Madison Cafe, Library of Congress",5,8,"April 14, 2015",New York,/Restaurant_Review-g28970-d4020260-Reviews-Madison_Cafe_Library_of_Congress-Washington_DC_District_of_Columbia.html,4.0,24,"Washington, DC",Lisa S,38.8949549,-77.0366456,40.730599100000006,-73.9865812,205.8262086077873,False,326.0
4.0,Variety of choices,If you're in the area of Library of Congress area this is a good find to eat at. Food is priced by the weight. Can be a bit pricey but it gets your way from the corner stands and expensive restaurants in the city. You have to go through security to get to the restaurant cafeteria.,"Madison Cafe, Library of Congress",24,4,"April 7, 2015","Lewisberry, Pennsylvania",/Restaurant_Review-g28970-d4020260-Reviews-Madison_Cafe_Library_of_Congress-Washington_DC_District_of_Columbia.html,4.0,24,"Washington, DC",jwalte02,38.8949549,-77.0366456,40.135092900000004,-76.85969449999997,86.07541866697314,False,281.0
4.0,Abundant choices and a nice setting,"The cafeteria offers many different types of food, including made to order sushi, stir fry, a large salad bar, panini sandwiches and so on. I visited with my family and we were all able to find something to suite our fancy. The location is very convenient if you're in the Capitol Hill/Library of Congress/Supreme Court area and the view from...


More","Madison Cafe, Library of Congress",7,3,"April 1, 2015","Bend, Oregon",/Restaurant_Review-g28970-d4020260-Reviews-Madison_Cafe_Library_of_Congress-Washington_DC_District_of_Columbia.html,4.0,24,"Washington, DC",Doug K,38.8949549,-77.0366456,44.0581728,-121.3153096,2297.4039009152875,False,352.0
4.0,Wow,"The selections here are massive! Pretty much anything you'd like to eat, they offer it. I had the bento box with California rolls which was fabulous. The rolls were made fresh right when ordered. I only wish I had tried some of their dessert - the cakes looked amazing.","Madison Cafe, Library of Congress",17,7,"February 14, 2015","Elkhart, Indiana",/Restaurant_Review-g28970-d4020260-Reviews-Madison_Cafe_Library_of_Congress-Washington_DC_District_of_Columbia.html,5.0,24,"Washington, DC",Kim C,38.8949549,-77.0366456,41.6819935,-85.9766671,509.68645870458744,False,269.0
4.0,Superior location; good food; high prices,"A warren of tunnels connects the Library of Congress to the Madison building in which you'll find this huge cafeteria on the 6th floor. On a clear day, you can see for miles. Food is just a notch above typical cafeteria quality, but assortment is vast - ethnic, grill, salad bar, even a Starbucks. On the way there, in the...


More","Madison Cafe, Library of Congress",38,26,"November 7, 2014",,/Restaurant_Review-g28970-d4020260-Reviews-Madison_Cafe_Library_of_Congress-Washington_DC_District_of_Columbia.html,4.0,24,"Washington, DC",dle0313,38.8949549,-77.0366456,,,,,332.0
