restaurant_address,restaurant_overall_rating,user_review,restaurant_name,restaurant_phone,user_num_reviews,user_review_date,user_location,restaurant_url,user_rating,restaurant_num_reviews,restaurant_location,user_name
"209 10th Ave S Ste 221Nashville, TN 37203",3.0,"Within the context of what Morning Glory is, I think it's a fine place.  But make sure you understand what it is:  It is a convenience store/deli inside Cummins Station, intended for people who work in Cummins Stations.  If you travel to Cummins Station specifically to dine at Morning Glory, you're gonna have a bad time.Having said that, as somebody who works in Cummins Station, I like Morning Glory quite a bit.  The staff are nice, they have a decent variety of lunch food, and their prices are surprisingly low, considering how much they must be paying to rent that space.It appears to be run by a Korean family and, as others have said, the English is not strong.  But it's serviceable.   They have a credit card minimum, but it's manageable.The quality of the food itself is fine, again taking the context into consideration.  This is a nice alternative to other places in the building:  Cinco de Mayo (fine, but you can't eat Mexican every day), M Restaurant (so expensive I have never been there), M Market (my, they take themselves seriously -- and quite expensive), the Suchi place (which has a nice buffet actually, but is also kind of pricey).Both Cinco de Mayo and Morning Glory win the price award in Cummins Station.As far as seating, they have a counter inside that is servicable but not terribly comfortable.   They have tables and chairs out in the hall, but in the winter that entrance is a bit drafty.  But they serve everything in to-go boxes, so you can certainly take it back to the office.",Morning Glory Deli,6152565657,1 review,2015-01-26,"Murfreesboro, TN",/biz/morning-glory-deli-nashville,4.0,4,"Nashville, TN",John I.
"209 10th Ave S Ste 221Nashville, TN 37203",3.0,"Had a meeting in Cummins Station, and we were able just grabbing something to take up.While I don't know how much English the apparent owner and his helpers understood, they got my order right and were lickety split fast.I used to work in a building like this that had a market where every conceivable snack food and craving item was packed into about 100 square feet, and I miss it!Your favorite flavor of chips?  Yep.  Favorite candy bar?  Of course.  Favorite soft drink, in diet, and in a bottle?  Yep.Don't think you're going here to go out to lunch, this is a grab and go stop, but an ultra convenient and well stocked one.  I'd totally visit again if a similar situation arose, would just have to already be in the building because of parking, etc.",Morning Glory Deli,6152565657,299 reviews,2013-06-02,"Franklin, TN",/biz/morning-glory-deli-nashville,3.0,4,"Nashville, TN",Sarah B.
"209 10th Ave S Ste 221Nashville, TN 37203",3.0,"It is great at being what it is: A no-frills mini-mart for the Cummins Station residents. The food is definitely average, and the family owning it has a reputation for being difficult to work with (One of the local food trucks parked outside Cummins Station, only to find the Morning Glory owner kicking their truck, yelling at them for ""stealing business"".)That said, I can drop in an get Starbucks Doubleshot, some Advil, and a pretty decent grilled cheese sandwich, without hassle, and without leaving the office.Overall, I'd say: If you're in Cummins Station and you're feeling a little snacky, this is your place. If not, it's not a destination you need to seek out.",Morning Glory Deli,6152565657,30 reviews,2011-12-29,"Springfield, TN",/biz/morning-glory-deli-nashville,3.0,4,"Nashville, TN",H. W.
"209 10th Ave S Ste 221Nashville, TN 37203",3.0,No tables. It is mainly take out sandwiches for the office building where it is located. It is as much a mini market as for sandwiches. It is only open office hours during the work week since its main function is mini market/sandwiches for the office buildling.,Morning Glory Deli,6152565657,104 reviews,2010-02-21,"Nashville, TN",/biz/morning-glory-deli-nashville,2.0,4,"Nashville, TN",Samma A.
"5414 Nolensville RdNashville, TN 37211",4.0,"real mexican food... sorry las palmas, mazatlan, etc.  Happy to have a great place in Nashville.",Tacos Y Mariscos Lopez 6,,40 reviews,2015-06-08,"Nashville, TN",/biz/tacos-y-mariscos-lopez-6-nashville,4.0,7,"Nashville, TN",Brandon F.
"5414 Nolensville RdNashville, TN 37211",4.0,"More onions than anything.  While eating in there just looked to leaving,  family business but it seems like they hate it. Got overcharged too",Tacos Y Mariscos Lopez 6,,7 reviews,2014-11-28,"Bronx, NY",/biz/tacos-y-mariscos-lopez-6-nashville,1.0,7,"Nashville, TN",Gerald L.
"5414 Nolensville RdNashville, TN 37211",4.0,"I am a picky Mexican food eater and I've been looking for a Mom-and-Pop taco joint ever since I arrived in TN.  This is by far the closest thing to the type of ""real"" Mexican food you can get as Mexican food in Los Angeles.  I ordered the steak, chicken, and cherrizo tacos.  Outstanding flavor bursting into your oral pallets and created magic.  I got grilled onions and pickled carrots and relishes on the side, which refreshes the tongue after each taco.  The only unfortunate thing was that there was no Lengua (beef tongue) that day.  I was sort of looking forward to it.  All and all, this place is addictive and I will definitely go back.  My waitress did not speak english very well but she tried her hardest to take my order.  Gotta give her points for trying.",Tacos Y Mariscos Lopez 6,,18 reviews,2013-12-03,"Fountain Valley, CA",/biz/tacos-y-mariscos-lopez-6-nashville,4.0,7,"Nashville, TN",Calvin L.
"5414 Nolensville RdNashville, TN 37211",4.0,"Awesome good , fast on service closet thing to Los Angeles good trucks",Tacos Y Mariscos Lopez 6,,26 reviews,2013-07-02,"San Francisco, CA",/biz/tacos-y-mariscos-lopez-6-nashville,5.0,7,"Nashville, TN",Collin K.
"5414 Nolensville RdNashville, TN 37211",4.0,"This little taco stand has the best $0.99 tacos in all of Nashville, and the best Pastor/Spicy Pork Tacos I've had in Nashville. They have 4 tables of 4 for sit down dining and serve to parked cars in the lot. Right now, the parking lot is full, there are two other tables occupied, and we still got served my $6 half-chicken, rice, and beans in about 5 minutes. I come here multiple times a week, after hours when all else is closed, and sit in my pjs, in my car, feasting on tacos and preium horchata. There's no better Mexican expeience for me in Nashville.",Tacos Y Mariscos Lopez 6,,4 reviews,2011-09-02,"Nashville, TN",/biz/tacos-y-mariscos-lopez-6-nashville,5.0,7,"Nashville, TN",Andreos C.
"5414 Nolensville RdNashville, TN 37211",4.0,"This place is the real deal.  Cucumbers and savory sauteed onions that melt in your mouth trim the burrito plates.  The burritos themselves are packed full of fresh tasty ingredients.  I had the carnitas.  Don't miss the horchata either.  You'll know you're near this place by the smell, mmmmm.  Go inside and eat, it's a cool experience eating in this typical Antioch-style home converted into a taco truck cafeteria.",Tacos Y Mariscos Lopez 6,,56 reviews,2011-09-16,"Nashville, TN",/biz/tacos-y-mariscos-lopez-6-nashville,4.0,7,"Nashville, TN",tron d.
"5414 Nolensville RdNashville, TN 37211",4.0,This is a great little spot for just picking up a quick bite to eat or a casual sit down if you want to go inside to eat your meal. The taco stand sits in a parking lot in front of an old house. If you choose to stay in your car the wait staff will come to your car and take your order & then bring it to you when it's ready.  I ordered the very reasonably priced ceviche and it was ready in about 5 minutes.  My only qualm with my order is that the ceviche didn't have any red onions & those were noticeably missed - other than that it was fantastic.,Tacos Y Mariscos Lopez 6,,3 reviews,2012-01-29,"Nashville, TN",/biz/tacos-y-mariscos-lopez-6-nashville,4.0,7,"Nashville, TN",Amanda M.
"2817 Clarksville PikeNashville, TN 37208",3.0,"I'm always on the hunt for delicious BBQ so when the coworkers suggested Nick's for lunch I forgot all about my Lean Cuisine and told them HELL  YEAH I'm IN!  I really had no idea what to expect when we pulled in.  The place is right at Clarksville Hwy and Rosa Parks just down the road from MetroCenter.  When you walk in there are three windows - one to order, one to stare at the food you are going to get, and one to pick up your food.  Menus are available to look at on the counter and also on the wall.  A room of tables is off to your right - it isn't very many tables but it definitely wasn't packed when we were there so perhaps not a problem?I always get pulled pork since it is my favorite BBQ.  Instead of getting the sandwich, I had to get the pulled pork plate because of the great sounding sides they had.  What sides you ask?  Creamed corn, green beans, turnip greens, mac and cheese, white beans (eww!), apples, mashed potatoes, and others I'm probably leaving out.  OMG what's up with all the sides?  I love it!  I got the creamed corn and the turnip greens.  They also have a three side plate as well as a veggie plate option.  Then you choose regular bread or cornbread.  And a drink - Pepsi products only.  Is Pepsi ok?  To quote some comedian whose name I cannot remember: is Monopoly money ok?  Ugh, they also give you a can with a cup of ice.  I didn't ask if there were refills but you usually don't get them when they serve the can.  Booo!  They put the food on your plate and pass it through the window at the end - kind of like passing it through a jail cell?  Not that I would know.  Ahem.  The first thing I noticed was WOW this is a lot of meat! (TWSS!)  Pork had a good smoky flavor.  Their hot sauce was also really good - definitely trumps Neely's.  The turnip greens came with a little plastic container of vinegar to dump on them if you want...and really, why wouldn't you want?  I thought the turnip greens were almost like home which means delicious!  The creamed corn was lacking something - I think I was expecting the corn to be sweet corn and it was more white corn.  But still pretty solid.  And remember I said - these are very large portions.  I couldn't finish it all and I was stuffed to the max.  So much for productiveness the rest of the day!Overall, I think Nick's is the clear winner of the BBQ options in the MetroCenter area.  I'll be the Duchess in no time!!",Nick’s Famous Barbecue,6152486365,1027 reviews,2010-11-19,"Nashville, TN",/biz/nicks-famous-barbecue-nashville,4.0,3,"Nashville, TN",Nickie G.
"2817 Clarksville PikeNashville, TN 37208",3.0,"Had the pulled pork!  Two words! ""Not dry!"" Tasted delicious! Just wish the BBQ sauce had a thicker consistency",Nick’s Famous Barbecue,6152486365,351 reviews,2012-11-21,"Long Beach, CA",/biz/nicks-famous-barbecue-nashville,4.0,3,"Nashville, TN",Mike C.
"2817 Clarksville PikeNashville, TN 37208",3.0,The chicken was so over cooked and salted it wouldn't be fit for an animal. The bread was like recycled cardboard. The kitchen is behind bullet proof glass. Scary. Go there only if want the adreneline rush of being a little too close to the edge.,Nick’s Famous Barbecue,6152486365,25 reviews,2011-04-26,"Dallas, TX",/biz/nicks-famous-barbecue-nashville,1.0,3,"Nashville, TN",Mike M.
"Vanderbilt Medical CenterNashville, TN 37212",3.0,"We lunched here several times during our family's recent stay at Vandy.The first time we were served right away and both of us really enjoyed our sandwiches and pastries.  There was not a clean table to be found indoors or out so we just picked the least disgusting one and carefully tried to eat off the tray.The second time we were served by the same people and it was also pretty fast service.  Still not a clean table to be had.The last time, I stood in line for at least 15 minutes waiting to be served.  What's really crazy is there was NO ONE in front of me!  It was a different group of people working and I could tell a marked difference in service.  However, the food was still excellent and the tables were still dirty.  I never once saw anyone wiping down the tables during any of my three visits over the course of three days.The Turkey and Swiss was my favorite sandwich and I thought their cornbread and chocolate chip cookies were really delicious as well.  Too bad they only had the chocolate chip cookies on the first day, but the chocolate chip brownie made a worthy substitute.It is convenient if you are at Vandy.  It's a little pricey but the food is good, service is spotty at times, and never did we find a clean table.",Au Bon Pain,,41 reviews,2015-06-13,"Nashville, TN",/biz/au-bon-pain-nashville,3.0,29,"Nashville, TN",Marie L.
"Vanderbilt Medical CenterNashville, TN 37212",3.0,Nice sit down place for wifi! Had tea and waited out the rain in here. Nice interior for conversation and personal space. Staff was so nice and charming.,Au Bon Pain,,90 reviews,2015-04-09,"Los Angeles, CA",/biz/au-bon-pain-nashville,4.0,29,"Nashville, TN",Andy C.
"Vanderbilt Medical CenterNashville, TN 37212",3.0,"Unfortunately, I had to wait for a sandwich that they weren't making... Once I asked about it again, they made it right away. I also purchased a small soup, only to find out they had no spoons anywhere. There response was, ""Well, we have forks - that's a miracle."" That is not amusing for an $11 lunch.",Au Bon Pain,,2 reviews,2015-07-09,"Nashville, TN",/biz/au-bon-pain-nashville,1.0,29,"Nashville, TN",Nico P.
"Vanderbilt Medical CenterNashville, TN 37212",3.0,I have been here for several weeks I get the smoothies for my mom who is the patient. It's a hit and miss here I've been waited on fast and the next time waited upwards to 8 to 10 minutes to be waited on.one time this lady was walking around I had to ask her I'd she knew how to make a smoothie she said yes and proceeded to make it.i think it's just a staff shortage The register people are sometimes nice as well,Au Bon Pain,,133 reviews,2014-07-20,"Antioch, TN",/biz/au-bon-pain-nashville,3.0,29,"Nashville, TN",Jesse Q.
"Vanderbilt Medical CenterNashville, TN 37212",3.0,"So this was my second time venturing to Au Bon Pain and it was yet another pleasant experience! The Good: Lets just start off by saying I like to try new things food wise, but not to kin on foods I can't pronounce so I mostly study what ingredients come in it. Don't ask me what I tried my first visit cause I can't remember but this time I tried the Thai Chicken Peanut Wrap and MANNN IT WAS GOOD AS HELL! Came with chicken, lettuce, peanut oil, cucumbers, wontons, and some type of shredded cheese...of course I was skeptical but just like the first time I went the young lady behind the counter making you food was so polite, and very helpful that she unintentionally talked me into to trying it,....Thanks kind lady cause I would have missed out on an AMAZING EXPERIENCE! all the ingrediants in my wrap tasted so fresh and everything blended together so well when i took my first bite  all lingering doubt abandoned my mind and even though that wrap was a pretty big size I devoured it under 5 mins!! Ok enough about the food,..sorry had a fat moment :(  I've read some reviews that complain about the prices, Now think about it...you pay about $5 to $6 and some change for a greasy burger with fries that may have been sitting under a heat lamp for God knows how long! When you can get your food made in front of you with FRESH produce that's very HEALTHY  and pay maybe a smidget more...?!?!? I'm sorry im not feeling you sonnn! As for the atomosphere, it seems to be very clean and for the times i walked in there i tend to be always greeted so great customer service from the counter to the outstanding kool chick making my food!The Bad: Only bad thing to me is that there aren't more chains of this establishment everywhere in nashville but you know what they say ""Too much of a Good thing is Bad""..that might apply to something else so don't quote me on that!..lol I am a fan and will be back Again and Again and Again!....",Au Bon Pain,,234 reviews,2013-08-29,"Nashville, TN",/biz/au-bon-pain-nashville,5.0,29,"Nashville, TN",Da Deacon H.
"Vanderbilt Medical CenterNashville, TN 37212",3.0,"There's not much to say about this place. It's not a place that I would seek out but it is conveniently located in Vanderbilt so when you have long appointments it's there for you. This is definitely a better choice then McDonald's. It's very over-priced and just okay food. A bottle of water was $2.50 and the $7.00 sandwiches didn't come with a side. Everything was a la carte. I bought a blueberry muffin and was extremely disappointed in the fact that the top was coated in hard sugar crystals. Customer service is so-so. The manager who took our order was helpful and pleasant while the girl that gave us our food...not so much. I was also told they had a soup and sandwich special running but were out of the soup so there really wasn't a special. It is what it is, I guess. There's nowhere else to go in Vanderbilt to eat so embrace it.",Au Bon Pain,,137 reviews,2014-02-25,"Nashville, TN",/biz/au-bon-pain-nashville,3.0,29,"Nashville, TN",Tara S.
"Vanderbilt Medical CenterNashville, TN 37212",3.0,"As Megan C. rightly pointed out, its unfair to judge Au Bon Pain on the political struggle surrounding the departure of the much beloved McDonald's.The Better Half was recently ""enjoying"" a brief stay at VUH so I got to stop in a few times.The things it definitely has going for it is the ""ready to go"" meals.  In the Vandy environment, if you are a patient, a visitor or an employee you want to be in and out as fast as you possibly can.  There is a plethora of  these items waiting of you.Everything I had was reasonably fresh and definitely warm.  I felt the price was fairly decent, and I spent almost no time in line any of the times that I went there.There is however a ""Made to order"" sandwich line in the back. I did not take advantage of this in any of my visits so I cannot speak to how good or quickly they deliver, or how the prices of those sandwiches are.If you are in VUH, it's the fastest meal you can get, otherwise you have to truck over to Children's for the food court there. If you aren't familiar with the place, this can be a confusing journey to say the least making Au Bon Pain a good choice.",Au Bon Pain,,787 reviews,2012-07-25,"Nashville, TN",/biz/au-bon-pain-nashville,3.0,29,"Nashville, TN",David O.
"Vanderbilt Medical CenterNashville, TN 37212",3.0,"I've had lunch here about a dozen times...maybe more.  The VA Hospital is one of my customers and I've had projects there that lasted for a couple months straight.  The cafeteria there, sadly, is pretty...not...good.  So sometimes I'll just shoot through the back door and cross over to Au Bon Pain.  I don't think anyone would choose it when their friends say, ""Where should we meet?"" but for a restaurant located smack dab in the middle of a few medical facilities, it's not bad.  I do agree that it's a bit pricey...if you went there every day it would certainly add up.  However, you can eat as healthy as you want to and get in and out pretty quick.  If you can manage to wait until the lunch rush is over...the staff is much friendlier.  Plus they have a couple little rooms you can use for meetings.  It's all right.",Au Bon Pain,,328 reviews,2014-03-15,"Brentwood, TN",/biz/au-bon-pain-nashville,3.0,29,"Nashville, TN",Linda A.
"Vanderbilt Medical CenterNashville, TN 37212",3.0,"I had another wonderful experience at ABP! I was in need of an early dinner and it didn't hurt that I had in my hand a coupon worth $1 off a $5 purchase. I have been watching my calories and so it was important that I didn't ""go over"" my allotted number. Fortunately, all of the caloric values can be found when ordering (at least for the pastries, soups and sandwiches! I settled on a half sandwich and small soup. The portions were perfect and ideal for a dieting meal. I'd highly recommend it. I selected the Turkey and Swiss on a multigrain baguette. There is this lovely honey pecan spread that comes on there which play softly off of the Swiss cheese notes. It is a little on the sweet side--so if you aren't in the mood for that! I was a little passive and didn't request it to be removed. As a soup I selected, after much tasting, the wild mushroom and wheatberries soup. It is a vegan and soy-free option that just spoke to me. Together they were the perfect 496 calorie combination for dinner!",Au Bon Pain,,271 reviews,2013-04-23,"Nashville, TN",/biz/au-bon-pain-nashville,4.0,29,"Nashville, TN",Sarah C.
"Vanderbilt Medical CenterNashville, TN 37212",3.0,I appreciate a great place with plenty of healthy options and treats so satisfy every taste right here on the wonderful Vanderbilt Hospital campus. I'll be back again & again!,Au Bon Pain,,2 reviews,2015-02-04,"Broken Arrow, OK",/biz/au-bon-pain-nashville,4.0,29,"Nashville, TN",Matthew C.
"Vanderbilt Medical CenterNashville, TN 37212",3.0,The food was Actually pretty good but the cashier was so rude that I complained to the manager.,Au Bon Pain,,4 reviews,2014-10-14,"Antioch, TN",/biz/au-bon-pain-nashville,1.0,29,"Nashville, TN",Justin L.
"Vanderbilt Medical CenterNashville, TN 37212",3.0,"I want to be clear that I was never a fan of a McDonalds being at the center of a world-renowned medical center...seriously VUMC, what was that about?  I'm researching the effects of obesity on kidney disease at the time, so I always found McD's presence a little ironic.ABP is not necessarily better than a McD's, but the difference is you have better options available to you.  A full salad bar, a fantastic soup bar, sandwiches both hot and cold, and the calorie counts on everything.  But there are things there for anyone not counting calories, or if you really want fast food people, walk over to the children's hospital, where they have Taco Bell and Pizza Hut.  Or the cafeteria, where there's a grill station with plenty of McD-like offerings.  ABP can be your best friend or worst enemy.  It can get pricey quickly for a lunch, and at prime hours its packed.  But again, you have choices.  A small soup and a baguette is $5.  They have snack offerings like cheese and grapes or hummus and veggies for about $3.99.  Sandwiches can be purchased premade or made to your specifications.  They also have great coffee.I go here for lunch on days I forget my own.  It really is a place to test your willpower, because you can find yourself with an expensive and heavy lunch in no time.  But the people who work here are great, and the selection of food is decent.",Au Bon Pain,,299 reviews,2012-12-18,"Nashville, TN",/biz/au-bon-pain-nashville,3.0,29,"Nashville, TN",Bridgette C.
"Vanderbilt Medical CenterNashville, TN 37212",3.0,"Awful! My advice bring your own food when visiting the Vanderbilt Health Center.Service was slow. The person preparing my sandwich was grumpy and unsmiling, spent her time complaining about her job with her colleagues.  The sandwich was advertised as a toasted sandwich was a barely warm baguette smeared with an avocado paste that was loaded with vinegar then cold, hard chunks of boiled chicken was laid on top.Ordinarily I like Au Bon Pan but in this case I would never eat from here again",Au Bon Pain,,7 reviews,2013-09-26,"Franklin, TN",/biz/au-bon-pain-nashville,1.0,29,"Nashville, TN",Alan B.
"Vanderbilt Medical CenterNashville, TN 37212",3.0,"The infamously greasy McDonald's attached to the Vanderbilt hospital has officially been replaced via French invasion, named Au Bon Pain.  While I will not argue that ABP is a much more healthy alternative to Mickey D's, the notion that it is in the same price range as McD's is absolutely ridiculous.  ABP's price range is comparable to Panera or Bread & Company and offers a similar range of food items. The renovation is beautiful.  Colorful couches, large glass windows, and brightly painted walls make ABP a fun and relaxing space to grab a bite to eat, study, or hold a meeting.  In fact, there's even a small private meeting room to the right of the main entrance for maybe a business lunch or mini-party.I am familiar with the Au Bon Pains that can be found everywhere in Boston, so I was excited when I heard they were opening a branch in Nashville.  It has sort of a cafeteria style in that you grab what you want and then bring it to one of the checkout registers. I have yet to try the sandwiches, but they look delicious and will definitely be back to try them. They also offer soup, a salad bar, and an assortment of baked goods.  I stopped in today for an afternoon coffee and snack.  Unlike its similar competitors like Panera, ABP actually brews a decent cup of Joe!  The hazelnut blend is wonderfully aromatic and delicious.  And, I love love how they offer SOY MILK at no extra cost to accompany your coffee, for those of us that are lacking the lactase enzyme.  I paired my coffee with a delicious cinnamon scone (after staring at the baked goods options for a good 10 minutes, thereby blocking the normal flow of people traffic, since they all looked oh-so-scrumptious and it was so hard to decide).They're still working out some of the kinks, since they just opened Tuesday.  But, give them some time, and this place is going to be a hit!  Also, GREAT hours. Currently, they are open 5 AM - midnight on weekdays and 6 AM - 11 PM on weekends.  But, I heard they are hoping to upgrade to 24/7-hour service eventually.  Vandy students are going to overrun this place, for sure.",Au Bon Pain,,311 reviews,2011-06-22,"San Francisco, CA",/biz/au-bon-pain-nashville,4.0,29,"Nashville, TN",Jess Y.
