restaurant_address,restaurant_overall_rating,user_review,restaurant_name,restaurant_phone,user_num_reviews,user_review_date,user_location,restaurant_url,user_rating,restaurant_num_reviews,restaurant_location,user_name
"335 Harding PlNashville, TN 37211",2.5,"For Memorial Day weekend, I was staying at the M-Star Motel right across the street and ended up here because I was too lazy to drive downtown and find free parking (good luck). I also wanted some sort of healthy salad to offset all the BBQ and beer I consumed earlier. Walked in about 9:30pm and was sat at a cocktail table by the bar. 10 minutes passed and no server. I asked the hostess (middle-aged woman with a British accent) who my server was. She asked around and discovered that they went on break before I was sat. The hostess was extremely apologetic and got me my drink order. While trying to find someone else to wait on me, I perused the menu and saw this amazing-looking New Strawberry-Avocado-Grilled Chicken salad. I was like, ""Hot dayum!"" A different waiter came out and got my order going. The salad came out and was PHENOMENAL! I was shocked to be blown away by anything from an Applebee's. The manager came out and apologized for the earlier mix up as well. I'm giving this Applebee's 4 Stars for acting like they actually care and for this amazing new salad of theirs. Good job!",Applebee’s,6153339012,22 reviews,2014-05-31,"Vienna, VA",/biz/applebees-nashville-9,4.0,17,"Nashville, TN",A C.
"335 Harding PlNashville, TN 37211",2.5,Awesome food and service! Thanks for a great experience.,Applebee’s,6153339012,43 reviews,2013-05-08,"Winfield, WV",/biz/applebees-nashville-9,5.0,17,"Nashville, TN",Michael B.
"335 Harding PlNashville, TN 37211",2.5,Not bad typical applebees they're open late food is good servers are friendly the toilet smell is an occasional issue its hit or miss...,Applebee’s,6153339012,31 reviews,2011-02-21,"Nashville, TN",/biz/applebees-nashville-9,2.0,17,"Nashville, TN",Mitch S.
"335 Harding PlNashville, TN 37211",2.5,"I walked in here late at night and walked out cause it smelled like a toilet. I left and went to the other Applebee's down the road and had a happy dining experience. So nothing bad to say about applebee's in general, just this one seemed like it could use a good hot steam bath.",Applebee’s,6153339012,43 reviews,2008-07-15,"Minneapolis, MN",/biz/applebees-nashville-9,1.0,17,"Nashville, TN",Helena S.
"2215 Elliston PlNashville, TN 37203",2.0,"Atmosphere:N/A - We ordered take-out.Service:We ordered online and maybe 10mins later I received a call confirming our order from an actual person. It was a late night order so I imagine they get issues here and there.It arrived in about 30 - 45mins so delivery wasn't an issue.Food:I've read some of the previous reviews about incorrect / incomplete orders but our order was correct and all there.We ordered a margherita pizza, a pepperoni pizza, and some wings. Wings tasted like they were just tossed in some Frank's - no issues there but definitely nothing special about them.The pepperoni pizza is comparable to one of the take-home pizzas you can get at the walmart deli. Yeah... that disappointing.Margherita wasn't horrible but definitely not impressive.Overall:I don't think we'll be coming back here anytime soon but it is another late night option for those in need.",New York Pizza Cafe,6153273663,72 reviews,2015-07-21,"Nashville, TN",/biz/new-york-pizza-cafe-nashville,2.0,23,"Nashville, TN",Jonathan B.
"2215 Elliston PlNashville, TN 37203",2.0,"I had written a favorable review about this place recently and I must retract my review.   Ordered last night- almost two hours to get pizza.   That was ok.  I knew it was game night Taylor swift concert.    It was the pizza.  Totally different from last ordered.   My husband swore I picked a new place it was that inconsistent.    It had no cheese, no sauce- crust was mush.    That's not why I'm changing my opinion.    My husband and I both got sick immediately after eating this stuff.    After reading other reviews and my experience last evening, I felt I needed to change so nobody else wastes their money and time.",New York Pizza Cafe,6153273663,4 reviews,2015-09-03,"Nashville, TN",/biz/new-york-pizza-cafe-nashville,1.0,23,"Nashville, TN",Holly C.
"2215 Elliston PlNashville, TN 37203",2.0,My order was 2.5 hours late!!!! They didn't even offer any sort of discount. Just mediocre pizza and the worst customer service through grubhub I have ever experienced. Stay away from this place!,New York Pizza Cafe,6153273663,2 reviews,2015-09-25,"Powell, OH",/biz/new-york-pizza-cafe-nashville,1.0,23,"Nashville, TN",Michael S.
"2215 Elliston PlNashville, TN 37203",2.0,"I, too, am only giving this place one star so that I can write the review. While staying in a hotel that's only a few block (yes, BLOCKS) away, I ordered from this place. First of all, the order was incorrect: I ordered my meal with no onions, and lo and behold, there were onions there. Secondly, the order was incomplete: The pamphlet clearly said the meal came with breadsticks, and there weren't any. Those, along with cutlery, were absent from the bag. I called and asked for forks and breadsticks, and was promised them in 5 minutes. 20 minutes later, burnt breadsticks and a bad attitude arrived at my hotel door. I called back; suddenly the same guy on the phone has broken English and doesn't understand what I'm saying. This shall be the LAST TIME that this place ever receives my patronage. DO NOT EVER ORDER FROM THIS PLACE, no matter HOW convenient; there are other places around. (And over an hour from when I placed my initial order, I'm STILL waiting on my breadsticks.)",New York Pizza Cafe,6153273663,10 reviews,2015-07-02,"Madison, TN",/biz/new-york-pizza-cafe-nashville,1.0,23,"Nashville, TN",Jennifer C.
"2215 Elliston PlNashville, TN 37203",2.0,"I'm only giving them one star in order to right a review. There are plenty of places to order food in Nashville besides this place. Ordered pizza, never showed, still charged us $12 over the price they said it would be. Tried to resolve the issue with them and never had worse customer service. I would highly recommend somewhere besides New York pizza cafe.",New York Pizza Cafe,6153273663,3 reviews,2015-06-24,"South Lebanon, OH",/biz/new-york-pizza-cafe-nashville,1.0,23,"Nashville, TN",Ronald G.
"2215 Elliston PlNashville, TN 37203",2.0,"Dishonest. If they will cheat you, imagine what they will do to your food. These guys said that their going through a renovation so they will only deliver so.... they will not accept their own coupons because they are for carry-out only. I asked to pick up at the door where their delivery guys walk out of. Nope. They just want more money.",New York Pizza Cafe,6153273663,5 reviews,2015-04-11,"Cottontown, TN",/biz/new-york-pizza-cafe-nashville,1.0,23,"Nashville, TN",Joey P.
"2215 Elliston PlNashville, TN 37203",2.0,"Terrible. Over-priced. Delivery takes forever. After an hour and a half of waiting, the delivery guy shows up with the wrong order. When we went back the next day to speak with a manager (because the guy on the phone that evening was incompetent and said we'd have to wait ANOTHER 90 minutes to get the correct food - unreal), the place wasn't even open. We gave them a call, and some guy answered it and said he was at the bank with a couple of other employees - on a Sunday. Absolutely ridiculous. We should all hope this pathetic excuse for a business doesn't make it one more day.",New York Pizza Cafe,6153273663,1 review,2015-06-02,"Louisville, KY",/biz/new-york-pizza-cafe-nashville,1.0,23,"Nashville, TN",Lindsey F.
"2215 Elliston PlNashville, TN 37203",2.0,Ordered a ton of food to our entire gymnastics team that was in town from Chicago.  Charged $80 for a tray of pasta (maybe 2-3 boxes) and only brought half the order.  90 min. Later after all the kids went to bed they brought the rest...we let them keep it.  Horrible experience; a must-don't for our next trip to Nashville.,New York Pizza Cafe,6153273663,2 reviews,2015-02-07,"Hoffman Estates, IL",/biz/new-york-pizza-cafe-nashville,1.0,23,"Nashville, TN",Justin K.
"2215 Elliston PlNashville, TN 37203",2.0,"Just ate here for dinner. Employees didn't greet us, they were quite rude and unfriendly. Pizza tasted like cafeteria food from middle school. Pizza wasn't fully cooked. Tasted like all the ingredients were premade and/or canned. Not the best. Restaurant seating area was very dark and dirty. Tables were full of crumbs and didn't look like they had ever been cleaned. No lights on at 7pm. Bathrooms were disgusting.Honestly, I've had microwave pizza bread that was better quality.",New York Pizza Cafe,6153273663,7 reviews,2014-09-14,"Oroville, CA",/biz/new-york-pizza-cafe-nashville,1.0,23,"Nashville, TN",Rickey D.
"2215 Elliston PlNashville, TN 37203",2.0,"Staying at the best western on division and needed something easy and quick.  Definitely got the easy and quick and the bonus was delicious.  Excellent pizza, reasonably priced and delivered in about 40 minutes.  Nothing bad to say except I ate the whole thing",New York Pizza Cafe,6153273663,10 reviews,2014-11-12,"Los Angeles, CA",/biz/new-york-pizza-cafe-nashville,5.0,23,"Nashville, TN",Denise P.
"2215 Elliston PlNashville, TN 37203",2.0,"The food is great.  They never get the order right however.   The past five times I went they somehow messed up the order.  Whether it is sauce on the side, forgetting a dressing, pizza topping, 2 liter of soda.  Whatever it may be.  It never fails.  All the people that work there late night are little kids and they act extremely offended hen you correct them (which when you get it delivered it is not as if they can fix it). I understand the New York mentality of being rude.  But when they constantly completely mess up orders then you would think they would at least pretend to care for repeat business.  The only reason I go here is because of their good pizza and having the best late night menu.  The  owner needs to fire his 74 nephews and get some real kitchen help in there",New York Pizza Cafe,6153273663,9 reviews,2014-11-02,"Nashville, TN",/biz/new-york-pizza-cafe-nashville,1.0,23,"Nashville, TN",Cory D.
"2215 Elliston PlNashville, TN 37203",2.0,"Should have read the reviews before ordering!!  NY Pizza Nashville is a one time only mistake.  The order taker wasn't particularly polite.  He told me it would be  40 minutes for delivery (no big deal), and the driver would be able to accept my credit card when my order was delivered.  Fast forward 90 minutes... I call back, because my food hadn't been delivered.  A few minutes later it shows up.  I present my card to the delivery person,  who looks confused.  I was then told I needed to call back if I wanted to use a card!!  I explained that I was told the driver could accept a card for payment...the driver finally calls and they process my payment.  When I asked for a receipt (was a little confused as to how my total was $20, when the items I ordered didn't add up to this much) I was told that I couldn't get one because I got delivery and the receipt was at the restaurant....not sure how the driver knew what amount to charge to my card....shady business practices here...Oh, and the food was meh....cold, soggy.",New York Pizza Cafe,6153273663,2 reviews,2014-10-31,"Berkeley, CA",/biz/new-york-pizza-cafe-nashville,1.0,23,"Nashville, TN",Ben P.
"2215 Elliston PlNashville, TN 37203",2.0,This place is awesome!!! We got a pizza delivered and it got to us so fast that I didn't know who could be at the door! The pizza was amazing. I was visiting from Chicago and I have no problem saying this is the best pizza I've ever had in my life and I'm 41. Guys that's a lot of pizzas I've had. I could go on and on about this place and I will to everyone I know.,New York Pizza Cafe,6153273663,1 review,2014-12-26,"Chicago, IL",/biz/new-york-pizza-cafe-nashville,5.0,23,"Nashville, TN",Ninel P.
"2215 Elliston PlNashville, TN 37203",2.0,DO NOT order delivery through this restaurant. They are deceiving. I ordered an $8.99 lasagna and a $1.49 bottle of 20-oz. Coke. When the driver arrived my total was $18.01. I thought that was too much so I called the restaurant. The gentleman informed me of a delivery charge and state tax. The delivery charge was $4.99. That was not mentioned on the phone and was not listed anywhere on the menu. I went ahead and paid for the food because I was hungry and it was getting late. When I opened the bag I discovered two things. 1. The bottle of Coke was a 16.9-oz. bottle not the 20-oz. that I paid for. 2. The dressing I requested for my salad (that was included with the lasagna) was not in the bag. So I had a salad with no dressing. The lasagna had pools of grease on top of it. To say I did not enjoy my $18.01 dinner would be an understatement. I probably would have ignored the soda and dressing if I hadn't already been deceived by the delivery charge. Very disappointing.,New York Pizza Cafe,6153273663,1 review,2015-04-29,"Annapolis, MD",/biz/new-york-pizza-cafe-nashville,1.0,23,"Nashville, TN",Acc T.
"2215 Elliston PlNashville, TN 37203",2.0,"The food here is decent, however don't expect to actually end up eating what you ordered.  They always manage to mix something up, even the simplest order.  One night all I wanted was a burger and fries, and I ended up with a burger and fried mushrooms.  How does that happen?  Really?  ...and the burger sucked.  Other food is decent, as I said, but it will be decent food you didn't order but will be stuck eating.  Maybe try ordering what you don't want and you will end up with what you actually wanted??",New York Pizza Cafe,6153273663,6 reviews,2013-09-13,"Los Angeles, CA",/biz/new-york-pizza-cafe-nashville,2.0,23,"Nashville, TN",Lydia F.
"2215 Elliston PlNashville, TN 37203",2.0,The furthest from NY style pizza you can get. Its closer to cafeteria pizza than anything. Dont eat this crap,New York Pizza Cafe,6153273663,3 reviews,2013-07-01,"San Clemente, CA",/biz/new-york-pizza-cafe-nashville,1.0,23,"Nashville, TN",Mike G.
"2215 Elliston PlNashville, TN 37203",2.0,"Someone recently told me they didn't think Nashville was that diverse.  Well on Saturday night I got pizza made by Turkish men.  We kind of knew that they were but I asked anyway.  He answered, uhhh...a little bit.  I think they were afraid I might be racist but I was more curious.  Anyway, so it's not good pizza but out of Dominos, Pizza Hut, Bellagio I'd take New York Cafe any day.  It was cheesy as heck and actually seasoned but not like the oregano explosion, some other unnamed pizza places does to their pizza.  When we were there, at 3am, they had no lie over 15 phone calls from people ordering pizza, the phone was off the hook!  It does the job it was called here to do!  Make my drunk butt happy and a little more padded the next day.",New York Pizza Cafe,6153273663,484 reviews,2010-01-25,"Nashville, TN",/biz/new-york-pizza-cafe-nashville,3.0,23,"Nashville, TN",Kristin Marie S.
"2215 Elliston PlNashville, TN 37203",2.0,"O.K this place isn't great, but when you want something delivered at three in the morning, this is probably your only option. The pizza is just O.K, but it's marginally better than a frozen pizza, and their cheese bread is definitely edible, even pretty good. You don't always get exactly what you ordered, but it's usually close enough, and you have to make allowances, especially considering that they are willing to deliver through the night when practically no one else is. They'll deliver until about 5 am, so it's handy to know they are there when you're in a late night hunger pinch.",New York Pizza Cafe,6153273663,357 reviews,2008-08-02,"Nashville, TN",/biz/new-york-pizza-cafe-nashville,2.0,23,"Nashville, TN",Claire B.
"2215 Elliston PlNashville, TN 37203",2.0,"NO, DON'T BOTHER!! I have finally had my last meal from NY Deli after 12yrs of horrible service and multiple ownership changes. The only thing that has improved over the years is that it no longer takes 2hrs or more to get food delivered in the neighborhood. Most other aspects which were not really all that good to begin with has degraded to terrible. Why did I keep ordering from them over the course of 12 yrs? Usually drunken desperation, but now there are other places in the area that deliver (Tazza, Cafe Coco, etc). Here's an example of last night:Accuracy of order 1/5:I call in and order fried mushrooms, french dip sandwich without onions, and chicken alfredo. He repeats it to me and then asks what dressing for my side salad with the pasta. It arrives in about an hour and when I go through my order I find the french dip is not only with onions but there's more raw onions on this thing than meat. The bread was also burned. I had no dressing for my salad, and my order of fried mushrooms contained exactly 8 mushrooms (no ranch dip) and strangely, two random mozzarella sticks.Quality of Food 1/5:    First off before I really get in to the quality I gotta mention that the alfredo pasta is served as a blob wrapped up in a sheet of aluminum foil as opposed to how they once served in in those round aluminum to-go pans with a cardboard top. It's difficult to eat out of the sheet of foil and can be messy.*French Dip: Okay well, their version of ""au jus"" tasted like fatty brown water. Seriously it had no taste, I think it was maybe made as 1 part beef bouillon cube and 20 parts water. Really, I couldn't even eat this thing. As stated above the bun was burned to a black crisp and the onion to meat ratio was outrageous. *The alfredo was cold and a much smaller portion than it used to be served as, also the amount of chicken in it was meager. *The mushrooms were very few, there was no dipping sauce for them unless you like mushrooms with marinara and upon biting in to them it was clear they were underdone. Most of the interior was still a runny yellow raw batter -it was gross. While I wasn't given a full order of fried mushrooms there were two random fried mozzarella I didn't order. We all agreed they might have tasted good if they weren't cold and hard.So while they make gross food and have for years, I'll give them one thing, the guy on the phone was kind of nice I guess. Bottom Line:PLEASE DO NOT WASTE YOUR MONEY AT NEW YORK DELI!",New York Pizza Cafe,6153273663,7 reviews,2011-03-19,"Nashville, TN",/biz/new-york-pizza-cafe-nashville,1.0,23,"Nashville, TN",Molly P.
"2215 Elliston PlNashville, TN 37203",2.0,"My buddy and I order from here all the time. Very solid late night drunk food. Pizza isn't great but better than domino's, pizza hut etc. Wings are solid. I've also enjoyed the cheesy-bread.",New York Pizza Cafe,6153273663,2 reviews,2010-12-07,"Nashville, TN",/biz/new-york-pizza-cafe-nashville,4.0,23,"Nashville, TN",John E.
"2215 Elliston PlNashville, TN 37203",2.0,"New York Deli is not the place you go to when you are hankering for good food, it's the place you call when you are starving at 4 o'clock in the morning. I have never been in New York Deli before midnight but have gotten delivery from the place more times than I can count. Their food is at best marginal but when you are given no other option it becomes delicious. Word of warning: though its great that they are open at the ungodly hours of the day, be prepared to wait at least 45minutes for your food (30 if you stop inside). Remember, you are not the only drunk that desperately needs chicken fingers and fries.",New York Pizza Cafe,6153273663,328 reviews,2008-10-18,"San Francisco, CA",/biz/new-york-pizza-cafe-nashville,3.0,23,"Nashville, TN",Mariela C.
"2215 Elliston PlNashville, TN 37203",2.0,"We ordered a couple pizzas at around 7:30pm on a Sunday. The pizzas didn't come until after 9, and there was no discount or guarantee for hour and a half late pizzas. They really didn't care that we were upset and starving. The pizzas actually tasted pretty good, which is unfortunate because the service was terrible. If you're going to order some delivery, make sure you call in a few hours before you're going to be hungry.",New York Pizza Cafe,6153273663,12 reviews,2008-10-19,"San Francisco, CA",/biz/new-york-pizza-cafe-nashville,2.0,23,"Nashville, TN",Christina C.
"2215 Elliston PlNashville, TN 37203",2.0,"ok...yes...this place delivers late...they are kinda slow when you are starving. the food is ok...i get the gyro platter, its a decent price, but you gotta get something else to make it over ten dollars to be delivered because of the minimum for delivery. bums me out that they don't sell cheap slices of pizza...but whatever. anyway...their gyro platter is great.",New York Pizza Cafe,6153273663,2 reviews,2010-05-01,"Nashville, TN",/biz/new-york-pizza-cafe-nashville,3.0,23,"Nashville, TN",Gregory S.
"450 Donelson PikeNashville, TN 37214",2.5,"The food was great.  The burrito I got seemed more fresh than your Qdoba/Chipotle standard.  Perhaps it was smaller.  It was about in line price-wise with its competitors--it clocks in at about $10.The interior of the place is sort of flashy, also kind of tacky.  This place is definitely a lunch destination for people who work in the area.  It was quick service, so I'd recommend this place for lunch.",Guac Mexican Restaurant Donelson,6155411115,135 reviews,2014-05-18,"Lexington, KY",/biz/guac-mexican-restaurant-donelson-nashville,3.0,22,"Nashville, TN",Ryan N.
"450 Donelson PikeNashville, TN 37214",2.5,"I would have given it three to four stars if I hadn't paid 36 dollars for 2 regular burritos and two tacos. I will add the kids turned the tacos into combos, but I would have thought it was a kids combo because they each only got one taco and the taco combo is advertised that it comes with two. It's very difficult reading the menu and figuring out pricing. I can't believe I dropped that much on a flipping carry out place! 36 dollars!! I didn't get a receipt so I guess I could have been over charged but I'll never know. The food was okay. The cheese dip was very tasty. If you like syrupy sodas the kids say this is the place for you. The guacamole was alright. All in all not thrilled by my experience. I will not be returning nor recommending.On a side note the menu listed on the website looks nothing like the menu at the actual location.",Guac Mexican Restaurant Donelson,6155411115,4 reviews,2015-06-26,"Hermitage, TN",/biz/guac-mexican-restaurant-donelson-nashville,2.0,22,"Nashville, TN",Liz M.
"450 Donelson PikeNashville, TN 37214",2.5,"When I walked in the place was empty, but the tables sorely needed wiped down and there were chips and debris scattered in the floor behind the counter. When a place is in that state I sort of expect to see covering on food bins and trays but no such luck. Ordering was a bit tasking due to the language barrier but I got it done.  The meat was a bit dry but had good flavors.  The guac was nice and fresh but got a bit slimy the further down I dipped.  Nothing remarkable but not terrible either.The fact is the mess and disorganization made the so-so food quality not worth it.",Guac Mexican Restaurant Donelson,6155411115,426 reviews,2015-05-07,"Longmont, CO",/biz/guac-mexican-restaurant-donelson-nashville,2.0,22,"Nashville, TN",Tim S.
"450 Donelson PikeNashville, TN 37214",2.5,"This place is way overpriced!!  I had a taco salad, chips, and drink and it was almost 16 dollars!!!  Way too much for a lunch time meal when I can get the same for under bucks at a sit down restaurant with a server.  Unless they change their prices I will not be back!",Guac Mexican Restaurant Donelson,6155411115,2 reviews,2015-08-10,"Nashville, TN",/biz/guac-mexican-restaurant-donelson-nashville,1.0,22,"Nashville, TN",Scott D.
"450 Donelson PikeNashville, TN 37214",2.5,"Run of the mill cafeteria style Mexican. Though the new management has taken on a new communication barrier, they have added more ""Mexican dishes"" to the menu that mirror any other Mexican restaurant.  We go because it's close to work and a fast lunch break.  3 stars, nothing extraordinary about this place.",Guac Mexican Restaurant Donelson,6155411115,17 reviews,2015-03-20,"Hendersonville, TN",/biz/guac-mexican-restaurant-donelson-nashville,3.0,22,"Nashville, TN",Kate J.
"450 Donelson PikeNashville, TN 37214",2.5,Chipotle style with a little more authentic TexMex food. The tortilla flavors are great. I have tried the salad bow and the burrito. The toppings are fresh and tasty.,Guac Mexican Restaurant Donelson,6155411115,49 reviews,2015-01-21,"Nashville, TN",/biz/guac-mexican-restaurant-donelson-nashville,3.0,22,"Nashville, TN",Filipe F.
"450 Donelson PikeNashville, TN 37214",2.5,"Not a huge fan of this place. A great idea, but the two times I've ordered and requested guacamole? They were OUT. Call me crazy, but if the name of your establishment boasts ""Guac,"" shouldn't you have an ample supply ready anytime?",Guac Mexican Restaurant Donelson,6155411115,125 reviews,2014-07-06,"Nashville, TN",/biz/guac-mexican-restaurant-donelson-nashville,2.0,22,"Nashville, TN",Megan K.
"450 Donelson PikeNashville, TN 37214",2.5,"Gave the new Guac management / staff one more chance today.  What a shame. Staff was totally disorganized, place was dirty, food was nothing like it was when the original family was running it. I give the new Guac 6 months. What a shame! Used to be so good.",Guac Mexican Restaurant Donelson,6155411115,27 reviews,2015-03-26,"Franklin, TN",/biz/guac-mexican-restaurant-donelson-nashville,2.0,22,"Nashville, TN",Craig L.
