restaurant_address,restaurant_overall_rating,user_review,restaurant_name,restaurant_phone,user_num_reviews,user_review_date,user_location,restaurant_url,user_rating,restaurant_num_reviews,restaurant_location,user_name
"1921 Eastland AveNashville, TN 37206",3.0,"It was an establishment of no small stature, the coffee shop that had for some time threatened to wrest the hands of the Bongo Java Roasting Company from about Nashville's underdeveloped little neck.  This building was of course not the first of its kind.  There was that one just off of West End, and then the one in 12 South, the one that had started it all by finally holding up its coffee condoms and its white paper cups in triumphant defiance of the norm.  But this one, it was in EAST Nashville, just down the road from their humble apartment.  Yes, this one belonged to them.They both needed coffee that night.  After all, she had never seen Buffy the Vampire Slayer, and he was determined to get through the first season that day so that they could move on to the meatier stuff.  The only thing they were missing for their Buffython was some coffee to help hold off the slumber.  Unfortunately for the young couple, their coffee maker was for some reason brewing coffee that tasted as though it had been percolated in a garbage can.  Have no fear though, for the Portland Brew is right down the road.  So for a moment Buffy and her intrepid gang were left behind for the sweet lure of the bean.They arrived and opened the door they had opened so many times before, only this time something was dreadfully wrong.  U2 was playing over the shop's sound system.  And not even early U2, those albums wrought with political tension, that some part of you hates to admit are at least passable as early 80s post punk.  No, this was the U2 that had unfortunately survived the 90s and emerged as a testament to one man's ego and one band's mediocrity.Standing behind the bar listening to Bono belt it out was a youth of the shaggy blond hair variety.  The kind of kid who bought every Beatles and Hendrix shirt he could find at Target.  He stood with his back turned, perhaps asleep, perhaps just so moved by Ireland's favored son (...) that he could not wrest himself from his home against the counter.  The young couple exchanged silent glances with one another, trying to figure out what the deal was.  Neither of them knew.  He knocked on the counter top, but there was still no response.  Maybe the young man was narcoleptic?  Just when they thought they might scream, literally, as it seemed the only method with which to rouse this young man, another soul came around the corner, cast a glance at his cherubic friend, and then mercifully turned down the U2.He arrived at the register, fielded their orders, and then went to work.  The man filled his coffee cup with some half and half and a dark roast which was utterly forgettable while the barista, apparently dressed for the nines in his fake motorcycle rider boots, black jeans, denim communist revolutionary hat, and yes, a Black Rebel Motorcycle Club t-shirt, prepared the lady's drink.  I believe it was some sort of Black Rebel Motorcycle Club outfit, and neither the boy nor girl were certain if he had put it together himself or simply bought it prepackaged.  So BRMC fan made her Americano, after again asking her what kind of flavoring she wanted in it, and finally the couple were off.Back in their home, sitting in front of the warm glow of the boy's laptop, huddled closely together after two large cups of coffee and watching Buffy and crew whomp some vampy ass, both of them silently wished that their was a chosen one out there to fight the forces of mediocre coffee.",Portland Brew East,6157322119,46 reviews,2007-08-28,"Nashville, TN",/biz/portland-brew-east-nashville,2.0,57,"Nashville, TN",Brett W.
"1921 Eastland AveNashville, TN 37206",3.0,"I went to portland brew to get a bagel and a coffee today at about 12:30pm. As I was standing in line checking out the remaining selection of bagels something else caught my eye. On the empty top shelf of this display case were a variety of little black bugs and flies. I'm no stranger to the service industry and consider my self patient and understanding but this looked like, for lack of a better word, an aqaurium for insects. I was shocked, so i left and i will probably not return. If you are that openly ""health conscience"" about the things WE CAN SEE then I can only imagine what lurks in the corner of what I can't.",Portland Brew East,6157322119,3 reviews,2012-01-22,"Nashville, TN",/biz/portland-brew-east-nashville,1.0,57,"Nashville, TN",Jessica B.
"1921 Eastland AveNashville, TN 37206",3.0,"Portland Brew's East Nashville outpost is great.  They have an awesome location in a brick building on the corner of Eastland & Chapel.  True, Portland Brew's coffee is not considered the best in Nashville, but I think it's decent and it sure does the trick.  What I like most about this location is that the building has two floors.  The second floor is nice for doing work and escaping the crowds of people downstairs ordering, etc.  However, it is not as much of a quiet sanctuary as I thought it would be.  This is probably because the building has a strong echo and the hustle & bustle from downstairs reverberates upstairs.  Still, I enjoyed my time hanging there and the WiFi is free, so who cares!",Portland Brew East,6157322119,292 reviews,2008-10-07,"West Palm Beach, FL",/biz/portland-brew-east-nashville,4.0,57,"Nashville, TN",Robert K.
"1921 Eastland AveNashville, TN 37206",3.0,"Unique upstairs loft is great for its privacy and for its open space. I have never seen so many plugs per sq. foot for free wireless laptop plugin in Nashville. It's nice to not have to search for an available plug like at a certain other coffee house. (Hello, Bongo Bob). Some of the nice barristas are a little alternative which is okay by me and somehow fits with the tolerant nabe. With the loft it's a bigger coffeehouse for Music City USA. I don't promote it by kvelling. I like that it's not crowded and is quite mellow so I keep my kvell impulses to myself. East Nashville is lucky to have Portland Brew. Now for my espresso kick.",Portland Brew East,6157322119,260 reviews,2007-10-26,"Nashville, TN",/biz/portland-brew-east-nashville,5.0,57,"Nashville, TN",Tart L.
"3900 Hillsboro PikeNashville, TN 37215",3.5,"This isn't the tyical Americanized Chinese takeout food you usually find around here. Chinatown Restaurant is for people who are looking for- and appreciate- traditionally cooked Chinese food. Don't go here looking for Americanized dishes like general tso and orange chicken or else you'll miss out on a wonderful opportunity to try excellent Chinese dishes.We went on a busy Saturday night, but I was impressed how helpful and polite the staff was! You didn't get that feeling that they were completely overwhelmed. The restaurant was run very smoothly. The food was absolutely delicious. I tried a little bit of everything my group got, and it was hard to pick a favorite because everything was so tasty! The roasted duck was delicous, and it seemed like everyone was really impressed with an eggplant dish we had. The tofu dishes were excellent. Even if you think you don't like tofu, try it here! Same with the duck! This is a place for trying new things and experiencing different food.Take a look at the menu and do some research before you come so you don't get so overwhelmed that you just order the same old Lo Mein, orange chicken, etc. Don't be afraid to try something authentic!Also...BUBBLE TEA! I was so happy to have bubble tea again! If you have never tried it, definitely give it a try!",Chinatown Restaurant,6152693275,58 reviews,2015-04-19,"Nashville, TN",/biz/chinatown-restaurant-nashville,5.0,119,"Nashville, TN",R R.
"3900 Hillsboro PikeNashville, TN 37215",3.5,"3.5It is what it is. Unfortunately, Nashville is not SF. We don't have the depths of certain cuisines found in other cities. In time, we'll get there. In fact, I'm sure there's some small mom & pop joint in the city serving up delectable, addictive fare. It just hasn't been yelped yet. It'll get there. Until then and that said, Chinatown offers up a lot to enjoy -- you just have to know how to order. The restaurant tries to straddle the line between authentic and Americanized and the trouble comes in trying to serve two masters. I understand the latter perspective -- it's located in Green Hills and has been around for a while. Know your audience. It makes sense. The last few years, though, have been transformative to/for Nashville. The Chinese restaurant that capitalizes off the influx of and demand from foodies (hate that word) will win big.And, again, what you get out of Chinatown is directly proportional to what you put in. Back in my Chicago days -- and before I placed a fatwa on him -- I was a huge fan of Tony Hu. Any restaurant/endeavor he opened, I was at. I'd never experienced the focus on Chinese regionality when it came to food and he served it up well. Soup dumplings, spice profiles, meat heavy, fish heavy, etc., there was a method to it all. It makes sense. China's ginormous. 'Chinese food', therefore, is a massive undertaking. So, if you do your research, find out the region(s) Chinatown best represents and the dishes that best represent that region, you're assured to have a slam dunk experience. If you're truly seasoned in Chinese fare, ask for the Chinese menu and go to town.I know all this. But, when I came in on a cold Monday night, I just wanted some Americanized Chinese food to eat with the porter that was chilling in my fridge. I ordered the garlic chicken with white rice and engaged in some chit-chat with the front of the house. She was very nice and the restaurant was packed (good sign). After long enough to make me know that my food was made to order but not so long that I got restless, I paid $10 and was on my way. Was it tasty? Yep. Did it make me weak in the knees? No, but that's my fault (see para. 2). Will I come back? (With a group after doing some research and diving in to the full offerings?) Yes.",Chinatown Restaurant,6152693275,1642 reviews,2015-08-14,"Nashville, TN",/biz/chinatown-restaurant-nashville,3.0,119,"Nashville, TN",Johnny T.
"3900 Hillsboro PikeNashville, TN 37215",3.5,"I despise leaving a business one star, but my experience here was one of the most disappointing dining experiences I have ever had.Food: Worst Chinese food ever :(I ordered General Tso's chicken with white meat, and they gave us a full plate of greasy dough pieces with a heap of sauce all over it. The fried dough was edible but we wanted chicken not dough.I ordered fried rice with egg and received a bowl of steamed brown rice...I didnt expect to have great fried rice here, but I at least expected a piece of carrot or a few pieces of egg. There was nothing in the rice whatsoever, and the waitress confirmed that was the order of fried rice :/I saw another review on here with their General Tso's chicken and it looked great! perhaps they changed chefs or ran out of chicken this time.Service: The waitress was nice, however, she didn't pay attention to our questions and food orders. ie. brought us shrimp egg rolls despite us mentioning (twice) how my mom ""absolutely could not eat shrimp"" (shrimp allergy). Sometimes a shrimp will end up somewhere when a restaurant serves seafood, but these eggs rolls were primarily made up of shrimp...thank goodness I took a bite before my mom did. She also got another part of our order wrong, but it was hard to get her attention (perhaps she was a little frazzled?)Ambiance: Nothing worth noting.Cleanliness:The table and floors were sticky. The floors had food and sauce all over.I am unlikely to ever return. If this is one of the best chinese food restaurants in Nashville, I won't be eating Chinese food for a longggg time.PS: As we were dining in, another customer left while shouting he was never coming back, not sure what happened to upset him, but I can relate!",Chinatown Restaurant,6152693275,9 reviews,2015-07-02,"Studio City, CA",/biz/chinatown-restaurant-nashville,1.0,119,"Nashville, TN",Necey T.
"3900 Hillsboro PikeNashville, TN 37215",3.5,"We met some friends here for lunch on our drive back from New York City.  Like some other reviewers have said, this is NOT New York City caliber Chinese Food, however, this was some good Chinese food!  I ordered the General Tso's chicken (this is my go to dish) and I was a bit disappointed.  The chicken pieces that were used were very fatty and not of good quality.  The impressing that I received upon entering this Chinese Restaurant was all the ingredients used in their dishes would be of high quality.  While I did order the lunch special of the General Tso's chicken, that should not dictate what type of chicken is used to make up a dish.  I will give this place another try the next time I am in Nashville as their Fried Rice was pretty freakin' good.",Chinatown Restaurant,6152693275,125 reviews,2015-08-17,"Memphis, TN",/biz/chinatown-restaurant-nashville,3.0,119,"Nashville, TN",Justin L.
"3900 Hillsboro PikeNashville, TN 37215",3.5,"I was having a tough time deciding how to review this one.  The food just wasn't quite right but I couldn't put my finger on it.  Then a few days later I got the rare opportunity to eat at my favorite Chinese place back home and that made my review crystal clear.I ordered to go and got Sweet and Sour Chicken, Vegetable lo mien, chicken fried rice and a couple of spring rolls.  I don't know if the time of night had to do with it, but the sweet and sour chicken and chicken fried rice were slightly dried out.  The sweet and sour chicken was tiny, hard pellets of chicken.  The lo mien wasn't edible, leaving me unable to find edible lo mien in the city so far.  Nashville lo mien as a whole is best described as inedible goup in my experience.  The spring rolls were delicious though and while slightly dry, the rest of the food was at least edible.I can't tell you how disappointed I was, especially since I was told this was one of the best Chinese places in Nashville.  Looking at other reviews leads me to believe that some of their dishes are better than others, so I will go back and try their ""best"" dishes.The service was excellent and the food was the most edible Chinese food I have found thus far, so I gave it that third star.   I agree with other reviewers that the food is average at best.",Chinatown Restaurant,6152693275,41 reviews,2015-03-29,"Nashville, TN",/biz/chinatown-restaurant-nashville,3.0,119,"Nashville, TN",Marie L.
"3900 Hillsboro PikeNashville, TN 37215",3.5,One of the hostess was not friendly towards us when we wanted to order lunch socials. She tried to up-sale us the regular order when we clearly told her we don't want to order lobster. The food was not as good as used to be. We will not be back,Chinatown Restaurant,6152693275,1 review,2015-09-13,"Franklin, TN",/biz/chinatown-restaurant-nashville,1.0,119,"Nashville, TN",Joshua L.
"3900 Hillsboro PikeNashville, TN 37215",3.5,"Egg rolls a joy as always, but....they've gotten smaller so if you're looking for nice size egg rolls this isn't the place. I love that they are made fresh, just too small.",Chinatown Restaurant,6152693275,13 reviews,2015-08-26,"Atlanta, GA",/biz/chinatown-restaurant-nashville,3.0,119,"Nashville, TN",Coco D.
"3900 Hillsboro PikeNashville, TN 37215",3.5,"First, let me start by saying this isnt nearly as good as the chinese food you find in New York City's Chinatown - but, for Nashville, its the best we have found in town by far. I really like this place. We order pretty much the same thing every time we go. Start with the green onion pancakes and crab ragoons. Both are always hot and delicous. They aren't greesy and are served with appropriate (and different) sauces. For mains, we always order off menu general tso's beef, beef belly in hot pot and either sizzling beef or mongolian beef. The beef belly in hot pot is amazing - it comes out already boiling in this beautfiul stew sauce, large beef chucks braised down and tender and served with baby bok choy thats been still holding its form with a bit of crunch but soft and tender - so delish! For chinese food in Nashville, this is the place to go!",Chinatown Restaurant,6152693275,189 reviews,2014-09-23,"Nashville, TN",/biz/chinatown-restaurant-nashville,4.0,119,"Nashville, TN",Christa P.
"3900 Hillsboro PikeNashville, TN 37215",3.5,"Overall, a solid place for Chinese in Green Hills & very convenient if you work nearby.Atmosphere: Clean, pretty quiet, & nicely decorated.Service: Polite, friendly, attentive.Food: Mixed. I've found a few great dishes that are my go-to (Mongolian beef is my favorite!) Some others have been very average (the lo mein is not that great). You get a lot for the price with the lunch specials & their egg flower soup and eggrolls are good.Note: The last time I ordered online, it didn't work. The order went through successfully online, but when I arrived to pick up my food, the worker informed me that their online ordering wasn't working. I had to waste 10 min. of my lunch break while they made my food. **Always order by phone just to be safe!",Chinatown Restaurant,6152693275,30 reviews,2014-12-26,"Nashville, TN",/biz/chinatown-restaurant-nashville,4.0,119,"Nashville, TN",Annabelle A.
"3900 Hillsboro PikeNashville, TN 37215",3.5,"The owner is very nice to us, we have a good experience to eat there, we will back when we get chance to go to TN again:))",Chinatown Restaurant,6152693275,2 reviews,2015-05-07,"Destin, FL",/biz/chinatown-restaurant-nashville,5.0,119,"Nashville, TN",Cheery M.
"3900 Hillsboro PikeNashville, TN 37215",3.5,Best Chinese restaurant in Nashville period!My favorite is the spicy braised tofu and scallion pancakes for an appetizer. I have yet to have any meal here that was not amazingly good!The portions are generally large enough that there is enough to take home for another meal later.The staff is extremely helpful and attentive and the food usually arrives very quickly.Highly recommended!,Chinatown Restaurant,6152693275,25 reviews,2014-10-11,"Lebanon, TN",/biz/chinatown-restaurant-nashville,5.0,119,"Nashville, TN",Jason T.
"3900 Hillsboro PikeNashville, TN 37215",3.5,"Great! Ordered Crab Ragoon, Orange Chicken, General Chicken, white rice, & lo mein! Loved it! I highly recommend this place for Chinese!!! I give it a 5 star!",Chinatown Restaurant,6152693275,81 reviews,2015-06-27,"Nashville, TN",/biz/chinatown-restaurant-nashville,5.0,119,"Nashville, TN",Shannon M.
"3900 Hillsboro PikeNashville, TN 37215",3.5,Yes I know they are verry busy on the Hollidays but any other day you will get the sweetest waitresses and the yummiest food.,Chinatown Restaurant,6152693275,16 reviews,2015-07-06,"Nashville, TN",/biz/chinatown-restaurant-nashville,5.0,119,"Nashville, TN",April B.
"3900 Hillsboro PikeNashville, TN 37215",3.5,"It's Nashville, Nashville, Nashville....welcome!Point is - context is key.  I think a lot of the reviewers on here are used to Americanized chinese food (it's what is mainly available here) and therefore graded accordingly.Authentic  chinese food is not drowned in cheap stir-fry sweet/sour/salty sauce - the key lies in its balance of flavors without overwhelming the taste buds.  If one is used to eating salty food, the cuisine here will come across as bland.  So if Panda Express is your staple, I would not recommend this place to you.Chinatown is a mix of both - authentic and americanized.  For the geographic area, they are about as authentic as it gets without scaring the majority of diners away who may or may not have tried authentic chinese food before. Now onto the food - good mix of meat vs. vegetarian dishes, generous portion sizes.So for the Nashville area, it is pretty good.  But graded on my collective experience of Chinese dining - it is A-OK.    Every time the craving hits, this is my go to place. For now.",Chinatown Restaurant,6152693275,100 reviews,2014-06-18,"Brentwood, TN",/biz/chinatown-restaurant-nashville,4.0,119,"Nashville, TN",Cher Y.
"3900 Hillsboro PikeNashville, TN 37215",3.5,"Oh my goodness. Dismal, depressing. The workers were morose, unfriendly, unprofessional. The food was just not worth that. I had a sushi lunch, which was expensive, made worse by the quality. $19 for the sushi lunch. Our favorite spot, Sakura in Franklin, is $8.95 for the same lunch, and 10 times better. My son got a fried rice, his usual. He was not impressed. No one ever spoke to us, everything was done with grumpy face and hand gestures. Then it seemed as if they were unsure who would serve us, so that took a while. Our waitress never came back, ever. Despite this I left a 15% tip, and she found out right away because after I filled it out, she picked it up and looked at it. *&#%! Really? Cardinal waitressing sin. That has happened to me one other time, ever. Ironically both times when the waitresses were mediocre at best. I would never ever go back. I would not recommend at all. I like to try to find little independently owned places like that, but that was bad. I will try to find another place for our Green Hills days.",Chinatown Restaurant,6152693275,78 reviews,2015-07-30,"Nashville, TN",/biz/chinatown-restaurant-nashville,1.0,119,"Nashville, TN",Nancy P.
"3900 Hillsboro PikeNashville, TN 37215",3.5,This is a run of the mill Chinese food restaurant. I will say the restaurant itself is very well kept and clean and the staff are extremely friendly but the food itself is average. I ordered the Orange Chicken with fried rice and my girlfriend ordered the General Tso's Chicken with Lo Mein. The Lo Mein was very good I must say but the fried rice was on the bland side. Both main meals were good but the funny thing was both the Orange Chicken as well as the General Tso's tasted and looked identical. Overall the food was ok but I wouldn't recommend going here if you're looking for GREAT Chinese food.,Chinatown Restaurant,6152693275,14 reviews,2015-02-25,"Nashville, TN",/biz/chinatown-restaurant-nashville,3.0,119,"Nashville, TN",Bob L.
"3900 Hillsboro PikeNashville, TN 37215",3.5,The food was pretty good. Bubble tea is great! Service left us looking at each other every time she walked away. When we asked what was in the steamed dumplings she said idk..... Chicken? If you study the menu before you go and know what to order right away. Like as soon as you open your menu you'll be good. Will be back for bubble tea.,Chinatown Restaurant,6152693275,2 reviews,2015-05-19,"Nashville, TN",/biz/chinatown-restaurant-nashville,3.0,119,"Nashville, TN",Kara C.
"3900 Hillsboro PikeNashville, TN 37215",3.5,Mediocre food and terrible service. Really terrible. Do not waste your time or money.,Chinatown Restaurant,6152693275,2 reviews,2015-04-28,"Dallas, TX",/biz/chinatown-restaurant-nashville,1.0,119,"Nashville, TN",Martha H.
"3900 Hillsboro PikeNashville, TN 37215",3.5,I've been here lots of times but always ended up eating the food before remembering to take pictures!  Probably because I know how good it is. Went again today and it was the normal experience. Great food. Great service. Was in the mood for a potato dish that I used to eat in China so I asked the server and she spoke to the chef and he made it for me off menu. It's that type of place. If they can do it they will. Also got the chicken and tofu in peppers (can't remember the name in the menu). The sweet pea leafs which is my fav veggie. The scallion pancake and then the mapo tofu. They make my mapo with Sichuan peppercorns which is the only way to eat it as it really spices it up. Ate everything and will be in a food coma for the next day or so but it is really worth it. It might not be Chengdu but this is as close to authentic Sichuan cuisine that you will find in Nashville. Yummy yummy.,Chinatown Restaurant,6152693275,6 reviews,2014-09-28,"Smyrna, TN",/biz/chinatown-restaurant-nashville,5.0,119,"Nashville, TN",Mark S.
"3900 Hillsboro PikeNashville, TN 37215",3.5,"It has been at least 2 years since I have eaten here.  7 years ago when my wife and I were dating I would take her here to eat for her lunch/dinner break from work.  It was her choice.  She has always liked this place even in college 20 + years ago.  It has been here a while.They have made some changes since we were last in.The decor is much more up scale.  There are now 2 huge fish tanks in the back.  One with live lobsters and the other with tilapia.  These are there for freshness as you are looking at your dinner if that is what you order.  Very cool!The menu has some of the traditional American/Chinese dishes but I was very pleased to see real traditional Chinese dishes.The service was excellent!  The waiter checked on us just the right amount of times without ever being a bug.About 1/2 way through our meal I looked at my wife and told her, ""this may be the best Chinese food in Nashville"".  I am not totally sure about that as there may be some whole in the wall place where some little Chinese lady is making XO Shrimp in the back of a small kitchen or some 5th generation chef is making braised chickens feet in a spicy brown sauce from some street cart that I would dream to be eating.  Until then, I will continue to try new places.  Until some other place really knocks off my socks,  Chinatown is my favorite.Very pleased and will go back.  I am looking forward to our next trip there.",Chinatown Restaurant,6152693275,198 reviews,2013-01-23,"Ashland City, TN",/biz/chinatown-restaurant-nashville,4.0,119,"Nashville, TN",Matt D.
