restaurant_address,restaurant_overall_rating,user_review,restaurant_name,restaurant_phone,user_num_reviews,user_review_date,user_location,restaurant_url,user_rating,restaurant_num_reviews,restaurant_location,user_name
"700 Old Hickory BlvdBrentwood, TN 37027",3.5,"I'm glad we didn't bring the kids. We were there over two hours. Being a Saturday and busy, you know waiting for your food may take longer, which is fine. But after over thirty minutes, the manger came by to visit our table. He informed us that the Filet was not ""prepared to his satisfaction"" and for that reason it would be ""seven to nine minutes"". It turned into fifteen to twenty. The food was great. I would recommend the port mushrooms. During the dinner the manager again visited our table. He checked on the food and offered us dessert at no cost. Two hours is too long, but we'll give Firebirds a second chance because of the food and professionalism.",Firebirds Wood Fired Grill,6154257240,17 reviews,2015-02-09,"Franklin, TN",/biz/firebirds-wood-fired-grill-brentwood,3.0,62,"Nashville, TN",Bill P.
"700 Old Hickory BlvdBrentwood, TN 37027",3.5,"In spite of my less than sparkling review, this place will do well due to location and hipness.  Décor is nice and shiny so the young, hip group will love it.  The older, wiser group ( I include myself here) think $11-13 cocktails to be ridiculous.  Server was very good!  Nothing negative to say there.  Started with the ahi tuna appetizer.  Unfortunately, while seared perfectly, the flavor was lacking.  The highlight of this app was the small salad they gave with it.  Not a bargain at $14.75. Not even worth $10 in my opinion.  I expect fish, from an establishment of this ""caliber"" to be flown in at least on an every other day basis for freshness.  Heck, a local burger establishment near the house does this.The sirloin my wife had was decent and cooked well but lacked flavorThe chili rubbed Delmonico, again cooked well, but lacked flavor.  How is this possible when rubbed with chili?The superstar of the meal for me was the scalloped potato side.  They were delicious.  Verdict?  1 app, 2 glasses of average wine and 2 entrees equaled $88.  I don't have an issue paying a premium price for a premium meal but this is Longhorn fare at best.  Save your mediocrity and go to local places for better meals at lesser or at worst, equal pricing.",Firebirds Wood Fired Grill,6154257240,14 reviews,2014-08-31,"Brentwood, TN",/biz/firebirds-wood-fired-grill-brentwood,2.0,62,"Nashville, TN",John M.
"700 Old Hickory BlvdBrentwood, TN 37027",3.5,These last couple weeks the restaurant has seemed to take a huge downfall in the service staff. The food has remained to be good but not consistent. I've also seen a lot of new faces which may be the reasoning of downfall. It seems they cannot keep their employees happy which is turning to customers being unsatisfied. I've also not seen my favorite server Austin in the last couple weeks and will not be returning anytime soon.,Firebirds Wood Fired Grill,6154257240,1 review,2015-04-07,"Nashville, TN",/biz/firebirds-wood-fired-grill-brentwood,2.0,62,"Nashville, TN",Tim B.
"700 Old Hickory BlvdBrentwood, TN 37027",3.5,"Great service, yummy food, although I went there in the afternoon it was very dark inside which was not expected! Not many choices on the menu and also on the pricy side! Overall a great place for friends gathering or maybe a date!!!",Firebirds Wood Fired Grill,6154257240,13 reviews,2014-10-06,"Nashville, TN",/biz/firebirds-wood-fired-grill-brentwood,5.0,62,"Nashville, TN",Nazanin R.
"700 Old Hickory BlvdBrentwood, TN 37027",3.5,"Woohoo!! A nice place in the neighborhood.  This place just opened this week, we went for lunch.  Here are the first impressions.  1) Its very nice inside.  A very nice bar. Beautiful furnishings.  A wine wall.  Nice outdoor seating.  Its a lot bigger inside than it looks outside.2) Waitstaff was attentive and there were a lot of them.  Great service.3)  Menu choices were good.  Lots of interesting items on the lunch menu.  4) How did it taste?  I had a ribeye steak sandwich.  Which was cooked very very well and had a great grilled steak flavor.  Not salty or over seasoned.  A really nice cut of meat on a nice buttered bun.  I had a salad called a BLT that was delicious as well.  I had tater tots which were good, but had a slight chemical flavor that I put down to new frying oil.  Nothing I wouldn't order again.  5) Price?  Reasonable for the food.  On the high end for lunch (about $21), but damn, it was a nice ribeye steak!  And a salad.  With bacon.  With good ice tea.  The manager was very visible and at one point helped clear our table.  The service from everyone was just great.I can't wait to try it for dinner.  It looks like a great steak house menu.  Looks like a fun happy hour menu at the bar too, with nice cocktails and bar appetizers at reduced prices.  Welcome to the neighborhood Firebirds!  I am glad you are here.",Firebirds Wood Fired Grill,6154257240,24 reviews,2014-07-24,"Brentwood, TN",/biz/firebirds-wood-fired-grill-brentwood,4.0,62,"Nashville, TN",Mark M.
"700 Old Hickory BlvdBrentwood, TN 37027",3.5,"I flew into Nashville for a meeting and was looking for a good spot to have a nice meal and this place fit the bill.  The tortilla soup is awesome with a good portion and a lot of chicken.  I also had the fish tacos which were very tasty with a nice creamy mayo and a bit of cabbage for extra texture.  The price seemed a little high for lunch but, the atmosphere was nice and the staff was very friendly.",Firebirds Wood Fired Grill,6154257240,7 reviews,2014-10-13,"Columbus, OH",/biz/firebirds-wood-fired-grill-brentwood,4.0,62,"Nashville, TN",Marc H.
"700 Old Hickory BlvdBrentwood, TN 37027",3.5,"I went to try this place when it first opened as I'm always excited when something new pops up near my house. First the staff and our waitress were very nice. The place is stylish kind of like a J Alexander's. Food is almost there but I think for the price point I've had better. Worth a try, the lemonade is great as well as the bar!!",Firebirds Wood Fired Grill,6154257240,23 reviews,2014-08-02,"Nashville, TN",/biz/firebirds-wood-fired-grill-brentwood,4.0,62,"Nashville, TN",Bryan B.
"700 Old Hickory BlvdBrentwood, TN 37027",3.5,"My wife and I were able to try this restaurant on the first night of their soft opening, and it was excellent.   The carrot cake with the salted caramel sauce is over the top.This is the best restaurant in the Maryland Farms/Brentwood area now.",Firebirds Wood Fired Grill,6154257240,4 reviews,2014-12-06,"Brentwood, TN",/biz/firebirds-wood-fired-grill-brentwood,5.0,62,"Nashville, TN",Michael T.
"700 Old Hickory BlvdBrentwood, TN 37027",3.5,"I had the opportunity to eat here last night.  The atmosphere was great and waiter was nervous but professional.   However, the steak was over cook, but the lemonade was great.",Firebirds Wood Fired Grill,6154257240,8 reviews,2014-10-15,"CANE RIDGE, TN",/biz/firebirds-wood-fired-grill-brentwood,3.0,62,"Nashville, TN",Precious M.
"700 Old Hickory BlvdBrentwood, TN 37027",3.5,"My boyfriend and I tried this restaurant on a whim one night, and it left us speechless it was so good. He loved their steaks so much he tries to go twice a month. Our waiters were perfect up until time for the check, but it was over looked since our meals were so amazing. I had an extraordinary plate of steak kabobs with a side of the most wonderful mashed parmesan potatoes. Every bit of my meal was perfect and filling. I even asked to take home another side of mashed potatoes to enjoy later. High in price, but high on my list of places to revisit.",Firebirds Wood Fired Grill,6154257240,9 reviews,2015-04-11,"Nashville, TN",/biz/firebirds-wood-fired-grill-brentwood,5.0,62,"Nashville, TN",Leslie W.
"700 Old Hickory BlvdBrentwood, TN 37027",3.5,Dan is the best server! Best happy hour ever! Fish tacos are awesome!  Brentwood needed a place like this.,Firebirds Wood Fired Grill,6154257240,1 review,2014-11-13,"Nashville, TN",/biz/firebirds-wood-fired-grill-brentwood,5.0,62,"Nashville, TN",Stephanie N.
"700 Old Hickory BlvdBrentwood, TN 37027",3.5,We have eaten here several times and have enjoyed it very much!!,Firebirds Wood Fired Grill,6154257240,8 reviews,2014-09-29,"Brentwood, TN",/biz/firebirds-wood-fired-grill-brentwood,5.0,62,"Nashville, TN",Michelle R.
"700 Old Hickory BlvdBrentwood, TN 37027",3.5,"Trendy chain restaurant (like J. Alexander's) with food that is good, but not spectacular. Went here during it's opening week and the service was actually pretty good even though people were being trained (I think every server was working and .there were like 3 managers on the floor as well to ""put out any fires""). We would return to this place.",Firebirds Wood Fired Grill,6154257240,29 reviews,2014-08-28,"Nashville, TN",/biz/firebirds-wood-fired-grill-brentwood,3.0,62,"Nashville, TN",Mark D.
"700 Old Hickory BlvdBrentwood, TN 37027",3.5,I went with my wife and liked the decor food and service. A manager even checked on us. Both of us liked our meals. What surprised us was how good the fried spinach was. It melts in your mouth. We will go back just for that alone.,Firebirds Wood Fired Grill,6154257240,14 reviews,2014-08-31,"Nashville, TN",/biz/firebirds-wood-fired-grill-brentwood,5.0,62,"Nashville, TN",John W.
"700 Old Hickory BlvdBrentwood, TN 37027",3.5,We used to eat at the Firebird's in Memphis all the time. So excited they have brought it Nashville. Love their BLT salad and their bread.,Firebirds Wood Fired Grill,6154257240,2 reviews,2014-08-30,"Franklin, TN",/biz/firebirds-wood-fired-grill-brentwood,5.0,62,"Nashville, TN",Andrew S.
"700 Old Hickory BlvdBrentwood, TN 37027",3.5,Firebirds customer service is really great. They read my review and responded with a gift card for me to try them again. I am looking forward to trying them again.,Firebirds Wood Fired Grill,6154257240,16 reviews,2014-12-22,"Nashville, TN",/biz/firebirds-wood-fired-grill-brentwood,5.0,62,"Nashville, TN",Laini B.
"700 Old Hickory BlvdBrentwood, TN 37027",3.5,"Seriously overpriced with below - average food.  Waitress really tried to get us to order an entire bottle rather than 2 glasses of wine. ' Same with appetizers, sides etc.  Husband and I had been looking forward to a nice night out after the snow and ice were gone.  We will not go back.",Firebirds Wood Fired Grill,6154257240,7 reviews,2015-03-10,"Nashville, TN",/biz/firebirds-wood-fired-grill-brentwood,2.0,62,"Nashville, TN",Deborah H.
"700 Old Hickory BlvdBrentwood, TN 37027",3.5,Such good food and the great cocktails too. Their quesadilla and their steaks are great! Yummy!!!!,Firebirds Wood Fired Grill,6154257240,1 review,2015-03-03,"Brentwood, TN",/biz/firebirds-wood-fired-grill-brentwood,4.0,62,"Nashville, TN",Catherine D.
"700 Old Hickory BlvdBrentwood, TN 37027",3.5,"I really want to like this place and give it four or five stars.  I certainly give them five stars for the choices available on the menu and for the efficiency and friendliness of the staff. The service is great.   Their food preparation is also spot-on.....I have tried many things on the menu, and every item was perfectly prepared.  That being said, for the price, the flavors are lacking.  Nothing seems to be seasoned nearly enough.  The only food item I have tried (and I've tried seven different menu items) that I wanted to have a second time  was the portabello sandwich.  For the cost, the flavors lack the 'wow.""",Firebirds Wood Fired Grill,6154257240,7 reviews,2014-10-26,"Franklin, TN",/biz/firebirds-wood-fired-grill-brentwood,3.0,62,"Nashville, TN",Sandi H.
"700 Old Hickory BlvdBrentwood, TN 37027",3.5,"This was disappointing. At these prices (dinner), things should be much more enjoyable. While greeted by the hostess and seated immediately, there was almost a 10 minute wait for our server. We started with water, lemonade (nice, not to sweet), the grilled chicken corn chowder (tasted like potato soup with corn tossed in ) and a nice mixed green salad. At that point the server while walking by remembered to ask us if we wanted bread. Bread is tasty with a cornmeal crust.  Then our main dishes came. Mine was very nice chicken pasta. Nice kick to the flavor. However the other dinner was a steak dinner. The green bean side was nice.  The steak was sent back., they cooked a medium steak to well done. Second time was better, but as it had not rested, juice left the steak once it was cut.  Other notes, wait staff is standing around in front of the kitchen (highlighted by kitchen lights), waiting. Yet, my water was only refilled 3 times and crumbs were never brushed from the table during the meal(mine or others). Disappointed by this restaurant. Unsure if we will try it again.",Firebirds Wood Fired Grill,6154257240,7 reviews,2014-11-09,"Gallatin, TN",/biz/firebirds-wood-fired-grill-brentwood,2.0,62,"Nashville, TN",Rebecca P.
"700 Old Hickory BlvdBrentwood, TN 37027",3.5,"We had the burgers - they were good, but not as good as Burger-up.  The waitress could have tried.  I felt like I was there for her convenience.  The manager stopped by,  didn't introduce himself, said ""I hope everything is OK"", and walked off before we could reply.  Hmmm.  Do you all really care what I think?  I don't think so.....",Firebirds Wood Fired Grill,6154257240,18 reviews,2014-11-30,"Nashville, TN",/biz/firebirds-wood-fired-grill-brentwood,2.0,62,"Nashville, TN",Andrew W.
"700 Old Hickory BlvdBrentwood, TN 37027",3.5,"Stylish, lively new restaurant on Old Hickory in Brentwood. Friendly staff, but slow service! We tried this on a recent weeknight. The atmosphere is very noisy, mostly because of its open floor plan and the fact that it was crowded. We had the salmon, which was good, but our dishes were not initially delivered at the same time! Because of the confusion and long wait time, the manager comped a dessert, which was nice of him. There were lots of servers milling about - it just felt kind of chaotic, but that could of been because we were seated in a middle table that felt kind of like ""Grand Central Station.""  It was also a bit expensive ($20+ per meal). I think the place has potential, once they get some of the service kinks worked out, but for the price, we prefer a quieter environment where we can talk.",Firebirds Wood Fired Grill,6154257240,10 reviews,2014-07-26,"Nashville, TN",/biz/firebirds-wood-fired-grill-brentwood,3.0,62,"Nashville, TN",Gwen K.
"700 Old Hickory BlvdBrentwood, TN 37027",3.5,"The food is amazing. Great atmosphere. However, we sat in the bar area and the service was absolutely horrible. Not one time did our server offer to get me another drink, and she never even stopped by our table so I could ask for it myself. She took our order and we didn't see her until after we were long finished with our meal. She didn't check on us one time. I had to flag down other servers to get a dessert menu, and then for our check. I'd love to return for the food, but will probably opt for take out next time.",Firebirds Wood Fired Grill,6154257240,5 reviews,2014-09-23,"Brentwood, TN",/biz/firebirds-wood-fired-grill-brentwood,3.0,62,"Nashville, TN",Shelby B.
"700 Old Hickory BlvdBrentwood, TN 37027",3.5,"I signed up for yelp because of this place.  Have you ever been Really, really hungry?  I was tonight and asked my wife to get me a simple chicken and cheese quesadilla on her way home.  About an hour later just before I nearly gave in and made myself a grilled cheese she arrived with the chicken quesadilla that I had been dreaming of.  Much to my disappointment the slimy quesadilla was jam packed with nothing but beans and onions( my least favorite things).  It was burned on several sides and I faintly saw one sliver of chicken amidst the oozing slop of a mess that was this crapazilla. As I sit here steaming eating the edges of a grilled cheese that I had to make, I wonder, what kind of restaurant can't make a chicken and cheese quesadilla.  Not a good one I say.",Firebirds Wood Fired Grill,6154257240,1 review,2014-09-18,"Brentwood, TN",/biz/firebirds-wood-fired-grill-brentwood,1.0,62,"Nashville, TN",Zach R.
"700 Old Hickory BlvdBrentwood, TN 37027",3.5,awesome food. great atmosphere. kinda pricey but worth it.  lunch crowd but fast.  nice upscale but casual. very welcoming.,Firebirds Wood Fired Grill,6154257240,79 reviews,2014-08-04,"Franklin, TN",/biz/firebirds-wood-fired-grill-brentwood,5.0,62,"Nashville, TN",glenn s.
"3539 W Hamilton RdNashville, TN 37218",5.0,"Awesome BBQ! Had a craving for BBQ and I passed by and saw the smoke then I got stuck in traffic so I whipped in the parking  lot. Ordered the pork shoulder plate  sauce on the side, baked beans and cole slaw. Huge portion for $8. Meat was well seasoned and tasty. Baked beans has meat in it cole slaw creamy. Yum Yum Goodness!",Real-Deal Bar-B-Q and Catering,6152991558,21 reviews,2015-05-01,"Nashville, TN",/biz/real-deal-bar-b-q-and-catering-nashville,5.0,1,"Nashville, TN",Anita P.
"3113 Nolensville PikeNashville, TN 37211",4.0,"I stopped in here one time on my way to a conference. At the time, I only bought one piece of bread because we had been told that breakfast would be provided at the conference. It wasn't (shame on you, TNTESOL), and I missed that opportunity to get a really delicious breakfast. A lot of bakery items looked good here, and the owners were a very friendly Central American couple. They also mentioned a hot, central american style breakfast (that include eggs, beans, cheese, avocado, tortillas) which I regret not eating to this day. I was so starving by lunch. They also mentioned some tamales that they sell frozen, guatemalan style in banana leaves, and another style (I forget the name) that she said was in corn husks. I need to go try these. I am really confused by the name of this place, it seems they must have wanted to appeal to an American audience, but the food and location really don't, and ""international cafe"" is way too vague in a neighborhood home to many africans, kurds, east asians, and latinos. Something more specific like ""Central American Bakery and Cafe"" might have brought me in sooner.",Bread & Butter International Café,6155789746,93 reviews,2012-05-30,"Knoxville, TN",/biz/bread-and-butter-international-caf%C3%A9-nashville,4.0,1,"Nashville, TN",Laura B.
"2206 Elliston PlNashville, TN 37203",4.0,"This place is one of my top 5 favorite places in Nashville. I enjoy smoking hookah, and this place is just as laid back as me. They have a super sweet happy hour. Also Angela makes a Tom Collins to die for.",Aladdin’s Hookah Lounge and Bar,6153293558,14 reviews,2015-08-29,"Hermitage, TN",/biz/aladdins-hookah-lounge-and-bar-nashville,4.0,45,"Nashville, TN",Eboni S.
"2206 Elliston PlNashville, TN 37203",4.0,"Good drink specials (half off beer & wine) during Happy Hour (even on Saturday), and the Hookah was $10 during Happy Hour.  The bartenders were very nice.",Aladdin’s Hookah Lounge and Bar,6153293558,244 reviews,2015-08-25,"Nashville, TN",/biz/aladdins-hookah-lounge-and-bar-nashville,4.0,45,"Nashville, TN",Sam L.
"2206 Elliston PlNashville, TN 37203",4.0,One of my favorite chill spots in Nashville. I'm at this place maybe twice a week. The staff is so friendly. They have good happy hour too!! The wings and hookah is the best!,Aladdin’s Hookah Lounge and Bar,6153293558,24 reviews,2015-08-29,"Nashville, TN",/biz/aladdins-hookah-lounge-and-bar-nashville,5.0,45,"Nashville, TN",Whitney L.
"2206 Elliston PlNashville, TN 37203",4.0,"My friend and I were traveling through Nashville on our way to PCB and decided to check this place out. We got there around 10:30 PM and the place was packed. We had to wait for an hour in the cramped entry way with no food or drinks.We got sat at 11:40 PM and then waited another 15 minutes for someone to stop by our table. After we got drinks and hookah, we were happy. The place is very dive bar, however if your good with tight seating, then this is a great place. The place died down around 1:00 AM and people we being sat right away. We got melon and mango sheesh with s ice hose. It was delicious and got great pulls off it. Overall: Good one time stop, but won't go again unless it's after midnight or before 9PM.",Aladdin’s Hookah Lounge and Bar,6153293558,5 reviews,2015-03-15,"Falls Church, VA",/biz/aladdins-hookah-lounge-and-bar-nashville,3.0,45,"Nashville, TN",Melissa C.
"2206 Elliston PlNashville, TN 37203",4.0,"First time trying hookah, we went with our favorite couple one weekend. It's very small and tight in here. We sat at the bar while waiting for our table which didn't take very long. Food and drinks were decent. A belly dancer came around to perform. Several flavors of hookah to choose from. We opted for the ice tip (I think that's the name). But I noticed that the coolness of the ice didn't allow us to blow out huge puffs of smoke like others. A guy continuously came around to make sure our coals were fresh (sorry, I don't know the appropriate lingo). All had a good time!",Aladdin’s Hookah Lounge and Bar,6153293558,107 reviews,2014-08-25,"Plano, TX",/biz/aladdins-hookah-lounge-and-bar-nashville,4.0,45,"Nashville, TN",Valencia J.
"2206 Elliston PlNashville, TN 37203",4.0,"Went here because it was well reviewed, and it was the worst hookah experience we've ever had! We all had one mediocre drink we didn't even finish (since it's a one-drink minimum per person) and we weren't even able to finish the house special hookah as two of us started to feel extremely sick. Ruined our nights....It was not a great atmosphere- almost no space between tables, uncomfortable for any intimate conversation, strangers kept jumping into our conversation. But it might have been worth it for the affordable hookah had we not gotten sick. First time in several years of going to hookah bars any of us has had a bad experience. Don't know why this place is so well-reviewed.",Aladdin’s Hookah Lounge and Bar,6153293558,6 reviews,2014-12-08,"Nashville, TN",/biz/aladdins-hookah-lounge-and-bar-nashville,1.0,45,"Nashville, TN",Elizabeth L.
"2206 Elliston PlNashville, TN 37203",4.0,"Beer, a well-packed hookah that burned for 3 hours and falafels for 20 bucks.  A little run-down inside but exactly what we wanted.  It turned into a bit of a sports bar too, with the playoffs on, and a hookah.  Great place.",Aladdin’s Hookah Lounge and Bar,6153293558,31 reviews,2015-05-10,"North Charleston, SC",/biz/aladdins-hookah-lounge-and-bar-nashville,4.0,45,"Nashville, TN",Eric M.
"2206 Elliston PlNashville, TN 37203",4.0,"Unattentive staff and the selection at the bar is beyond terrible. The ""full"" service bar couldn't even manufacture a blended scotch drink to save their lives!",Aladdin’s Hookah Lounge and Bar,6153293558,17 reviews,2015-07-17,"Suwanee, GA",/biz/aladdins-hookah-lounge-and-bar-nashville,1.0,45,"Nashville, TN",Ankit V.
"2206 Elliston PlNashville, TN 37203",4.0,"Really nice place with good food, great hookahs, nice service!! Strongly recommend it !!",Aladdin’s Hookah Lounge and Bar,6153293558,2 reviews,2015-04-23,"Nashville, TN",/biz/aladdins-hookah-lounge-and-bar-nashville,5.0,45,"Nashville, TN",Ingrid I.
"2206 Elliston PlNashville, TN 37203",4.0,"I never would have thought that I would consider Aladdin's my ""Cheers"" of Nashville. They have the nicest servers who all have somehow remembered my name and go to drink considering how many regulars they have. The manager is even nicer and he is constantly making sure everyone is comfortable. Also, they have some of the best chicken wings (I know, very random) in Nashville. I highly recommend ordering Aladdin's combo!",Aladdin’s Hookah Lounge and Bar,6153293558,10 reviews,2014-09-24,"Nashville, TN",/biz/aladdins-hookah-lounge-and-bar-nashville,5.0,45,"Nashville, TN",Patrick S.
"2206 Elliston PlNashville, TN 37203",4.0,"I came to Aladdin while visiting Nashville for the first time. My bf and I searched Yelp for a good hookah spot and we saw that Aladdin had good reviews. One of the main draws is their happy hour where they have hookah for $8, as well as very inexpensive beer and wine specials.Bf and I had the mango and mint hookah with an ice hose. It was great! The pull was clean and the flavor was good. I was also blown away that they offer hookah with fruit, since it can be difficult to find. Between the hookah and the IPA beers, we left Aladdin very happy. We were upset that we didn't find it sooner during our trip.I would be remiss if I didn't also mention the diverse crowd at Aladdin. It was nice to see that. Whenever I go back to Nashville, I will def return.",Aladdin’s Hookah Lounge and Bar,6153293558,4 reviews,2014-06-11,"Atlanta, GA",/biz/aladdins-hookah-lounge-and-bar-nashville,5.0,45,"Nashville, TN",Alara K.
"2206 Elliston PlNashville, TN 37203",4.0,First real lounge I've been to in Tennessee. Everything is wonderful with this place. Wish I could live closer,Aladdin’s Hookah Lounge and Bar,6153293558,8 reviews,2015-02-26,"Smyrna, TN",/biz/aladdins-hookah-lounge-and-bar-nashville,5.0,45,"Nashville, TN",Christopher C.
